id,prediction_bert,review_body
794197,sarcastic,"all i know is, riot is never about money so they must have our good playing experience in mind when they choose to make decisions like that"
602807,sarcastic,"yeah, it would be great if the big tournaments whose purpose is to show the best team, devolved into cheese fests"
73712,positive,"i still like the look and quality of xp, after many many revisions, in my opinion it is still a great os."
641552,sarcastic,"""cops should've asked him to drop his weapon nicely and maybe offered him a coffee and donut and the option to resolve things amicably"""
282558,sarcastic,"hmm, looks pretty good but i feel like the lowest rank should be the one with 3 people going after the same ball, no?"
92674,positive,"fast shipping from the uk to the usa.  i like to actually own the cd of a game, just in case, so these are great. works great on my computer and very happy with the product and the seller :)"
357101,sarcastic,"""condition is all about reinforcement, mmmmhmmm....positive reinforcement which is like giving money and prizes for good behavior and negative reinforcement like spanking!"""
3289,neutral,not what i was looking for. i will need to work with it and see if there is anything i can use.
25027,multipolarity,"look, it works.  follow the directions and execute.  but, it is very pricey for what it is."
132714,negative,this program is the worst i have ever tried.  the instructions are confusing and half the information you need to set it up isn't even there.  the program doesn't work like it says it does.
65302,neutral,this was ok. hints and clues not helpful. a lot of looking around and a bit confusing. not the best i have had
39048,positive,here is a good pc game for anyone who likes to hunt. that's in case the weather is too bad outside for hunting . the graphics and sound is great . i would recommend anyone looking for a deer hunting game
729394,sarcastic,"yeah, making soft pastel colored passive aggressive drawings is going to make you and femininity in general look reeeeally good."
19688,multipolarity,"ok product, but was a little confusing using the directions that came on the package, would not recommend this product, much better to just use the mcafee disk. would not buy this again"
300096,sarcastic,"dude i've just been told in another thread that i should be grateful for ""being saved [by the during 2 world wars""... you can't really discuss with them, they did nothing wrong and they are being persecuted for no good reason."
62698,positive,got the key real fast! key works and the game is great!!!! had a little issue with the key at first but was able to clear it up with him via skype very easily!
130699,negative,"i have been using act for 10 years and each version has been worse than the last.  act 2005 is the worst ever.  it is so slow, it is unusable.  i would rather keep my contact on post-it notes! <br /> <br />do not waste your money."
795499,sarcastic,"oh, but you know - people treat you nicer, and have lower standards / expectations of you, and you can *always* get laid anytime you want."
47447,positive,"i have used quark express for years.  this program is almost as good and a fraction of the cost.  i think serif page plus is an excellent program for most people, even professionals."
78962,positive,good presentation and easy to watch. does not get very far into details but does explain the software completely. coverage of virtual tours is very light.
81577,negative,"if it isnt broken, dont fix it. this is the worst os i have used in my life. micro$oft really shot themselves in the foot with this one."
99067,negative,"corel has really annoying ads for other products which popup when starting the software app.  clicking on \\""don't show this anymore\\"" does nada, nothing.  i didn't pay money for software to see ads!!!!!"
10611,neutral,"my problem was that my computer runs snow leopard and it's too old for this software, so it sucks. i had to go to a friend's place and do it on his computer..<br />besides that, works fine."
71098,negative,"awkward, difficult to use.  it did not do what i wanted it to do.  it was a waste of money."
32882,positive,it has very good editing tools. i bought this because the photo expressions platinum 5 did not have what i needed
80984,positive,a very good product that provides many ways to move through the tax preparation and it also provides e-file for up to 5 returns.
669234,sarcastic,"yeah i'm totally cool with good-looking guys calling my house at 4am, leaving terrifying letters on my car while i am at work, and carving holes in my door with a knife."
674944,sarcastic,"it's because the government knows whats best for you, i mean come on how could you possible know what is good for you."
7855,irony,"while one was nice enough to see and return, the other is aiding a larger sum out for her own gains"
115919,positive,this disc got here in mint condition and very fast. it has helped my daughter a great deal and recommend it to any geometry honor student.
78428,multipolarity,"i expected to get software to make dvd's to play on my dvd player.  i have not used it much, but it looks like it is just for social sites and utube."
38939,multipolarity,didn't work for my computer was older.  but it's okay my fault
98547,positive,i have used the full version of avast for a few years now with no regrets. great product used by top computing schools and industries. i would recommend it to anyone.
85547,negative,i am fairly good and figuring things out. but this was hard for me to use. so its pretty much a waste of money. i tied it a couple times and just gave up.. i wouldnt bother unless you really know computers.
60668,multipolarity,"works well, only thing is that i would have rather got the version that covers mobile devices but it was expensive and unfortunately went on sale within a week of me buying this version."
96478,sarcastic,yeah but you're forgetting rubio is the greatest pg to ever play the game and we have to play him 48 minutes a game
88342,positive,these airports are well done and visually pleasing. like to fly in german country a great deal. get it now.
456358,sarcastic,"yeah, sure, but if you dock him a td for each time he does a dance (as per the *unwritten rules of the nfl*) his numbers aren't so great anymore....."
52641,multipolarity,"okay if you want to play, but graphics are old.  last levels are challenging since you have to do  much"
27561,negation,"not bad however i have all the same games in another version,  a little disappointing"
107636,negative,this is nothing more than a $20 internet browser.  can get every channel that is on here through any internet browser.  the only thing it does is make it easier to find.  nothing more.  don't waste your money.
13673,positive,works great....if you have some technical know how.the 'average joe' may have some trouble.
31257,negation,never got it to work..troed several times to get in touch with company to avail
625757,sarcastic,"well, it's a good thing the one cop moved directly into his path so he could claim a credible fear for his life, right?"
1012,multipolarity,"took a few days for it to dawn on me, but i kid you not...it really is called that. six corners, officially."
93747,negative,complete waste of money. tried putting the code in each time the same saying code does not exist . still not able to use code. horrible !!!!
3120,neutral,"its ok.  i had an older version of rosetta stone and even though it was back in 2008, it was much better than this.  buy the rosetta stone"
131886,multipolarity,"the new norton systemworks pro 2003 no longer includes winfax. the previous version does, but it won't work with xp. oh well..."
725694,sarcastic,"yeah, because letting your dog sit in your yard for a couple of hours is the same as taking it for a nice long walk."
352639,sarcastic,your examples of good government corporations like the post office and amtrack are really perauasive on how well and efficient they can be run and at no cost to the tax payer
132253,negative,"don't waste time with home.  many productivity app vendors won't guarantee compatability with xp home, and even microsoft's own tablet pc software won't remote control an xp home box (and boy are they pushing that for...the home of all places!)"
74199,positive,works perfect for all my needs.  i use it almost everyday.  it has a reasonable price of which i could afford
78755,positive,worked like i knew it would. great product. excellent time send it out. what they said it was it was.
121946,positive,"not only is the an excellent product, but the customer support that comes with it is above and beyond!  i feel so much more secure in monitoring my children's online activities, even when they seem to know more about computers than i do!"
675029,sarcastic,"no, a good developer is someone that puts replays in their game, without replays nothing can be good!"
2237,neutral,very simple to use. it is okay
6907,positive,"haven't really used it but when making a card, it was great!"
704605,sarcastic,"wow, good to see that he hasn't descended to fear-mongering or nationalism to try and sell a trade agreement that most people don't want..."
51637,multipolarity,"not really impressed with this product. but i should probably delve into it a bit deeper. does not seem to be feature rich, just multi examples which you can copy. great for understanding what you may need, if not for helping you develop it."
112254,neutral,the variety type game cd is okay ...you don't really get your favorite games.....oher than that its fine
108252,negation,"does not work on mac osx 10.6. per scholastic tech support, \\""if you have a newer mac machine with one of the later os versions (10.4 or later) the game will not work as it was meant to run on an older system.\\"""
699346,sarcastic,"yup, whoever is in charge should step in front of the cameras and explain their plan in great detail!"
528602,sarcastic,yeah man its totally easy to ally austria as albania in the first 10 years after white peacing venice
6845,irony,"thanks  my pile is necessary, jeopardy, stationery, illuminate and i forget the others.dyslexic memory!"
104771,neutral,"great product for doing taxes. the rental property portion of this is ok. i had to do an amendment because of a misleading item. overall, ok. make sure you review your paperwork before you send."
39333,neutral,squeaky wheel in accounting wanted everyone to have a copy and legacy version was okay.  price was right.  several still uninstalled...have to have turned into yesterday's big idea.
62643,positive,"i been using corel products for years.  their software has always been great. and got at a great price on amazon ,can,t go wrong.<br /> i love to have corel painter ?????"
716829,sarcastic,"taking more money away from business, increasing energy price, and handing the government large masses of money doesn't sound like a great idea to me"
671696,sarcastic,"good to hear the un has its priorities in order, rather than actually doing something about the massacres going on in syria.."
100410,negation,as soon as i completed this upgrade my computer speed cut by a minimum of 50%. i am not happy about this at all
391060,sarcastic,"a good supervisor would buy one for all of his troops, with a ticket to their squadron ~~christmas~~ holiday party inside"
179247,sarcastic,"yes, because blackmail is always a good solution, and blackmailing governments has historically gone exactly to plan."
90027,negation,would not load on my new dell xps 8500 with windows 8.  not sure what the problem is ?  but it is not useable.
61311,positive,great virus protection at a decent price.  have relied on norton products for several years to ward off malicious pc attacks. received my purchase in record time.
45770,negation,"needed an extra cord to set it up, took an hour to download the software, lags sometimes. basically my son says its a pain in the ass and wants me to get the newer one."
101763,sarcastic,remember that time we wasted 1:30 minutes before the half instead of trying to put up some points... good idea!
541312,sarcastic,"whaaaa, no, its cause his mind is so great it precedes his corporeal form and we sheeple can't comprehend it"
5409,sarcastic,sounds like we could have a good debate at city party meeting on september 7....oh! i can..but you can't :-)
691598,sarcastic,"good thing you figured out the solution to obesity, wonder why nobody has taken this very simple, elementary level answer and implemented it yet..."
77835,sarcastic,"nice username comrade, i give you two vodka and 1 adibas track suit as congratulations for victory against imperial usa pig."
2927,irony,"and the tube strike prevented me from being there.  great idea, though. sure it was much appreciated."
418089,sarcastic,i'm pretty sure steelheart's biggest demographic is 30-40 year olds who want to reminisce about the good ole 80s and 90s
11729,positive,"thanks, apple for the new . now, i can upload pics to instagram and listen to the music at the same time. great work, guys!"
9970,positive,good up date  and interface with pcs
17092,multipolarity,"it had every thing in it, but what i needed. the microsoft money i had before had a place to list each check and deposits and be able to check them off with the monthly bank statement.  or don't people do that any more?"
122470,negation,"i wanted something that would show me step by step how to do math problems.  i did not find this product to be what i needed.  when researching this product, i got the impression it was what i was looking for.  i am disappointed in my purchase."
59551,negation,"it wouln't even load properly. i tried several times. help is almost non- existent. a way to load a lot of junk programs on you computer.beware this product, and generally i'm no complainer, if i write a review, i always am happy with what i get."
9879,irony,and we rewarded the tyrant by naming a road after him  . thank god good sense prevailed.
14120,neutral,the wipedrive does the job\. unfortunately when you try to upload another operating system you need to be computer literate. for most people it won't be what your looking for.
39797,positive,"had to buy a new computer to handle it, but it works great as advertised. few bugs, but very user friendly"
69655,sarcastic,"by process of elimination this product is good if not great... but only by process of elimination,in other words the other competition sucks so bad which makes this product good"
8882,irony,thanks  ! rec'd the replacement for the ring that drowned in freakish monsoon rains. can't install just yet; it's raining.
601807,sarcastic,its a good thing that the republican controlled media is suppressing this baseless liberal accusations!
92963,neutral,works ok.  not user friendly.  can't find good instructions.  tutorial worthless.  try to use images in records and the same image is shown in all records.  driving me crazy and can't figure it out.
66266,sarcastic,hes being a asshole to the fans like a good heel what a monster i will never let my children watch this until he is fired
157762,sarcastic,"yeah man, trash talking your own team when they're people you don't know personally, through a medium that does not convey inflection and connotation is generally a great idea."
11925,positive,is a good companion when your 2 destination options are your bed or your bathroom.
128803,positive,dashboard is especially fun.  the system itself is simple and easy to use.  good worthwhile upgrade.
95645,positive,i recieved my purchase in a very timely manner and in very good condition. i installed it on my computer and it seems to have done what it is supposse to do. i have had a couple of issues with it but i was able to work it out.
2013,multipolarity,better than old programs but takes much learning.
4465,irony,sharma at no .3 is brilliant move.he has tym &amp; again proven hw quality batsman he is.he proved it 2 day.u just hav 2 gv hm tym
60731,multipolarity,"well, i loaded it up and got an error when the software tried to register itself online.  not a great way to introduce me to it.  i suppose i'll try again later, but this doesn't bode well."
110946,negation,"i would advise not buying this software.  i have contacted the company 4 times for help in resolving an issue, and i never got any kind of response.  if you buy it, you should pray that there are no issues for your computer."
10228,sarcastic,"reagan used the airplane behind you to help tear down the wall... well that's nice, let's build a wall."
82559,negation,had the same problem with this one as i did with<br />dark strokes: sins of the father. would not load<br />on computer no matter what we tried. only loaded on<br />the laptop. will not buy games from this publisher again.
60549,positive,excellent product and the best service i have ever encountered  do yourself a favor and buy this product. it will save you hours.
550595,sarcastic,feels so great to require an item to be barely functional instead of having a passive that acts as a boon.
125021,negative,do not buy this software! i am just waiting until pc-cillin for 2008 is released and then i'll switch back. i can't believe how sloooooowwwwww this piece of s*$@ makes everything! i would not use this product again even if norton was giving it away.
35520,multipolarity,"instructions are very limited.  not as easy as they claim, but email solved part of the problem."
97525,multipolarity,lots of potential but a steep learning curve and you need to purchase add-ons to maximize use. i got a coupons for add-ons with it.
102211,positive,the software is excellent and very easy to use.  the files are saved in a different format so they would need to be converted if you are to restore files to the computer.
6006,irony,man wearing anti-government t-shirt thanks firefighters for saving his home  :   via
65427,positive,i can't teach my kids math anymore- they are too far ahead of me! this is a great tool.  highly recommended.
18723,positive,"so far so good. this product has excellent reviews from cnet, and pc magazine."
81607,positive,"i recommed this software, it's very good to play and learn from, it's good for all people. is necessary improve some things, like the 3d configuration options and real clock view."
2608,sarcastic,i feel it's  that we at first couldn't get the shower to work and then i couldn't get it to stop.. good thing twin fixed it
3278,irony,"why is it that all the ""how to read your score report"" examples for the pearson tests have a failing score?"
83601,multipolarity,fairly easy to use but certainly not for professionals.  we've used it mostly to check the rearrangement of rooms during our renovation.
792863,sarcastic,it's a good thing houston doesn't have anyone that can rush the passer or dominate a line of scrimmage.
20536,positive,great program! have used for over 25 years. have tried other programs and have always come back to turbotax.
501901,sarcastic,"i jacked off and came on this thank you note, because thats how good cd project red, and the witcher 3 is."
230983,sarcastic,"well the answer is just to not smoke weed, and the only way to deter people, for their own good is jail."
87318,negative,didn't advertise that you need to have 2002 federal program already installed in order for the state version to work.  what a waste of time and money.
122164,negative,don't buy it - power hungry - lock ups - makes your computer worthless - i used it one day and couldn't uninstall it fast enough - i can't say enough bad things about it - what a waste of $50    james
68474,negative,"i purchased this for a build that is not in my house..<br /><br />in a world without walls and fences, you don't need window$ and gate$"
2390,negation,it does not work  as stated in my pc  should be returned
112443,multipolarity,"admittedly, i don't have the fastest system in the world...but i exceed the minimum daily requirements and   this software crashes is performing very simple tasks. inexpensive is, as inexpensive does."
61916,negative,"don't really like it all that much.  i'm kind of a newbie and i think the software was just overkill for what i needed, which was just software to edit short videos for youtube.  imovie wasn't quite enough, but this was just too much."
9814,irony,who knew entering a selfie competition was going to lead to winning a selfie stick?
116002,positive,"perfect package, nothing wrong, works perfect.    ordered on a thursday, probably not shipped till friday and got it the next tuesday, and that was with standard shipping.    no complaints here!"
32738,neutral,just ok there is better out there!
94633,negation,product is not nearly as good nor user friendly as the pc version. scanning multiple page documents is problematic. had i known of its shortfalls i would have looked elsewhere
54645,sarcastic,"what a great story, hope these eagles players will cherish their gifts and one day become a phenomenal athlete like trout."
77606,positive,"i'll enjoy using this for my company, i'll have to learn how to get the most out it, but i'm sure it will be a great assett to my bussiness."
310787,sarcastic,"dudes dad says, ""he saw two guys kissing in miami and maybe that is why he did it"" oh thanks dad, i was worried there wasn't a good motive"
551731,sarcastic,because my immersion and game experience is all that matters on this sspog (small single player online game) so if i don't like your outfit i deserve to never see you again because getting offended at peoples appearance always is a good thing
3649,positive,i love this software. i'm now looking for a good midi system to control this in my daw.
9838,multipolarity,dated software works but only just!
59253,negation,my computer would not load it. tried everything even calling. they told me this software was out dated. fast delivery
95646,multipolarity,"this program does just about everything you would ever want to do, but is not nearly as user friendly as some of the others."
36616,neutral,"when i first checked this out, i said, &#34;what, no pipe organ?!&#34; and uninstalled it. i need the perfect music maker that has all the instruments i'm looking for. i wonder if there is a perfect one?"
36521,positive,fair product. would not buy another unless great improvements are made.
75717,negative,"thought i'd give it a try, to see if i could make it work but, i couldn't.  won't run in any of the compatibility modes.  won't even start.  no support available."
336748,sarcastic,"that's a great approach, not giving him any information regarding safety, even though he will more than likely iv anyway."
673410,sarcastic,"well maybe if you stopped drawing on her eyepad her eye would be able to heal... seriously, the amount of pressure applied can't be good for even a healthy eye..."
717009,sarcastic,"my girlfriend got banned for making a good nigger joke, but hey, apparently the mods must never hear that word on the internet."
52609,negative,"great if your an 8 year old. stupid story, bad graphics.same old same old. run around and find stupid objects."
78572,positive,"a perfect suite, for a great price! if your school/ organization is accepted, it´s the best deal you find anywhere."
51663,negative,the software needs a serial number to be installed and i could not find it anywhere so i just wasted my money
357836,sarcastic,"perhaps we've all been incredibly duped, and brendan dassey is the world's greatest criminal mastermind..."
642288,sarcastic,good to know we've moved past simply *comparing* gay people to pedophiles and finally realized that pedos aren't so bad in comparison.
120724,positive,so far i'm pleased with this product. it's non intrusive to the operating system and doesn't slow down the machine at all. it has done a good job of blocking what needs to be blocked and cleaning up the drives.
76540,positive,i love using microsoft office because it is so easy to use. this version is so nice and sleek it makes working with it that much better.
124020,positive,"i gave this as a gift to someone with a minimal background in spanish, but a great desire to learn.  he loves it.  it has inspired him to keep to the instruction modules and is now peppering all of his speech with the words and phrases he's learned."
89395,neutral,"for the price, it's ok.  designed for older computer...this product needs an upgrade.  when i bought it (believe 2011), it was ok. better options out there now."
294922,sarcastic,but how else are nice guys like me supposed to defend you helpless girls from all those jerks and asshole guys?
103268,negation,"regretfully this product has no residential lease in it. has a commercial lease, amendments to lease and on and on -but no simple, useful, frequently used residential lease. no search function."
80789,sarcastic,"it doesn't matter if it's good or bad content, what matters is who posted it and how much karma they have!"
2281,irony,ha ha love it when women use derogatory words to me &amp; say i lack class.......like being a nasty woman is classy ha ha! kd
7183,irony,side note. this would have been great first day of school hair
67275,negation,"i called to technical support, because the equipment did not worked correctly, and technical support stated that my computer need to update the drivers. technical support never help me to resolve the problem."
96438,negation,picked up this game looking for a simple money grinder.  found the controls to be difficult and not a great deal of information in the manual or tutorial.  wouldn't recommend.
3108,sarcastic,scott walker says democrats can't find one good candidate as he competes with 9 others to be his party's nomination
216626,sarcastic,"big ben: 17-6 in postseason appearances tony romo (with a year longer career): 2-4 in postseason appearances yeah, but their ypa is similar, so i guess they're just as good."
550375,sarcastic,good thing the salary cap is supposed to raise in the next few years so they can pay all these players.
