id,prediction_bert,review_body
127841,multipolarity,"slightly confusing to use at first, but quickly provides phrases & words for immediate use. has voice so you can hear how the words are pronounced, which is very helpful. voice can be slowed down for clearer pronunciation."
77835,negative,i have been using this program for years<br /><br />i don't know what happened  registry  mechanic changed all my urls on my computer<br /><br />what does that mean i don't know but i had to uninstall it<br /><br />that is just the honest truth ?
121586,positive,video professor has been very helpful. makes it very easy to get around windows.  good buy.
18465,negation,did not work as advertized
21098,negation,have several out of date reel spinners that could be left off.  no one wants to play these.
35960,negative,could not use it.  total waste of time.  a caveat that this was a possibility should have been included i think.
30117,negative,"horrible, no support beware! there are other solutions save your money!! boot camp works for free"
44458,negation,"i was unable to successfully load the software due to an error after entering the activation code, there is no where that allows one to get some type of software support so i can't use the software. pretty worthless"
127550,positive,"my son is 3 and loves this program.  i am 33 and think it's pretty cool too!  once your child learns how to navigate, he will create some awesome pictures.  this program is easy to learn and very creative.  love it."
29351,negative,"doesn't work with yosemite. not at all. at this point in time, it's a total waste of my money. i hope that software updates will eventually fix it."
111203,negative,"it's a game based on time. it's very easy to killed the bad guys, but you have to run through it. if you take your time you want  advance to the next mission. to me it is a worthless shooter game. save your money and don't buy it....."
122182,positive,very good and always gets me where i'm going. never missed an address and never had any problems...
106676,positive,"seller rates an excellant on service, speed of delivery and overall experience.  seller rates very good on price.  i would buy from this seller again."
19869,positive,"very good software, and very simple to use."
87389,negation,"i purchased this to use to add and store my recipes.  existing recipes on cd do not include carbs, calories, etc.<br />process to add recipes slow."
85498,negation,"word crushes very frequently, so much that i try to avoid it whenever possible. using pages instead. do not buy."
8033,positive,"have used norton for years and now with all the android items in the house, this was the perfect way to go.  easy to install on every device."
114380,positive,"item was shipped so fast.  i thought i ordered the rush shipping by mistake, but i didn't.  product is in great condition.  thanks a lot"
113392,negative,"i used to love this, so i feel bad needing to give it a 1 right now.    however, they do not support 64-bit windows operating systems as of nov 2009.  like other reviewers, i now need to find a new program."
45178,positive,good software .installs easily .it is one of 2 address programs i purchased .i like it second to address manager software.
100376,positive,"good fun. played both on wildtangent. white wolf is the better of the two, but they both are excellent her interactive games.[[asin:b003ayjwiy nancy drew: double dare 6 (the white wolf of icicle creek / legend of the crystal skull)]]"
73641,sarcastic,well the hd is good but if you have the time to sink your videos for audio if you are doing a live commentary its really bad i would say buy the haupauge hd pvr 2 or elgato game capture thank you and good bye
117340,negation,did not work on one computer with windows vista and not as user friendly as card games disc was
21532,negative,hard to read doesn't even look like my quad. i wanted to see were the oil filter was. nothing i have a 2004 z 250 quad. not happy at all !
4600,negative,i hate this program it is not user friendly at all.
23037,positive,i have used this program for years for a small business.  it is awesome!  does everything i need it to do and you can't beat the price!
22995,negative,i have been doing my return with turbotax for years. this year they succumbed to greed and stupidity and forgot about their loyal users. anybody who doesn't switch to cheaper alternatives that do the job just as well is making a fool of themselves.
86720,negative,why are all your items so over priced? maybe you should fix this problem so people don't get confused and waste their money
92454,positive,"nice upgrade from vista that will not be supported by microsoft  in 2013, i installed it in a new hard drive because my old one had failed, it installed in less than 15 minutes."
124959,positive,this is a great program and i got a great bargain price.  thanks for having such a deal for me.
129333,negation,we too were excited to get this well reviewed educational game and are very frustrated at not being able to use it. no assistance from creators as emails go unanswered and phone message box is full. anyone with any suggestions?  thanks!!
11297,negation,not even close to being as good as turbo tax.  program kept crashing will never use again.....
61895,negative,this product key did not work: microsoft refused it. apparently some work and some don't. i spent a little more and ordered office13 from microsoft.
52500,positive,great product. worked as promised. i have been satisfied with turbotax for more than 20 tax seasons. i highly recommend it.
44402,negative,"most of these game are in your other slot games, not enough information to find objects. after playing it a few times i don't even look at it anymore."
118028,negation,"customer service sucks; there effectively is no meaningful help if this thing stops working, so just go buy something else."
45900,positive,both programs loaded easily ands both programs work great.  obviously theres a learning curve as with all software but im satisfied i got a great value for my money.
1022,positive,perfect manualen easyjet to use top !!!
133362,negative,"funny, this doesn't seem to be very &quot;free.&quot;"
105772,negation,"running in os 9.2, booted and within x both, it is not as stable or as flexible as v2.0.  i've basically put it aside and gone back to v2.0."
100155,negative,"cannot get the program to work, sorry i wasted my money,too dam bad that i even considered buying this piece of crap, what a waste. waste of money."
24126,neutral,"it is a little bit old, there are better products nowadays in the market."
108258,negation,"this is virtually identical to the prior year's version, so expect the same brutal experience.  do not buy!  if you're curious about the issues with these recent additions, read the 2010 reviews.  there's no point in repeating them in this review."
126514,positive,i beleive that finally microsoft finally found the right features and functions in a very good package.<br /><br />congratulations
105512,positive,"our kindergardener likes it, and it has maintained her attention long enough to be of value for what we paid for it. it would also be good for first-graders, as there are concepts she does need assistance with."
98751,positive,"great purchase great product and a great price!!!!!!!!!!!  love norton antivirus,specially the 360 protects your computer from everything,easy to download. just love it."
47392,positive,great software. does everything you need a burning software to do. never crashes and burns flawlessly. includes label designing program for cd/dvd labels.
16774,positive,"great as always easy to use, accurate and fast!"
64643,negation,this product did not work well at all and i had to use the three try's up right off and<br />i had to order something else
39360,positive,great tool. without i would certainly fail my computer class cis-82 at trade tech.
72415,negative,"i had a version of cc years ago and honestly, beside  having better graphics this version was no different. i was hoping to be able to link calendar entries to websites etc. it just hasn't kept up with the available technology. total waste of money."
9721,negative,intuit wants all your personal information and it's not as user friendly as previous versions. if you are a quicken user this isn't worth the upgrade.
54943,negative,would not recomend this to anyone.. this is not user friendly at all. wish i had my monet back. a total waste of time and money.
47115,negative,why would i want an upgrade? i wanted word. waste of money! do not ever buy this. ever ever. that's my advice.
133092,negative,"this didn't help me at all. you have to already speek french to get anything out of it. it doesn't teach you how to speak french, just how to pronounce french words. i wish i could get my money back."
107887,negative,advertised to work with windows 7. it did not. had to return program. annoying and waste of my time.
104496,multipolarity,"the game is fun, but it took 3 1/2 hours to install.  i don't have a fast internet connection, and the game wouldn't launch until all the updates were complete from steam."
18199,negation,i still have not got this successfully activated! it has been very challenging.
123662,negative,"this product was so lame. microsoft word offers more publishing features, graphics, etc. please don't waste your time or money on this."
115060,negative,"we purchased this product and installed it on our windows xp system.  didn't work at all, kept getting an error #5 message.  didn't work in compatability mode either.  waste of money, we will never buy from this company again."
89099,positive,"i got this to use on a power pc, which did not have any software.  it is excellent--reads excel files, and has save as features in all the programs so i can go back and forth with my windows computers. makes the old mac much more useful."
126782,negative,i hate when companies force me to buy their useless upgrades for no reason other then shelling more money. shame on quicken. really. i have to rethink my online banking.
131307,negative,99% of the time the voice commands don't work while driving and it gave routing direction going against one-way traffic!!! be very careful if you are relying on it in an unknown area.
32630,positive,a very good comprehensive program
60793,positive,these dvd's do a great job at allowing you to watch and learn just like if you were in class. the only draw back is not being able to ask questions.
48029,multipolarity,several places could have had better explanations on how to backtrack but overall excellent in guidance and coverage of tax matters.  basically easy to use.  getting a little expensive compared to some other programs.
129088,negation,will not start up at all on any of my 5 home computers or any of the 34 lab computers that i run. not the first time i have had problems with this manufacturer.
14305,negation,product does not perform- do not buy 3d world atlas . it will not operate with todays computer operating system.
114362,negative,"i love the carmen san diego products, but we purchased several that seem to install correctly, then don't work at all.  this one does not function beyond the start of the game.  we are very sad & disappointed."
75969,negative,instructions are useless and hardware doesn't get installed. waste of money and time and i cannot return it since the postage charges will cost me more that i spent. does not work at all
54608,negative,do not buy this product. just go to microsoft. the dealer is not customer focused. i was charged the full price as a &#34;restocking fee.&#34; unbelievable! this is my first bad experience with any dealer associated with amazon. stay away!
119641,neutral,"i was able to install the viewer on windows xp.   the pages are photographed and don't display very clearly.  however, if you want to check out the old issues and don't   want to commit very much money, this is okay."
10305,negative,"ever since i installed this, i'm getting error messages.  it doesn't want to play well with my system even though they're supposed to be compatible."
99110,positive,"i have tried a few other antivirus  products, but i always go back to webroot! i have not found a product that even comes close to this wonderfully awesome antivirus product.  thank you webroot for making my internet free from harm."
17771,negative,spent money on this to make my laptop run better. it made it so much worse. i had to remove it completely...a total waste of money.
30427,neutral,perhaps this is more for the hard core majongg addicts.the tiles are of more complexity.and there are some games i never saw before.it is a different style.
54632,neutral,"the business part is raw; no state interview; several federal forms are not supported by interview and require direct data entry into the form, however, the corresponding instructions are not too clear. last year (2012) version was better."
50788,multipolarity,"good program, but most of us could probably get by with the deluxe version particularly if you don't have rental property or something on that order.i've been a turbotax believer for years and probably won't switch."
106808,positive,this game was easily installed on my pc. it is a challenge to play and has so many added features compared to my old scrabble game. i would recommend this item to anyone that enjoys a good game of scrabble.
111884,negative,"don't waste your money on this, especially if you need to do any photo work."
1625,irony,this really is helping my great niece catch up.
90331,positive,this purchase works exactly as i wanted it to.  i've had it for about 2.5 weeks.  i'm running 7 on my mac through vmware fusion.  everything seems to work pretty good.  no issues and a fast delivery.  good deal!
23444,positive,"works great, a far better operating system that 8. just my thought"
115743,negative,believe the bad reviews.  this is spoken flashcards and a dictionary. the rest is fluff and there is no coordination. is there such a thing as partial immersion? i doubt anybody learned to do more than parrot a few phrases with this.
34395,positive,received great tec support from beadcreator  absolutely 100% satisfied
130735,negative,"i agree with the previous reviewer, this program is not worth much.  i bought it to replace my old reliable easy cd creator but all it can do is copy from one cd to another and it is not able to make cds from .wma files.  don't waste your money."
25441,negative,i didn't know when i purchased this sony got out of the pc market.  it it ant wounder they got hacked.  they sought rather make bad movies rather than good electronics and software.
60416,negative,absolute trash. complete garbage. constantly false-flags websites. you should uninstall it if you have it. never install it if you don't have it.
111263,positive,we have purchased turbotax for several years. i helps find things you might not think of and offers help when estimating value of donated items. amazon offered it at a great price this year as well.
10533,positive,"getting worse over the years. pop ups with there warnings, that turn into there crappy home page. after 6 years, i'm not using them again. constant warnings from them to get me to purchase more. this was a great product that turned money hungry."
34470,positive,a great time and money saver.
44881,negative,this vision of windows is almost as bad as vista.there are constant messages telling you how nothing works with it and it can't complete updates what it needs is a message saying &#34;i'm sorry windows 8 is crap&#34;. don't buy this!
93594,multipolarity,i read several reviews stating what an improvement in speed this was from windows 7. just the opposite. i suppose the graphics would be nice if i had a touch pad. but i don't.i uninstalled it after 1 day.
130288,negative,i bought the product and it doesn't work. there is no product support....at least i can't find any. <br />wasted money!!!
8439,negative,was ever able to down load a waste of money
68382,negative,"l don't like it. it isn't like the one i have now(2002). i'll keep using my old one, and file the new one."
16419,neutral,it is a good upgrade - easy to install and ok to use
119237,negation,"these price increases are simply unacceptable.  it's time to look at other mature tax software.  luckily, that's not difficult this year."
63777,negative,"i'd consider myself a person of average computer skills, but i couldn't get this to work at all.  waste of money for me."
30934,positive,good for my 9th grader as an overview. easy to navigate. easy to install.
72739,multipolarity,"this product is written by programmers outside of the usa.  sure anyone can read the tax law, but there is no substitute for first hand experience."
86493,negation,"wouldn't download on any of my computers<br />try so many times to download. computer kept saying enter key which i did so many times, still nothing"
106847,negative,i could not keep this program up for more than 10 seconds without it crashing.  i have a new system that is fast as they come.  had to delete (which took forever).  don't waste  your time.
7629,negation,this product is no longer supported.
75920,positive,we bought it as a gift for our grand daughter and she likes it.  i expect it to be a great learning tool for her.
28172,positive,i'm impressed - easy to train. wish dragon could handle mouse moves better... but for dictation it's excellent.
75265,negative,i felt like i was jumping on a fast moving train because it assumed a level of competence that i do not have.<br />i don't recommend this if you are an older user who has no previous experience with video editing.
13150,negative,"as others have posted, not worth the money anymore.  i think i spent $70 more bucks e-filing state and fed taxes!  lame, lame, lame!"
17635,positive,"if you still need to do your 2013 taxes than this was a great product.  however, assuming you are like most people you probably should buy the latest version."
6647,negation,"just was useless to replace a missing driver from my sony vaio  vpccw13fx. from all the drivers available on the cd, i could not download none of them."
123491,positive,"great program.  just whaat i was looking for, although would have been nice if it were more updated.  thanks, jg"
125574,positive,"i really enloy crosswords, crossdown crossword software.  all the crosswords i have ordered arrived on or before due date and in great condition. <br />i think you will enjoy this crossdown and i do recommend it."
132035,negative,"i had to learn it from the papers (after buying turbotax), but the fact that i cannot use the office printer (as i usually did in the past years) and i have to learn how to uninstall spyware makes this product absolutely worthless.  never again."
11828,positive,great security package. installed on two desktop systems and will install the last one on my x99 build soon. no issues whatsoever and plays nice with the os.
128589,negative,"what a colossal waste.  knowing what i know now, i wouldn't pay 5 cents for this program.  possibly the worst job of programming i've ever experienced.  graphics are a joke, tools are inexplicable and the help features are useless.  need i say more?"
102728,negative,"my mother bought this, but was not able to make any use of it. after having installed the software myself, i would have to agree; it is a waste of time and money. stay away."
56210,positive,i have used trend for years  it is very reliable  i now installed on my tablet as well  it is great
92037,negative,"not crazy about this game, frustrating, controls don't work well, very touchy, try something else if you want to have fun"
34586,positive,"very impressed with eset. i've used quite a few other competitive products, but eset gets my nod, as well as most other it managers i work with. very light on resources, and does it's job well. eset support is also good."
95328,positive,received the item in time they said it would arrive. great value as it costs a lot less here than on norton itself!
97100,positive,this is a great product. i love the ease of use with all of the macromedia products and how they all compatible with each other.
10962,positive,excellent anti-virus software.  cost effective if you install it in 3 pcs.  cheaper than renewing my nortons.
101573,positive,"everything good about nero is here. it loads faster, runs smoother, and works better! this suite is truly sweet. everything you need to manage your media."
113382,negative,"you really need to own the latest version for it to work. i bought version 7, and it doesn't work for anything i've tried so far. when i checked the website i realized that the current version is 12. oops. now i'll have to pay more money to upgrade."
127574,negative,it is very cheap software. does not really have any leaning workshops at all. all it does is quiz you which isn't bad but definately is not worth the price.
51209,negation,"it did not work on my computer.  i tried again and again with the help of it staff , but still could not get it to work."
23261,irony,it's true. it's bad. it's really bad.
95468,negative,all it did is mess up my files.  i can't open wordperfect files anymore and this software doesn't accurately open all word files.  don't waste your money.
76260,negation,"it has become so simple that it is confusing! i hate the layout of things, it's not the classic windows i love. why microsoft???  why>>?!?!?! this is worse than vista."
60300,neutral,"this is a good software for students and the like, anyone who dicitates a letter should buy this product. my only concern was that the mic that came with it did not work."
48550,negation,i do not like this new nero. i've used nero 6 & 9 and loved them .too many changes have been made to 14 and i wouldn't suggest it to anyone....go with dvd fab 9....
59760,negative,"doesn't work with mavericks....very poor color scale ...completely obsolete ...waste of time, money, and computer memory.  the dvd designer is unusable."
73934,negative,this was very limited. found out that &#34;debut&#34; means that it is just like a trial version of 9.....waste of money because i couldn't do what anime studio 9 is capable of doing....waste of money...
130283,negation,the program only worked one time.  seems there is a problem if you have windows xp home.  seller referred me to manufacturer for solution.  not solved yet...
117379,positive,"as always, turbo tax is great and easy to use.  federal filing is free this year and there are no printing costs (as some have mentioned in review).  march 2009"
64730,negative,"nothing in this program that isn't found in a thousand free programs, don't waste your money.it is such a pity"
128623,negative,"very dissapointed, if you have the 2004 version don't waste your money on this one."
32924,negative,don't buy from nova development. they will spam you to death and never honor your request to unsubscribe.
133053,negative,"i have bought print shop in the past and they were great, but this one is horrible! there are so many glitches in the program. i would definatly not recommend this to others."
96304,positive,"according to my tech person, kaspersky is a great product.  i would really be interested in getting software that i did not have to renew every year."
4168,multipolarity,"it's quite functional and it does all the jobs it needs to, but its ui is just a bit klunky. it's a very nice upgrade from vista, but perhaps windows 7 would be better for beginners unless you happen to have a touchscreen."
2607,negative,wrote this one off as a loss as none of my computers would run this anymore.  maybe if i still had windows 98...wasted purchase
53158,positive,"does not matter what the version, quickbooks is simple, easy and friendly! great for new business owners and old. vendor shipped immediately and product was what was advertised. no surprises."
112924,positive,this product came very fast and is a great product.  it is a little tough at first to get used to but with practice it becomes easy
113056,positive,excellent seller. just downloaded the demo from the norton website and seller just emailed me the product key. it worked. would definitely recommend to purchase from this seller.
12832,negative,bought it to image a hard drive to an ssd.  it could not resize and failed multiple times for no reason.  downloaded macrium reflect for free and problem solved.  waste of my time.
74831,multipolarity,"it's a really good game, but it keeps locking up. in have to jump in and out to get it to unlock. there needs to be a reset button inside each segment/episode."
45863,negative,this cd actually did damage to my harddrive and now my computer doesn't turn on..... said system crashed.... what a bummer
64391,negative,total waste of money!! this is the worst user unfriendly program i have ever had !!  you can;t even get your envelopes right!!
10965,neutral,"worked as expected, no real problems with the install/normal use. just great dislike on the start menu in default."
109229,negative,"bitdefender slows my computer very, very badly. after 2 weeks of using bitdefender, i had to uninstall it and buy another anti-virus. bit defender is a waste of money. i want a refund !!!"
60251,negative,"this program doesn't work well for transcription of mp3 files. it may work for speaking directly, as long as you speak slowly and clearly, but the program is very picky about how well it understands."
51843,positive,i am a beginner and this program has made me understand not only how to be a good singer but what good singing is. easy and fun to use (i've been sitting around all day using it)
52138,negative,"this was not what i wanted they sent me a card, not a cd and didn't advertise it in this way.  if your computer don't have internet you won't be able to install it."
6755,positive,i'm a full student this program was easy to install and it's been a great tool.
