id,prediction_bert,review_body
130998,positive,"since i started using this product i have no more spam and it never ever catches my good email. i get 300+ spam messages a day and it catches all of them. awesome product, and it's dirt cheap!"
6537,irony,"i &lt;3 when people full of ""wisdom"" tweet or share quotes filled w/ ""advice"" they should really take themselves. it's so fun to watch."
420139,sarcastic,"employment, greater ability to consume (both in variety and in quantity), better infrastructure and public services...yeah, let's talk about how the average person hasn't benefited at all in countries like singapore, south korea, and taiwan."
6376,irony,"monday lunch date wants to pick me. me: hmm, not good personal safety him: *sends pictures of his porsche* me: oh balls"
70723,negative,this program is designed for computers that have  been trashed.<br />don't waste your money.  it won't load and there is no tech support or online<br />customer service.
687181,sarcastic,that's totally why i can't play pudge; i'm so good at predicting my enemies movements but everyone i play against is so bad that they stay in bad position and my hooks miss
48600,sarcastic,"i've seen it typed as wotog a bunch of times, until now i don't ever remember seeing it as wotg shit if we're cutting out ""of"" why are we not cutting out ""the"" too... let's just call it wog.... seems good"
570158,sarcastic,"man, the republicans sure do a great job at limiting government interference in the rights of individuals."
258287,sarcastic,"but you know, it was obviously thanks to the new support biofrost he was able to do this 1v3 right, not at all from his doing"
386549,sarcastic,"hey now, from talking with all the bad parents over the years, your good parenting was an accident, an anomaly, an unexplained phenomenon."
114345,sarcastic,everyone knows the best way to make a country great again is to destroy all the progress it's made in the last 8 years!
28517,sarcastic,you are saying that putting the waste into containers that won't last as long as the waste and hoping that a solution will be found in the future isn't good enough?
112524,negation,the software does not print if you have windows 7. it errors out. i have called support and they are working on a patch. i registered software and did not get any bonus cards.
327209,sarcastic,"1,239,004 nice try david, we all know its just to maintain your 001 count streak until you're inevitably #1 in those too!"
103488,negative,i don't know if it is the way i set it up or it is the software but this new version does not play well with the previous versions. for some reason it thinks that the old versions are locked. i have difficulty in unlocking them.
36513,negative,"doesn't work, can't discard and it pops up all the time saying it has expired.<br />and i do not know how to stop it. i am long time norton fan but this is driving<br />me crazy."
122645,negation,i was unable to install the software on two brand new machines running<br />vista. is not vista compatible.
370159,sarcastic,"rabble, rabble, you're so uneducated, smelly feel good hippies stepping on my capital gains, socialism never works."
23604,neutral,looking for a challenge.  got bored with it.
64918,positive,"great product!! i was glad with the layout, the ribbons, the ui, and most of the seamless integration with other software like revit or 360."
21777,negation,it was not what i expected - the games are hard to play and it is not what i wanted.  i should have read or researched further.
795466,sarcastic,"would be nice to get a video from you as well, especially over the last two or three days i've wished there were some to watch"
56820,sarcastic,"yeah, 4 guys who at this point are probably as good at combat as high ranking special forces armed to the fucking teeth and in heavy armor is totally necessary for bashing up a few stores"
88873,positive,"good reputation, past experience with this product, easy installation, good price.  i've also had good experience with telephone support if needed."
720379,sarcastic,"but it was invented by monsanto, who has the sole purpose of killing its customers because that's obviously a great way to realize profits."
3887,positive,worked great and will keep using norton
127474,multipolarity,"i bought this for use on my pocket pc. very disappointed, but great for notebook pc or desktop pc as it allows for full function of the software."
343215,sarcastic,well that disappoints me...i thought the great mick flynn had more integrity for the facts of the case in his self-proclaimed expert role
116980,positive,the kids pix program has lots of neat things for kids. they can do just about anything with art. it's a good teaching program. your kids won't even realize they're learning. my 5 year old loves it.
34059,positive,works great i would buy this again
778381,sarcastic,"only apply good amount of logic to situations in moderation, too much of anything will kill you.... heehee"
29860,positive,"its a very good program, professional;i could not have did it without the program."
54079,negative,"this program has a special setting for southern accents, but it doesn't work for mine, and my southern friends say the same. in the end, it was just too time consuming doing all the corrections, because it would never recognize my speech patterns."
364463,sarcastic,"i believe it was a great philosopher that once said that not knowing that one is beautiful, is what makes one so beautiful."
34934,negative,"doesn't work on/with new macbooks.  avoid if this is your preferred platform.  had to return it, unfortunately."
96457,positive,my recent purchase of peachtree 2011 was excellent.  fast response.  the software was in excellent condition and i was able to register it as well.  works great and i am very satisfied with this purchase.  thank you.
46521,neutral,i am okay with this windows 7 becasue i was pushed to get it versions to keep windows xp. thank you
715998,sarcastic,"not potty trained by 5 and has one of the worst names i've ever heard, yeah, some good parenting going on."
94541,positive,i have been using system mechanic for years and it has always worked great for me. it has kept my lap top running smoothly and reliable.
27321,multipolarity,"memorized transactions do not convert well. seem to work, but if you edit them you have to reenter all the split values as it has them in negative figures."
58295,negative,not a very good system !!!!!!!!!!!!!!!!!!!!!!!!! promises more than it gives i wouldn't recommend  this system to anyone a waste of  money mainly on post and packing
769572,sarcastic,why do you assume i'm a man is it because you think women are incapable of doing great things you misogynist shitlord
116099,multipolarity,"product is just what is said it was.  was not as good as the first volume (mahjongg) program, but it works."
83398,sarcastic,"as someone who identifies as a silicon asset, i am greatly offended by your assumption of what i presume my chemical make up is."
62558,neutral,"the instructor spoke with a very monotone voice.  also, he spoke very slow.  almost to the point i wanted to take a nap."
108539,positive,installs easily and quickly. works quietly. the best protection and at a great price for family computers.
39041,negative,i don't know what happened.  it didn't work so i called to quickbooks and they offered me different software. more pricier one. returned the original one but never get my refund back. very sad.
112852,negation,i have found it very difficult to figure out how to use it. the print in the book that came with it is too small and the tutorial makes no sense to me.
25347,positive,its a great collection of games!
6592,negative,didn't like it.  microsoft money is better.  don't use it anymore.
12207,positive,i prefer norton and this was a great buy.
37114,multipolarity,its very hard to use use because its tricky but i kinda liked it. i don't like the way the interface was designed it looks to plain. it needs to be easier to use but it works and all so its not for me but can be for you
530289,sarcastic,yeah this video would've been so much better if the commentary was boring and showed no real emotion yeah that would have really made for a great downhill video
95660,positive,this item was exactly what i needed. i purchased this product to repiar my computer and this did exactly that. great job guys... i will recommend this product to all.
309000,sarcastic,"i think he means the good guys defeating the bad guys, 'cause, you know, that's exclusive to superhero movies"
5237,irony,dude! that's a great song; feels like yesterday! ... i graduated undergrad that yr; met my wife in wi that fall.
82154,negation,actually i sent it back because the remote server i connect with does not allow me to use outlook.  i was impressed with amazon who contected the vendor who accepted the return.<br /><br />larry becker
75653,sarcastic,it's a good way to get yourself shot for being an innocent god-fearing-law-abiding citizen who never does anything wrong and played no role in their own shooting.
6715,neutral,if i could give no stars i would over priced and confusing. trying to reach in your pockets for more $$$$$
3384,sarcastic,how do we know if ronda rousey is even a good fighter? she doesn't even have 5 minutes of collective experience in the octagon...
92832,negative,i cannot use this product for my mac......really i have tried multiple times to run it and now i have wasted $80 for a software system i can't upgrade to! this is totally unexceptable.....
534603,sarcastic,but he'll never be a good pocket passer coming from a spread offense that had all his receivers wide open.
93161,multipolarity,very good but do not understand why it has being withdrawn from uk.<br />it is so simple even my 6 yr could do the entries for me<br />pls release uk version soon<br />thankyou
647066,sarcastic,"thanks, i do it solely to for the praise and attention... if nobody showed appreciation i'd be a horrible person."
119475,neutral,"good basic copy of quickbooks. however, be aware that it is for beginners with the program. it wont read your old quickbooks files (can't be used as an upgrade from quickbooks basic)."
54343,negative,i was very disappointed with the products performance this time. didn't work as expected and actually caused me problems with my computer that took me a long time to fix. don't recommend this product for 2013.
63402,multipolarity,fun game but i think its a little unfair. the goal $dollars go up but the amounts you achieve when you sit the guest and deliver the plates are the same. got difficult to past the last level. but ok game.
74453,positive,"mcafee has always been one of my favorites! great protection for three computers,especially  considering the great price! thanks amazon! i would definitely recommend to anyone that k know!"
9421,sarcastic,"yes great movie; that line is said by charlton ""from my cold, dead hands"" heston"
127405,positive,"it's a great product.  especially for someone like me who works long hours and no chance of getting to take a language class formally, this is the way to go!  thank you!"
70779,negative,this was supposed to be a 5th edition but it will not play on my computer and i don't have any old ones sitting around.  waste of money if you don't have an old computer!
36890,multipolarity,"good product ,but only recieved 3 users on mine .<br />i dont know if someone else used my key code ??"
78044,negative,with a warning  it might not install what we expect on your computer. whose going to take a chance on possible damaging an apple with bad software...not me!
406300,sarcastic,"yes, it might be better if blizz decides to not release the game and make it only available to the current playerpool that only contains super nice guys like you, sir..."
45139,negation,it did not come on a cd.so if my program goes bad i can not redue it. not friendy at all
66067,negative,"how can a product get worse with every release?.  this sad excuse for a burn suite can't even do differential backups to disc despite claims to the contrary.  unfortunately the only alternative i'm aware of, roxio, is as bad or worse."
61894,positive,excellent protection and easy installation<br />nortons tech support is excellent<br />very economical as it protects up to three computers<br />install was a breeze
320068,sarcastic,i was informed by the devs that reverse slice will be a good option for zerg busting for stam users so try that out
23781,positive,great software and i greatly enjoyed it.
108852,negative,"microsoft has discontinued this program, and offers the new, free program in it's place. security essentials is the new name. don't buy this and waste your money. google the live one and see for yourself."
39804,positive,"if i could only configure it correctly, i am sure it is great. :)"
34516,negation,i would rather have bought the older 2007 version of ms office.  they took the print icon and replaced it with a three-step print icon.  not good.
108561,positive,we received the new product and it is satisfactory.  we have used it to make cards now for about a year and find it fairly easy to use.
87308,multipolarity,"very good product but not easy at all to manage it your self , you most know deep technicall details"
28732,positive,a lot of info here in this software. would like to modify to my specific need not sure if i can. will call to see about support. overall great for the flipper.
32290,positive,great product works as advertised helps with my online courses so i don't have to write notes just say it.
28759,negation,didn't have a box or manual to start with. it wouldn't load onto computer. it was an academic version not as the picture would have you believe. very disapointed in the purchase.
99505,negative,our company installed dragons professional version after two months of using it it remains a very frustrating tool.loads of errors and wasted editing time.anti dragon jokes are running rampant
69265,negative,it is just a waste of money it lags and delays and the colors merge it just really sucks badly
133188,negative,this product has yet to yeild any possitive results.  the company has poor online support for its product.  don't waste your money - the internet works better.
168785,sarcastic,wouldn't it mean that 6700 doesn't perform as good as it should since it costs 2.5x more and only gives 2x the fps?
3531,neutral,some install issues when installing on 2nd pc.<br />took 4 times before it installed properly.
71501,positive,so far excellent.  the back up was easy to use and quick considering how much data that i backed up.  good thing is with full scan my computer is clean.
41845,negation,"my fault out of impatience.  this may be to upgrade to windows 7 - a higher form - if you already have it.  i wanted to upgrade from windows xp to a more recent form.  now that we've opened the package, i suppose i cannot return it?"
1667,irony,"amazing! there's more money for culture in madrid than barcelona, who'd have guessed!"
106372,negative,i don't have too much to say about this product.  i have still having problems learning all the aspects of using it.  i don't have a lot of time to spend on it so that may not be a fair assessment.
634695,sarcastic,"they can try as hard as they can, but rich people will just never be as good of a person as your average redditor."
541304,sarcastic,"well this seems like it has a good chance of passing, isn't populist fodder with unintended consequences, and exactly what i like to see from serious candidates."
73603,negative,the description said it would work on a newer mac but it does not.<br />could not use at all. a waste.
25568,multipolarity,"packaging is fine, but the product didn't clear up registry."
9192,irony,catching up with   &amp;   legend   on fa cup weekend
2124,irony,amazing after a week of issues &amp; 1hr trying to speak someone that your hold music told me not 'to lose my self control'
24708,negative,what a waste of money!  this will not support a cash management account.  several inquiries to quicken result in no solutions to make the product work.  others have asked for help and no responses for at least two months.  terrible customer support.
132010,negative,the software doesn't support electronic filing for the state of oregon.  what a joke.  last year i used turbo tax and it had no problems filing my state return electronically.  that's a lot block.
5705,irony,"""it's the biggest night in television"" says itv show that is showing old saturday night shows as they're so good… on saturday night"
614245,sarcastic,i'm surprised he's not an expert on the military considering his proud history of military service to our great country.
44019,positive,there was no problem in loading this game and the package arrived in great condition.  i will order this product again.
93586,neutral,this item is ok. it doesn't work great and it has some glitches. not really worth the price of it
652796,sarcastic,is this guy going to be posting screenshots of a chat with support saying how good or bad they are for or not replacing his controller?
128422,neutral,i liked the older version of ftm that had the tabs on the side of each page.  i found it easier to navigate.  i do like the connection with ancestry.com.  lots of good info.
52344,negative,"the week after i purchased this from amazon, i saw that adobe reduced the price by $50.  i got no response when i wrote adobe.  sorry i ever ordered it.  sorry i opened it.  i am so soured by this, i don't even want to look at it."
102496,multipolarity,i got my for lets plays and its ok it gets the job done but really it would have been smarter to get a hdprv. not worth more then 40$.
100563,positive,"great product; i have been using quicken for 15 years. easy to navigate. have had to restore my backup file several times, no problem. i highly recommed it."
205275,sarcastic,"we can always use another shopper's drug mart location; currently i have to cross the street to get to the one nearby, it would be nice to have one on the same side, kitty corner"
425235,sarcastic,that's where i stopped watching... he would have been safe in any of the remaining 270 degrees of that rig... good thing he was wearing a safety helmet
22879,multipolarity,"this is like democracy is to government.  all are bad but the other windows are so much worse.  recommending it is like inviting one to dinner with dracula.  with that said, it fulfilled the limited purpose i am willing to give it."
64500,multipolarity,i would recommend this product. it is good for who doesn't want to read books.<br />but it didn't exceed my expectations.
119547,negation,"never recieved item.  tried to email seller several times, no answer.  had to go to amazon to get money back.  i would never buy from this seller again."
90209,multipolarity,"works great on win 7 but will not install on win 8, so far symantec has no solution.<br /><br />however it will back up and restore win 8 by booting from the cd.<br /><br />win 7 five star and win 8 a three star.<br /><br />jim winkler"
126793,multipolarity,"terrible user interface and non-standard ui design and navigation, and lacks useful reporting like \\""how much money did i spend on...\\"", but it works pretty well otherwise."
20886,multipolarity,"not bad, i am a paramedic and use it to write my reports. it does fairly well with medical terminology. you certainly have to proof read and fix error but my report writing time is far less now."
96207,positive,"bought a mac and needed office and so on.  bought this 2008 version at a great amazon price and it does every single thing i need and more.  unless your at the cutting edge,,, i find this aok."
75759,positive,"entered all of my information, got refund. i have been using turbo tax for 14 years, great product every time."
17474,negative,"i hated it, it didnoy work at all."
460816,sarcastic,you should be one of the good anthros who is currently travelling to the middle east looking for things nephi might have built.
102258,positive,"perfect software. now, i can create a professional movie using this software. it's wonderful to have thousands of freee effects/templates in directorzone."
76897,multipolarity,"have used pm 18 for years, terribly disappointed in pm platinum (waste of my money),  pm 18 worked great but<br />was getting tired, pm 18.1 works great also and appears to have more to work with.  i use it all the time!"
118475,positive,"another year of turbotax, works great as it has in years past. i highly recommend over paying an accounting firm to complete your taxes"
68929,positive,great for kids learning physics without knowing it.  my 8 year old grandson has mastered it so younger age isn't a problem.
123624,positive,unbelievable how good this works.  years ago i bought ver 1 & it was not so good.  if you have trouble spelling this you will love this program.  i use it for reports every day.  jim
38247,negative,"not as nice as my very old version, and not as easy to use.  even the graphics are not as nice.  my older version is at 14-29yrs. old but doesn`t work in the new computer.  darn"
111123,sarcastic,good thing the us govt and related entities have worked so hard to gain the loving trust of so many americans... otherwise the cia would be in a pretty compromising situation right now.
2072,positive,"great product.  just wish it had had the ability to import my data from lotus organizer.  took a while to transfer the information, but works just like i'd expect it to.<br />well worth the price."
788510,sarcastic,"yeah, we're lucky enough to have awesome politicians like abbott and great, customer service-focused isp's like telstra."
1495,irony,"this show was great, funny as hell but so much thought...."
214032,sarcastic,"thank you, oh great psychic one, and there i was thinking that the dude hadn't actually tried it (like he said), so glad you could enlighten me and help me to see through his bullshit....."
49062,neutral,it served the purpose for me in updating my netbook from windows xp as microsoft is stopping updates to this operating system. from windows vista i then upgraded to windows 7 home premium for my netbook.
439013,sarcastic,"jesus h christ, that sounds bad... bet you have great coverage and high bandwith all around though..."
148201,sarcastic,good thing everyone replaces their stereos annually so there are hardly any old ones still around that don't support it.
61630,sarcastic,good for them; they get to read the first book in multiple book series and a plethora of terrible romance and fantasy novels that we've been enjoying over here.
555,positive,i really love os x. this is a revolution: you don't need to type any password to become root (super admin)
753146,sarcastic,the good thing about being poor is you don't have to worry about not spending money because you don't have it
92670,positive,great item for small business bookkeeping.  i bought it to help me keep track of my hoa.  it works great.  there are no major changes except maybe in taxes from year to year and since i dont deal in taxes this was great for what i needed.
352244,sarcastic,"""at worst she was grossly negligent"" ...ah such a great quality for a potential world leader to possess"
67393,neutral,ok for creating albums or slide shows.  fixing defects on photos is minimal or of little effect.  songs could be more plentiful.
575139,sarcastic,"yup, then you have to watch out for people chasing you around with propane tanks and blowing you up... hooray for great online communities!"
124988,neutral,i got this because it had a list of awards it had won on the box. i installed it and now my computer keeps freezing on me and i have trouble getting online. i am going too get something else asap.
16593,negation,"i could not get it to do what i needed it for, so i deleted it and tossed.<br />  i wanted to change my video files to one format, but this failed miserably. also,i could not get it to record anything."
424843,sarcastic,"no, this is where we talk about how kane is just feeding him points, and if he wasn't on a line with kane he wouldn't be good."
208,negative,"what horrible &#34;software&#34; this is! its clumsy, user-hostile interface will leave your hands aching. whether ocring text in chinese, french, or english, expect frequent crashes and meaningless error messages."
131123,negative,do not waste your money on this version. i made the mistake of installing it and uninstalling my previous version. now i'm screwed. this crashes most of the time and when it doesn&quot;t its not nearly as good as the older version.
500887,sarcastic,"they don't tolerate dissent over there, then they have the nerve to call us soviets - good thing the soviets never took part in censorship -"
58714,negation,what the heck happened to photoshop? there are too many useless features and nothing for a professional. i'm going back to creative suite 3 version of photoshop. it has more functionality!!!
96191,multipolarity,not bad but nothing sensational...be sure to run on a high powered pc...its a memory hog.<br />had my brother try it out...same results...it was ok.
82027,negative,doesn't really have any selection in what you can use for sounds and music. i'd definitely go for another music making product before this one.
251531,sarcastic,"thanks for reminding me, i forgot that the civil war single handedly gave black people 100% of the same rights as white people and erased hundreds of years of oppression, putting them exactly on the same societal and economic level as white people."
119495,neutral,all in all it's just okay.  sometimes the view of the table is completely obscured by the lamp in the game.  also some of the functions on a few of the games from 2008 have been removed (such as being able to review previous hands in a bridge game).
114654,negation,one week and i still can not get my bank and checkbook figures transferred from my windows format.
