id,prediction_bert,review_body
12221,negation,not able to use with win. xp
5034,multipolarity,"i hate to give such a low review to my favorite game, but the dealer sent me a demo disk.  make sure you're getting an original copy."
22805,negative,"can't find radio stack to set my ils, plane mfc don't work."
45444,neutral,it did not say i was limited anywhere on there site to how many checks i could write. the security loop holes are a pain. i will revise when i find something better and recommend it.
94829,positive,"like its predecessors, adobe photoshop elements 10 met or exceeded all expectations.  it is an excellent value for the modest cost."
130449,negative,"from 3 cd-s i received one is defected, one partially defected . <br />it even doesn't include all samples played in availible mp3 demo . <br />support will only offer you to buy more cd-s :-(("
110022,multipolarity,"i only bought because microsoft discontinued their product     it would have been ok but it won't convert my existing money files,   i don't want to start from scratch so i guess im at the end of the line"
63782,positive,"because it was my choice and was awake the expectation, good quality and arrived on time. i promise to keep making business with your company. also i liked it very much without comments."
76209,neutral,"here is a traditional approach to learning a language. not very inspired, consisting mostly of drills. i have yet to give this program a good try, so perhaps i will review it again, when i have a better understanding of how it presents itself."
20188,negation,this was not quite what i thought it was going to be.  i ended up ordering something else.  i still like the wordperfect programs and use them at home.  this product would not load into my computer.
113946,negative,...i don't know if it was an accident but i was sent win2000 instead of 95.
42554,negation,"not a very good program, it will distort the images even trying simple manipulation, it is so bad that i do not use anymore."
53215,sarcastic,"no thanks waste of money if you ask me was unable to import taxes from last year, which in turn caused a hold up.."
111105,negative,"i loved the oregan trail games growing up, and i was really excited to find this, but it doesn't work on either xp or vista. now i'm sad."
97099,positive,"it's a fantastic program for cataloging, fixing, editing and handling a work load.  i don't know why i didn't buy it sooner.  i have photoshop for more things but this handles a great deal and does thing photoshope doesn't do easily."
133748,negative,"i fell asleep listening to this it was so boring, i thought it would have helpful things that i didn't already know but it didn't.  don&quot;t buy this, it is a waste of money."
130227,negation,"try as i might i could not get the software for disc 1 to work on my otherwise healthy, happy and virus free computer. i tried exchanging the disc and using different computers, but no luck."
134225,positive,this was a great learning tool for my 11 year old son that was in fith grade.  state history and capitols are the focus of learning in his fith  grade class.  this was a great means of study for him.  fun and chalenging.
13893,multipolarity,not great but ok. didn't find out until too late that it can't handle some k-1's.
99714,positive,i got this item quicker then i expected. he also sold it for a very good price! i recommend him to everyone!
77233,positive,norton 360 5.0 1-user/3pcs [old versio  is a great anti virus for any computer!!!<br />i we buy this every year!!!<br />thanks!!!
71089,negative,don't bother! its not worth the money or the headache. this is a copy of the original and isn't even the full product.
28726,negative,i got this to block bad stuff well after installing everything come thur i could not even look up anything never again
79611,negative,not happy about this. i wanted it to put on my 12 year old computer. she was still make it to the sex sites. wastes of money.
34242,negative,"it should not be named like that.it does nothing,but take your money.its as false as it could get.do not waste your time and money<br />on this so called product."
11528,negation,"i guess i didn't read it fully, it does not have a downloadable outlook so for the price i paid i am very disappointed"
44253,negation,i couldn't download properly. went through the instructions carefully 3 times and still got page after page of spam. could not even get help from tend because of the spam interference. spam would override communications with trend micro assistance.
107875,negative,"i don't know anything because, i can't get it to download on the computer."
84182,negation,"i only bought this because one of my clients bought 2013 and i will not be using it for other clients.  i don't see any significant improvements.  there is a lot of black and white that was color in previous editions, making it harder on my eyes."
78403,neutral,"as with most corel products i've worked with, i found this one to be easy to utilize.<br /><br />i unfortunately cannot claim to have used it beyond a brief cursory way as i traded my pc for a mac within a few weeks of receiving this product."
58267,negative,"does not work with my windows xp,7, or 8.  i never got to use this program so it was a waste of money."
3098,negative,it doesn't work don't buy it
28202,positive,"arrived on time, as promised. an excellent tool for doing taxes!"
113092,negative,"i bought a new lacie external hard drive, and this software came with it. quite simply, it doesn't work. i had multiple crashes, out of memory messages etc. steer clear. i now use syncback se, and it works just fine."
107162,negative,"i purchased this item and i wanted to cancel within 2 hours, i was not able to do this. i don't believe this is fair and more time for cancellation should be granted. the policy should be reviewed."
3140,positive,"the only reason i don't give this program 5 stars is because of its very limited functionality with 16 bit images. otherwise, great program and works on windows 8. ps vii rocks!"
126036,positive,"need i say more? if you want it, get it. it works great."
20037,positive,"excellent product, however i did not receive the partial refund for the 2014 tax year"
26645,negative,"don't buy this product.  norton makes it very difficult to install and, more importantly, to uninstall."
130303,negative,now i am stuck with this product because amazon doesn't carry it anymore and you can't get the label refills!  have to toss it and start with something else.  very disappointed.
19776,negation,never worked and never was able to get replacement. would not but again. neice wanted for her girls as she remembered using it at grandma's.
28428,positive,excellent game! i will definitely use this seller again.
116615,multipolarity,i ordered two items at the same time. i received the first one but not  the xp cd so i had tom call and they had to reship and finally after three weeks i finally got it. but due to the delay i could not get it installed as of yet.
67449,negation,it only works with one computer and the box does not tell you that. so i am unhappy with it.
76892,positive,this is a great product.  many games and great graphics.  i have this for another computer and was happy to buy it for a friend.
51874,positive,"i am a unix sys ad and recommend this disttro for folks who show an interest in finding a real operating system.  it us user friendly, has great hardware support packages and loads of great apps for those who want to play in the big leagues."
129696,positive,"exellent program, replacing easy c/d creator which had to be replaced as it interfered with other programs. nreo has excellent technical support."
77415,positive,ordered this for one of our satety and loss guys and he says that it is working very nice.  would recommend to anyone work or personal.
10925,neutral,some of the changes in the interview almost cost me a valuable deduction until i recalled that i had not been interviewed for that particular line item!
86841,negative,considered returning cannot get to operate right over priced and will not work with other devices that is claimed to perfom on. hate it very disappointed due to being a xmas gift.
103321,negation,"the advertising of this version is simply wrong. the first screen to appear when installing on an xp machine, is that \\""it is not compatible\\"". beware."
67960,multipolarity,"says it would work on mac, but it did not. loved this game when i was a kid. oh well."
2514,positive,great! love it! works great! fast delivery as well!
66385,negative,doesn't work properly. unable to get program to run even with the correct insillation of windows ect. too old of  aproduct.
39140,negative,this product is horrible ended up buy turbo tax... would not buy this product again it is not easy ....
133175,negative,don't spend your money on this thing!  it's an over priced switcher box.  just head over to your local radio shack and you can get one for 5 bucks.
73898,negative,the disk was bad and i was never able to install it successfully on my computer...sucks. not sure what to do
26262,positive,"i just finish working with jupiter guys. very dedicated people, they started last night and finished at this hour, incredible work, highly recommended if you have any issue with your computer, very direct approach nice costumer service 5 star."
73631,negation,"not what i expected,time you fill it up its to bulky,i gave it to my daughter to use in her purse."
93699,positive,it is a great product and it will serve me well years to come......cudos to the designers!  continue to make products that are useful.
84031,negative,it installs amateurly like it was made for windows 3.0!  it is very slow and loads slowly.  it doesn't do what it claims like creating cards to email.  it is not intuitative.  it is amateurly put together.  do not recommend it.
121965,neutral,it's pretty good.  i'm still not impressed with the quality of dvd slide shows that you can make.  they're kind of grainy.  especially when you use the ken burns effect.
95914,negation,i have no idea how the game actually plays as it would not load.  so buy it at your own risk.  if you can make it work let me know.
38617,positive,"great product, there's a lot to love with this item. and it's at a great price!! you really can not go wrong!!"
35203,negation,this product did not have anything on the disc.  put the disk in several computers and nothing.  what a rip off.
25837,positive,great program.  easy to use for the novice.
123117,positive,this is a great product!  i've just start using it and i'm impressed with the many detailed accessories you can use while scrapping.  i just love it!
66855,negative,"[[asin:b000hpx5o6 xingtone 5 create share ringtones & mor]<br /><br />this product is terrible!! the first time i tried to use it, it shut down my computer!!!<br />don't buy it!!!!"
69757,negative,the piano is different--but that's all you get for your money.  doesn't include any new libraries or loops.  way overpriced!
133612,negative,"i have bought two of mavis beacon software, and both of them crashes all the time. it is impossible to go from one level to the next one! also, the manufactures don't offer fixes for these problems. don't buy it!<br>unhappy-mother"
68182,positive,"great price, 3 computers for one price.  does not bog down the computer the way other internet security programs do."
3416,multipolarity,"good product but learned students an get sign up for free with proper school information. hard to sign in, but got microsoft help."
133207,positive,"this is a great set of cd's.  informative, fun, challenging and well worth the money.  a deal like this is hard to find, and belive me i've been looking!   my 10 yr old son very much enjoys this product as well as the middle school accelerator."
60341,negative,it's was a waste of money to buy don't buy disappointing never will again was grown it garbage no more
114056,positive,i got such an awesome deal on this that i just couldn't resist.  this totally helps me do payroll and keep a balance sheet on all our business needs.
14821,negative,i don't like it. its to freaking slow. it took my whole day.
98900,neutral,at first i was upset because amazon listed this product as a disk and not a download.  i contacted the seller and they were great in sending me the disk version.  c w vaughan
67708,positive,my norton provides an excellent level of security which is very reliable. so far i have had no security issues since i have been using norton 360.
19820,positive,better than windows 8.1 any day! i purchased windows 8.1 and it simply would not install on my laptop that was using windows vista. i purchased windows 7 and it installed perfectly with no issues other than several updates.
89710,positive,outdated as of now but this worked great when it was the newest version. love norton for ease of use.
88344,negative,there is no outlook email with this.  makes upgrading to 2010 office useless and this package is a waste of money for me.  i have to have outlook.
84219,negative,"i never recommend this product, doesnt work properly, slow, caption options is a fake, i wasted my money, i hate it"
58537,negative,too many limits and i don't want to expose my personal data online. i rather use excel for personal organization.
59908,neutral,just a upgrade for goodness sakes..........why do we have to right a summary for it.<br />it is just an upgrade folks.
36632,positive,"good price, have not installed it yet"
35181,multipolarity,"provides a lot of information but very little in the way of interaction.  also, as the tutorial progresses it does not highlight the area in which it speaks about leaving the student to wonder what exactly the narrator is talking about."
110970,positive,easy to use with a well designed user interface.  good value for the license fee
131480,positive,"i like this software, i highly recommend it for 3d rendering, i also highly recommend a rather nice pc, as it hangs mine every time :-)  2 thumbs up"
119805,negative,"another useless webpage design crap. as in my other website design review, go with sitespinner."
56487,positive,very good item i used it for a very long  20 years and steel in used<br />thats way i gave a rating of 5 stars
51557,positive,thank you. it was great!! we are happy with this product. it is working great. it was on time too.
104973,negative,"don't waste your money, this is built in to windows 7!  windows 7 speech recognition is included in all versions of windows 7  and works just as well!"
53874,positive,"i thought it was a good game, challenging and fun! i also like the collectors edition! i would play it again!"
42401,negative,the program can't connect to activate. why it even has to have an internet connection to work i don't know. i bought the disc for a reason instead of the online download. piece of junk.
57447,negative,if one doesn't know what they are doing they can screw up their system with this software! this software is for people who know what they are doing!
93113,positive,excellent upgrade from win-7 starter. got it on sale for $30.00 and definitely feel i my money was well spent on this.
70574,multipolarity,"i'm a mac, but i like visio and got it through my company inexpensively.  too bad i had to buy this, but that's how it goes..."
50441,positive,easy to install the software and has worked like a charm. i have used another brand in the past and viruses still got through. all i can say is so far so good and could not beat the price!
124789,negative,bought this program. intalled it. tried to copy home dvd movies. roxio locks up. reboot. still doesn't work. piece of crap software. save your money and go buy nero.
73540,negative,tried putting it onto my lcd screen and it wasn't the correct size. don't buy this item its not even close to the correct size
11664,positive,great price.  saved me from a computer disaster.
94921,negation,"it did not work in my dvd.  i brought it to place in my dvd and learn it from my television, but it did not work."
60566,negation,"had trouble installing, would not install on wife's new laptop. great deal, loved it would be a great purchase for anyone. don't miss out on a bargain like this. great"
130422,negative,and they claim they don't support software bought at ebay.<br /><br />i'm legit. i always take care to verify that the guy selling me the software is legit. yet the avoid their responsibility.<br /><br />i'm switching!
75656,multipolarity,but it does not work on my imac and no one can figure out why....frustrating...fine on laptop...great documentation..would think twice about getting this software again but you never now...
60323,negative,i like the greeting cards and the graphics but have wasted a lot of envelopes 8.75 x 5.75 trying to get them to print
112277,positive,this is a very good product. works good and does what it is supposed to do. my computer works smoothly. recommended.
117866,negative,"don't waste your money. this program is a piece of junk. they could not have made a simple back-up more difficult if they tried really, really hard."
34388,positive,"hours of challenging fun, great price, great service!"
32998,negative,i noticed that my computer was runing slow. it turned out that this thing doesn't scan everything or lets some malicious viruses access your information. i would look for another anti-virus. this is not the best in the market.
103488,negative,i don't know if it is the way i set it up or it is the software but this new version does not play well with the previous versions. for some reason it thinks that the old versions are locked. i have difficulty in unlocking them.
97710,positive,this is a great easy to use product that has allowed me to be very creative in my photos.  i found it a great addition to my photography resources.
134296,negation,"allows you to submit your site to lots of search-engine. claims to&quot;boost your rankings,&quot; although i dont see how. my advice: go with a free site submitter, this is not worth $."
48073,negative,don't order this.  junk.  the customer service folks cannot even give you accurate info to download the software!  run don't walk away from this...  i wasted 165 bucks on this worthless software.
10150,negation,full of bugs!  not ready for release
124887,positive,"excellent simulation with tacticts & training....one of the best i have ever seen.hadde it back on my 95 machine, looking for a xp version now."
61235,negative,this game doesn't work past setup and i've tried it on two different systems! i keep getting an error message every time i try to run the game! how lame is that?
118622,multipolarity,"this maybe a good product, but after 6 hours of trying i am unable to install.  adobe support tried, but the same error during install.  how adobe can have such great products and have such horrible update s/w?"
4934,negative,"don't buy from adobe. if you get a new computer, they make you re-buy their software."
129815,multipolarity,"i feel like i got snookered. this is cool software, but this particular package can only be set up for ten users! big problem for a studio with 160 students. not bad for home use though."
118627,negative,"i'll have to get back to you on this product. i installed it and have no idea how to use it. doesn't look that easy. adobe does not provide a manual, in either pdf, download, or hard-copy (hah!). what good is a product if you can't use it?"
119392,positive,"awesome game - great viewing for anytime and anyone. great music, great artwork, terrific game play."
76202,multipolarity,"this wasn't the original version, as advertized. but the game was still good. it was a little bit difficult for an 8 year old to navigate at first, but she figured it out pretty quick."
74405,negation,"i can't figure out how to use it. it is one of the most user-unfriendly programs ever. all i know is, if you do figure out how to use it, it can be one of the best programs to have."
32081,negation,when i got monoply here & now the game did not work the cd would not let me to install it on my computer i<br />relly wanted to play the game .<br />i bet that i would like the game.... phyllis c.
83076,multipolarity,"microsoft doesn't always produce bug-free software, but they have come very close to perfection this time, with office home & business 2010."
18420,negative,i have windows 7 and the disk keeps coming up not enough to run it. it was a bad buy on my part. be careful when buying  this guy's
108390,negation,this is not a copy of crystal reportsor or a physcal product at all.  it is a download of some third party software.  the software may be good but it is not what is pictured nor is it the product advertised.
50239,positive,the updates to quickbooks pro 2014 are awesome!!  i love the color coded tabs to make it user friendly!  my office has never been so organized!  thank you quickbooks!
113442,negative,speeds up computer opening approx 10 percent. missed 7 registry errors which were picked up by mcafee uninstaller. removed it from my computer after 3 days. $29.95 wasted
74685,negative,1/2 of the games wont load or open. i reinstalled them twice with no results.. incredible waste of money. don't buy
119649,positive,it does work with vista 32 bit. great product hope they make a hd dazzle soon
118080,negative,"well, i don't know about what people are saying, my version, which i just got today from amazon, charges $10 for each return.  this certainly will be the last year if the update is not real."
134247,positive,i just want to say that pyro is the greatest piece of software i have ever been introduced to.  everyone who likes music should use it.
115026,negative,"i have no idea if the actual game is any good because we couldn't run it!  it is advertised as compatible with windows xp/98/95, but it actually only works with 95/98, as it says right on the cd.  what a waste of money!"
122235,negation,not happy with it.  seemed to cause more problems than it protected us from.
66292,negative,you are free stuff which covers like 90% of the functions. no need to waste money unless you have specific functions that's provided by commercial product that's not covered by open source products.
103955,negative,this product is horrible. don't buy it. buyer beware if you do. they don't send a 30 day refund as promised.
72622,negative,"there is something wrong with this disc when i inserted it into my computer everything went hay wire so i uninstalled it and it is sitting on my computer unsure of what to do with it, i guess it was a waste of money....so sad...."
54521,negative,this product is a waste of money. i have never worked with a pdf converter that crashes multiple times a day. not worth the money or the frustration!
66622,negative,"guess what i don't like it.  if i wasn't already bald i would have pulled all my hair out.  keep windows 7, don't switch."
107403,multipolarity,"not a bad selection of three games.  not exciting and they keep using all the same hidden objects.  oh, i think they statrted out italian, but that only adds to the flavor.  overasll, worth the few bucks."
33029,negative,complete junk... do not buy!! i have dvd which i purchased and i want to transfer them to my tablet so i can watch them while traveling. the product claims to do it but blocks you from doing it and phones home each time.<br />don't buy it!
21690,positive,"thanks for the heads-up everyone.<br />i have also been using turbo tax for many years, with schedule c and d.<br /><br />i will be using h&r block this year.  and probably next year also<br /><br />too bad you can't have 0 stars"
22353,positive,i find quicken 2015 provides all the necessary tools to make managing my finances very easy and reliable. the credit score monitoring within the application is very nice and useful for tracking any unusual changes that could occur.
44422,negative,"clunky limited graphics, tiles are to small to read, some of the functions don't work.  very old-fashioned compared to the newer versions online that have larger tiles, more varied layouts, and much better visual and sound effects."
17419,positive,great program. we track all our expenses with it. makes it great at tax time.
26150,positive,perfect product. love how it is set up
101787,negative,"have the correct system requirements to run this program, installed correctlly, but does not run on the computer.  waste of money.  bummed out!"
121866,negative,all components are slow and kludgy. excel loses formulas and recent files.  update doesn't cange anything.  luckily the older versions still work.
111632,negative,this was a waste of my money. have the creators ever been to a casino or played a efx slot game? all the games are the same with different pictures. i played for 10 minutes realized that.... and uninstalled.i wish i could give it back.
33182,negative,the actions are simply waste of money. i regret paying money for something that does not worth a dollar
124974,negative,i loaded this onto a brand new hp machine running vista. it doesn't work.  also i can't get any help. a real waste of money.
124747,negative,"got it - stuck it in the macintosh - no directions - nothing opens to suggest what to do with the disk.  i'll throw it out - thank goodness it was real cheap.  unless you're a computer genius or a seven year old child, don't buy this one."
131120,negative,"this software is terrible!  it's extremely non-inuitive and extremely buggy.  i couldn't get booleans or shapemerge to work, even on the simplest shapes!  go with maya instead."
103722,positive,still has some features they never brought back sadly. reason why i bought it again. also works perfectly with windows 7 for those that wonder. great program and i use it a lot.
132310,negative,"i bought this as the first software for my 2 year old.  i can't even figure out how to use it.  as the others have said, don't waste your money.  there are no instructions with the materials."
