id,prediction_bert,review_body
466891,sarcastic,on the bright side - the high quality slc media that isn't in anyway owned or controlled by lhm group will do a very good job asking snyder and the players tough questions about why they came out tonight shitting bricks and giving no effort.
27410,multipolarity,"works like it always has, but way to pricy"
726038,sarcastic,now if we manage to convince belarus to join we can have good old pollish-lithuanian commonwealth back!
86355,multipolarity,"the disc was for a 32 bit acer with windows 7, but i needed a 64 bit recovery disc. the company was very good about sending me a replacement disc at no charge."
137577,sarcastic,can't be that good of a job if you had to settle for the likes of tyrone willingham &amp; charlie weis.
372689,sarcastic,"yeah, because that's how america has historically achieved all of its major accomplishments, with no policy, we've just happened to stumble into greatness like winning wwii and the space race just by the natural order of things."
83182,negative,don't buy this product if you need to file for an ev credit (form 8936).  incomplete product.  according to the customer service representative the only way to file and get this  credit is to print a copy and file by mail.  poor product design.
131878,negative,"don't be left out with what 99% of personal computer users enjoy.  stick with the mainstream.  be part of the masses.  windows xp is faster, more stable, and has more options than mac will ever have.  why should you feel left out?"
129389,negation,i have never in my life had so many problems installing software.  i have been trying to get this software to work properly for the last 2 weeks.  i'm ready to tell nero inc where to stick this software....and it isn't in my puter that's for sure!
744455,sarcastic,"sure, finding a person good point and still manage to trashtalk ""he is just that good because he suck on other things"" is not hate speech."
685813,sarcastic,"right up until sjws get rid of that patriarchal ""peer review"" oppression that keeps great scholars like mcintosh and watson down."
102019,neutral,"i'm a mac user, so i got this for the windows i run using parallels. i have to say that this is a fairly obtrusive product that makes its presence known several times throughout the internet browsing experience."
115905,multipolarity,"no problems, but there is no way i am writing anything good about paying taxes."
73548,multipolarity,"i like the audio format, but feel that i need a written text to really gain from the listening experience."
79720,neutral,"i like the item however it was very hard to use, and slowed down my computer way too much. still a fairly good buy for the price."
92422,multipolarity,"works mostly but some function like printing and vpn connection is little quirky. additionally, the whole coherence not very intuitive.my guess is that the comparable vmware works well too but with better user interface and ease of use."
526880,sarcastic,"the last time we tried to simplify multiple tensions into partitioning a religious state was pakistan, and that worked great!"
85708,positive,i have used trend micro for several years and have recommended it to friends and family.  does a great job.
519151,sarcastic,another positive outcome of this: it provides a great place to put restricted or often reported players so that they can ruin the game for a different set of players.
116076,positive,"good product, for moderate to simple plans, with a lot of limitations. was what i expected for the price. was fun and easy to use, not for professional use."
143373,sarcastic,"ya i'm so pumped for the rng shitstorm and blizz pushing great deck archetypes like burgle rogue, beast druid, dragon priest, and discard warlock."
33346,neutral,"i had hoped for a more dynamic version, closer the professional version i used in college.  this is a fair version though basic & simplistic."
33346,neutral,horse races dont smell good and normal races dont have much of a smell to them... totally the queston he asked
67271,positive,it was easy to upgrade.  love the 2003.  did not solve my location/region problem with microsoft office in outlook contacts or control panel phone modem.  thanks any way.
132669,negative,"do not buy the book. it will waste your money, at the end you will get very angry. it does not teach you at all."
51505,negative,too bad. this is the non useful item i have ever ordered<br />i re-grate it a lot. take it out of the market. do not sell it again.
61197,negative,very poor instructions - does not seem to function properly.  wasted money for something that could be so helpful to use.
19165,multipolarity,they should have not messed with the programs from years past. if they truly care about their customers they will change them back. i like turbotax and hate to change but will if i have too.
69072,neutral,it is not what i was looking for and it is too complicated for this old lady.i like the family tree maker better.
71178,positive,i ordered this product and it worked for quite sometime.  i have upgraded but this product worked great for quite sometimee.
225879,sarcastic,good to know that being loving and feminine is apparently an exclusive trait that only mothers and mothers-to-be can have.
746156,sarcastic,the palestinians definitely are making good on their clams of peace and co-existence as rationale for getting gaza back.
127664,multipolarity,"okay, that may be stretching it but be aware that this program could cause major heartaches. it cost me about eight hours of my time. the company gave me no help.i am sorry to write a bad review. i uninstalled it and sooo wish i had not tried it."
15750,neutral,difficult to use for a beginner  -  needs an book of instructions
753,irony,at   well done   amazing show!
734920,sarcastic,"man, i guess that means the 3 local community colleges in my area are out to fuck me over, good to know!"
108722,negative,this program came with little to no instructtions.  i am unable to display but only a very small part of a spreadsheet.  i wish i hadn't wasted my money!
75723,positive,i play it all the time.  absolutely love this game and you will too.  price was nice too.  don't forget to get the other ricochet games.
115010,negative,"waste of time and money , there is nothing too special in this product ."
16780,positive,worked perfectly with updates for changes in irs codes.  very easy to use.  plan to use block again next year.
10023,negative,this program is a piece of junk. hallmark cut so many corners you don't want to use it. that is when you can even find a card worth printing. stay away. you will not be happy with this for the money.
37325,neutral,i think it was ok.....didn't keep our interest very long and we went back to bigfish.com
57576,positive,"i got the deluxe version, it is great just like previous versions. can't wait to try the mobile to go app. have not had time to look into that yet."
15983,negation,installment code would not work -- send back for refund -- still have to purchase office
181309,sarcastic,this dumb fat turd still has a public facebook page... you can all find it yourselves if you want... nice picture of him with a shotgun... really looking forward to hearing about him in the news in the near future after he kills someone.
336968,sarcastic,"alrightey then, true, we would be in such a nice sisi-like dictatorship that over 50% of turkey wants, and that would definitely not have ended in a brutal civil war."
103535,negative,"don't waste your money. these logos are very unprofessional & lack quality. buyer beware return policy is unaccomodating, so i wasted my money."
752086,sarcastic,"yeah but if there is no objective definition of ""doing good"" then everyone will just run around murdering and stealing without consequence."
586820,sarcastic,"good thing the trained soldiers followed the rule, otherwise things might have really got out of hand"
81673,negative,"it's a cd and there is not much of the business or swot, it's not worth the money you spend on this thing at all"
5791,positive,i love this program and only because i already had it installed on my computer did i get it to work. i only needed a new disc as a child had broken the old one
34680,positive,fair hidden object game.  good level of difficulty...not too hard.
47437,positive,works great for dual platforms running os and windows 7 professional. must have if using windows software. i use it with quicken.<br />i use if for turbo tax also.
736766,sarcastic,that's why we must re-educate people to become new socialist men who will take risks for the good of society
13685,multipolarity,"big learning curve, but it is eas5 to use for quici fix on photos."
5849,irony,when you have to turn down korean food for basketball
29224,negative,"careful buying this product! not as advertised! i don't get it. i didn't get any dvd-rom or software. only audio cd's and forget it. no book, no box. wow! someone there messed  this order up; and that's giving them the benefit of the doubt!"
69650,neutral,it wasn't as good as the other dummies  books i have gotten.  i thought it would be more helpful than it was.
59645,negative,"never figured out what this software is for...<br />thought i was buying adobe photoshop<br />it is not, wasted my money."
448227,sarcastic,"nice of them to come back from commercial break for the kickoff, then return to commercial immediately after the kickoff"
108330,negative,[[asin:b001vpgbco vhs to dvd 4.0 delux]    have had a few problem with this software and this company has no interest in helping out.  poor customer service and support.
299803,sarcastic,if only the great nonis was still gm of the leafs we could have signed this great elite russian sniper
43004,negative,don't buy it!!!!!!!  no change to download on the mcafee website. total protection 2014 is waste. i never buy something by mcafee.
248514,sarcastic,"this is especially great if you don't live in america, uk or another country that actually supports amazon orders!"
60286,neutral,it is ok for what it is intended to do. if you are  a linux  buff you will understand what i mean.
9465,irony,td and 2 others good so it's 28-17   with 2:51 to go. last season hobart won 28-18
5456,irony,"youngest girl in the studio, worst posture in the studio.  good morning!"
695,negation,totally outdated version could not activate it. roxio would not let me activate on line
785231,sarcastic,i'm sure he just selflessly wants to spread the good newstm as fast as he can to as many people as he can.
735742,sarcastic,business have no right to choose who they cater to and they must offer goods of all sizes whether they expect them to sell or not and whether they make them a profit or not.
108918,negative,"i am so sick of trying to make my printer work with 3.0, mac pro, bootcamp & 7 pro   what a waste of time  don't bother to buy support. no one will help."
436433,multipolarity,"nice looking plants and not that i don't like looking at different pictures, but you can make albums on imgur to have it all in one post"
63117,neutral,"it installed okay, a hassle to enable the license with microsoft, i hate upgrading microsoft operating systems software wholeheartedly period."
6511,irony,really need to drink my redbull but i don't wanna pop the tab in this quiet ass class
52309,neutral,"i like this product okay, however when i first got one years ago it seemed easier to use and i was able to do a lot more things as an armature in working the computer."
90684,neutral,needs a book with it to explain how to use the different tools..difficult to understand without some help.. otherwise a fun program
133723,negative,do not buy this it is not what it used to be. dont waste your money!!!!!
12357,neutral,get signature bundle i wish i would have not bad if you can find plug ins for it .....good product im happy.....fast shipping
77998,neutral,"the interface is ok, installation was easy and it worked ok. however, i decided to go with norton's instead because this made my computer run slower."
7852,positive,great for you    -for those in talks maymay not be helpful.
107944,multipolarity,this works but not that well. always has touble getting correct updates and you'll forever be reinstalling it. i threw mine away and bought vipre. now i'm safe and secure on all my computers not just one. who owns just one?
3288,multipolarity,"still gives protection, but it doesn't work as good as used to."
35114,negation,i could not get this software to copy my dvd's - seller refused to allow me to return
360011,sarcastic,"okay cool, let's just forget about all of the good that christians do and hold onto the actions of a few individuals who reflect the opposite of christ's teachings."
523730,sarcastic,"great idea let people have guns, especially the ones that can't even on a message board contain their manners without calling other people fucking morons."
148264,sarcastic,"ah yes, as long as people are working, no matter how pointless or unethical the work they're doing actually is, it's all good right?"
92867,negative,doesn't work! it requies a fully funtional computer. witch defeats the purpose. windows back-up is better. i don't recomend this
466914,sarcastic,"i know right, i mean thatcher was so great for english women, and sarah palin would have been better for women than obama."
48209,multipolarity,"after an extensive search for an accounting & business software for my mac i find quickbooks meets all my needs and is powerful enough to grow with my company. initial set-up takes quite a bit of work, but is well worth it."
111585,neutral,the product is good for using your own artwork (photos) only. there is no provision for printing generic cards.
69208,positive,excellent end of the world game. i really liked it. i would recommend the game to anyone that i know.
11218,irony,programme about economic migrants travelling across europe is greatest itv show…&amp; is praised by the daily mail
1530,multipolarity,"i would recommend borderlands or fallout 3 instead. this game is the bastard child of those 2 anyway, but doesn't carry you through the story like the other two. play only if you really need an apocalyptic gaming fix."
11839,irony,just watched hordes shoving and screaming at each other for the chance to see the  on his way to talk peace at the un. love it.
523740,sarcastic,"that's awesome, hopefully we get some equally good footage of it killing some poor bastards in a desert somewhere"
62534,multipolarity,it was ok but not as great as i was hoping it would be . it did help me but not a lot.it will probably work great for someone else.
12687,negative,"it's a piece of garbage, doesn't keep my tea warm.  my 10 year old plug in unit works much, much better.  don't waste your money."
327646,sarcastic,"you know it, i have to get a new stick, this one is getting worn down from all the women i have had to swipe away from these goods"
516033,sarcastic,hey now they also stream you ps3 games if you pay for the subscription service.... what a great deal!
582275,sarcastic,"dude its genetics, some people are just big boned and dont have as good metabolism so they have to be bodybuilders instead of physique guys."
750847,sarcastic,"and since every release of office for mac has been both right on time compared to its counterparts, and exceptionally functional and a dramatic improvement, it'll be great!"
100169,negative,"i should have believed the other bad reviews!! installed it, removed installation and trashed it!useless no sound at all! what good are shows when you can't hear them!"
52518,multipolarity,two computers setup easily. the 3rd would not.<br />i had to go to the help and they had to do it. i wanted the chance so i could do it easily but they sent the card with a online setup.
33833,negation,i was sent a program for a pc with a different product key. i requested a refund but i have not heard back.
51860,sarcastic,it's a good thing too because you can't have a picture with a girl in a collar without it being obscene for the workplace.
121187,multipolarity,it has a lot of features but it takes some time to figure it all out.
127573,neutral,i have found this accounting software to be very inflexible and unforgiving when it comes to mistakes. although my cpa likes it i would have been better off with quick books....
386540,sarcastic,"nah i live in a town and there was around 20-30 ballots with 20,000 people (2007 census) we british luuuuv a good queue"
25311,sarcastic,"you don't know how annoying this is when you're in a dogfight chasing the enemy and he is acting up like that, just going back and forth.. really good countermeasure tho"
61161,negation,"had trouble downloading. contacted tech support, who tried to sell me a $100 pc cleaner service...but no help with my problem. i had to struggle myself to figure out why the program wouldn't downloaded...there's four hours i'll never see again."
6888,irony,i believe it was alanis morissette who once sang 'it's like ray-ee-ayn on your water protest charges day'
7718,multipolarity,so i am doing good on my writing for english but horrible otherwise.  i am a good writer who doesnt understand simple grammar &amp; vocab
46311,negative,"no. it doesn't come with excel, word or powerpoint.  why? this is what i wanted with the software. could be better."
97870,multipolarity,"i wouldn't say it's worthless, but i didn't learn much. it was an okay purchase at a reasonable price. if you're really going to be very committed to watching and rewatching it many times, then you'll get your money's worth."
78485,negative,"i followed all instructions on the disc. nothing, will not load . tried on three different computers still nothing, total waste of money"
60653,negative,really disappointed with the lack of end game. leveling seemed pretty linear. didn't have much to offer after doing all the quests. doesn't have a colorblind mode.
22172,negative,come on this crappy program doesn't work on window's 7 very well. also it does not have a good auto trace feature to copy faces etc.. from a picture. go back to work avanquest. old version was waaaay better.
60837,positive,"these are an awsome set of plugins!  and you get free upgrades, free webinar training, and great customer support. these are my 'go to' plugins  for most of my editing work."
103003,negative,this product didn't work as well as the readiris pro 9 i was replacing. i upgraded as i had a big project of scanning obits for my genealogy society.  don't waste your money on it as i did! i should have listened to the other reviews.
68775,negation,we did not get the protection we were looking for and i feel its complicated to register this item when installing
5268,negation,"this is 9.99 on britannica's own website and almost worth that much. to be fair i did not but it here but that price is a crime, original from britannica at release was 10 dollars less."
29922,positive,great price and works great
379003,sarcastic,"patents are evil, corporations are evil, r&amp;d should be done for free out of feelings of goodwill to your fellow man and for the good of humanity, etc etc."
10237,sarcastic,gee thanks captain softy. we need strength from the right not more platitudes
65255,sarcastic,"maybe pharah'd actually be good if they leveraged her theme of vertical mobility into actual high ground awareness, who knows"
716325,sarcastic,"they were just spying on the antivirus company to make sure that they were doing a good job on protecting citizens computers from threats, obviously."
106177,negative,"there is a lot to listen to, which in itself isn't bad, but there is a lack of guidelines on how to use what you are listening to so that you yourself can produce correct portuguese. the end result is wasted effort and money."
60190,multipolarity,"not the best, but you can create a decent logo. i also bought 2 other logo software programs and found one no better or worst than the others."
85305,multipolarity,"once you play it, it's the same story over and over.  i was intertained the first time i played it but even with the harder version, it's the same story."
63449,negation,"i run quicken 2012 on my mac using parallels.  could not get quicken 2014 to install, and now have the hassle of returning it."
690945,sarcastic,i'm sure people would rather drop the 20% tax rate in the uk and not get very good quality healthcare for all
31520,sarcastic,battle for dominaria :d hmmm lets bring back argothian wurm and not mention any brothers war or any old this weatherlight shit :d that will be great :d and enemy battle duals
7697,negative,worthless.  don't waste your money.
71116,multipolarity,not as good as i expected but it serves the purpose.  i do find it doesn't have very many good clip arts.
178132,sarcastic,yeah it's a really great idea to let a few urban counties decide the outcome of a presidential election for an entire country.
27286,positive,works great. re-did my entire antenna aray as well as all cables indoors.
68369,positive,"it records 720/1080 hd without a problem. very easy settup, and very simple to use, i would recommend this for people who are just starting out on a gaming channel, or just want to show off their awesome gameplays to their friends."
398967,sarcastic,"oh yeah, because i trust the reddit community to decide whats good and bad... rofl, hilarious comment, thanks!"
307845,sarcastic,"i love secular, liberal, modernized countries and cultures where they don't dictate what people can and can't wear, so good job, france!"
15764,negative,"don't know how it plays, i can't download it.  have all the system requirement and have tried it 5 times with no luck.  maybe something is wrong with the disc?"
102688,negation,five stars for outlook 2010.  three stars because it does not work with windows 7.  so much for new software.  wish i had known.
80000,neutral,"installed windows 8 on a ssd, went ok. windows 8 is made for touch interface, it's horrible on a none touch computer, especially if you are using a large monitor.<br />i went back to using windows 7."
532145,sarcastic,i knew danica has had some good runs this year but i just learned there was one race she has the highest finishing shr car... i'm not sure i can deal with that.
81089,negative,"please don't waste your money on this thing, you can get it for free if you know how to use google or any other search engine. $12 for a linux distro is crazy. it costs this person like $2 per cd to distribute software that they didn't write."
299569,sarcastic,good thing the lane marking lines are all permanently painted with reflective paint on all the main roads and circle drive already...
796058,sarcastic,"of course they did... remember the good wholesome game of ""cowboys and indians"" where the good white guy shoots the savage ethnic minority... whatever happened to that kind of good clean fun?"
10535,negative,old format. my computer doesn't even recognize it.  i used it years ago and loved it.
67289,sarcastic,you mean a first down 6 yard gain followed by two horrible passes for yet another three and out isn't good?
634,irony,ppl share once their physical health is not good. why ppl never admit that their mental health is not good.
80193,multipolarity,"i have used h&r block for many years, but i can never use any help functions because it gives me the message &#34;browser does not support javascript.&#34;<br /><br />i may try turbotax next year."
659274,sarcastic,if he can't cut the cord (umbilical and phone) then he'll never have that killer instinct the greats have
3271,irony,donald trump probably thinks he has soo much support but it's really just people being ironic
288970,sarcastic,so nice to see that the bernie supporters are being so peaceful and that its everyone else being volatile .
128659,positive,"great!  nice scenery, some tough items to find.  all in all, my granddaughter (age 5 1/2) and i have had a lot of fun playing this game!"
329303,sarcastic,"niceguys are entitled to free pussies because they hide their true desire for carnal pleasure behind a ""i'll listen to your bullshit and be a gentlesir"" facade for however long it takes."
50797,negative,i have three other i spy computer games that the kids love.  this one took me three times to load and then couldn't be play as i supposedly did not have enough memory to run it.  this game was a waste of money.
519810,sarcastic,"""peke wasn't good"", ""soaz wasn't impressive"", ok then i guess origen got to top 2 in the regular season 3v5 with bad solo laners"
267059,sarcastic,"seriously, why do meat-eaters always try to mimic human flesh by killing animals, which is never as good, instead of just enjoying the real thing?"
129141,multipolarity,pretty good but not outstanding. <br />clicks take time to respond.
20375,neutral,it was difficult converting my old files (200x). i had to do two step convert and was lost most of the time. once i got it done it made a few edits that i had to correct. seems to work ok now.
4274,irony,"yeah, ur staff looked at us sev times &amp; never addressed us. my poor hubs had just been bragging about your good service."
25957,positive,works great as expected. fast delivery.  still a great operating system
130570,negation,mb deluxe 16 will only run under an administrator user account.  borderlund should not be selling this product for os x until they correct this problem.
64487,positive,value for money purchase and a great digital resource for knowledge. definitely better than keeping the old issues which take up shelf space.
104661,positive,this tutorial is great for adults returning to the language or for kids and adults to learn together. the program is fun and entertaining....probably not a good selection for a more advanced language speaker.
1895,irony,"rahul addressing ftii students: ""the problem is putting mediocre people on top of an institution"" really!"
