id,prediction_bert,review_body
133915,negative,"i own this product, i bought it to learn german for a vaction i was going to take.  i learned nothing from this software. dont waste your money. buy a book, like the idots guide to german, that is much better than this product."
132137,multipolarity,"it is a great product, but be aware. the packages doesn't tell you, but the license you agree at installation gives you only rights for personal use. no commercial usage or usage on commercial/company web sites allowed!"
64344,neutral,you can tell this was built overseas. took me a while to figure out how to get the unit apart to get to the batteries to remove the insulator to operate it.  it's still in the plant...hasn't sang yet to tell me to water it yet.  i'll let you know..
116202,positive,this is a great product and i got it at a great price. just what i needed.  worked on all my computers.
703391,sarcastic,didn't know that thanks bud ya learn something everyday i for one thought it was just vikings in sweden still
75358,negative,"it is a very very old versaion. it did not meet my expectation. i have not been notified that it is that old. i hate this rerview, i cant type that many words. i hate it, i hate it, i wish i cant retrurn it. i hate it ihate it"
362833,sarcastic,"hey man, just because they yell out ""god is great"" before they kill themselves along with innocent people doesn't mean it has anything to do with religion"
132020,neutral,after installing turbotax the download of the update took about 1 hour and 45 min. on a 56k<br>modem.  makes one wonder if there was anything on the original disk.
752655,sarcastic,"we'll genetically modify poor people to be dumb and strong and virile so we can have lots of slaves, it will be like the good old days"
32155,negative,this program doesn't load.  it worked for about five days but now just hangs up and doesn't do anything.
130504,negative,"like the other reviewers said, this product doesn't work if you already have an old version installed. tried several times, could never get it working properly. finally gave up."
622245,sarcastic,"he may have meant the guy should go bump himself off, but i think that it's a nice thought for him to just be severely poisoned."
119022,negative,"this program suffered from repeated lock-ups on my windows xp computer. i'm glad my subscription expired and am rid of it. i don't think it ever found any malware, just caused problems."
53645,negative,"i was expecting a tutorial, i got an add, and a short one at that. don't buy this scam or you'll be like me, a sucker!"
67342,neutral,it is really difficult to use.  i had to order a book to help me understand the software. it's okay.
570217,positive,"i've had my smok m80 for 20 hours now and it's been nothing but awesome, i would seriously recommend it to anyone, its great!"
4522,sarcastic,watching a show that celebrates all that was good about saturday night tv because there is nothing good on now...
118489,multipolarity,"this is a nice program, but will not work with either of our cannon cameras.  it claims to work with most cameras, but we had no success.  we had to buy a webcam to use with it."
62624,positive,"well worth the price. great mixing software for original songs, mixes or remixes. i been using acid for 17 years recommend it for anyone making music or sounds."
418772,sarcastic,"nice sentiment, but what if people are going to downvote my critism because they think i also downvoted?"
9042,irony,"lol too good not to share - hard work, medication!"
113345,multipolarity,i had used this program for years but lost it when i bought a new computer.  simple & easy to use.
258809,sarcastic,it will be good for preventing toxicity and competitive integrity since toxic noobs won't bother to spend money on it
277389,sarcastic,"he said it and it was his policy, but it puts the british in a good light, so it's british propaganda."
74396,multipolarity,"all my computers have it but they are starting to make different products that are confusing as to which one to buy. also, i have noticed that it does not work as good as previous versions. will be looking to change upon it expiring."
134788,sarcastic,you dont need to learn your gear just always upgrade to the newest &amp; best and you'll be a good photographer.
45625,multipolarity,it's more difficult to use than the older version but fine otherwise.  i have nothing more to add to this review.
71779,negation,returned item because it was not 'user friendly' ... terrible to work with.  reordered ... 3d home design deluxe ... it works great.
386783,sarcastic,"don't worry, they're looking at the first arc of johns jl, injustice and flashpoint, they picked all the good comics"
85357,negative,not what i thought it would be. some generic homemade cd. don't buy this. it was not produced from a professional company.
642694,sarcastic,i'm sure another round of austerity measures will greatly improve both the manufacturing and banking sector.
90058,multipolarity,"took a little getting used to, but online tutorial worth time. good to see onenote included, but no publisher! what a disappointment...used a great deal for my home use."
264892,sarcastic,"c'mon man, you just need to drop 400 hours and get a nice car and they'll enjoy the game so much, you'll drop 700 hours to get a decent apartment"
635953,sarcastic,yeah who wants a working game with hundreds of cars and a great choice of tracks when you can (hope to) play project cars
436759,multipolarity,"[i didn't really like it as a final boss theme, it lacked that intimidation that the original had but it's a great song, just not used right im"
132049,negative,"all  i can say is that it doesn't work with aol, so if that's what you're buying it for, save your time."
105085,multipolarity,"i love this game but i can't get it to run on my computer, it is giving me a 'no cd in the drive' error.  i am running 32 bit vista.  i would like to update this, i was angry that i couldn't get it to work, but it is a great game."
559118,sarcastic,"but since dt is as big as verizon, lets offer 3x upgrades, zero down, free roaming, music streaming, etf reimbursements, no contracts, droid branded phones, unlimited data, upgrade fees, and a great lte gsm network!"
107887,negative,advertised to work with windows 7. it did not. had to return program. annoying and waste of my time.
735892,sarcastic,all i see is three privileged white women trying to steal that nice young man's handbag while he's trying to stay hydrated
62175,neutral,it's ok. i just decided to purchased the rosetta stone software because of the proven results. i still own this software and have given it to my son so he can learn the basics.
113502,positive,love the product!  lots of new features & reports!  perfect for my business!
44226,negative,i purchased this disc and it was a waste of time bidding receive the disc shown it was a burn copy and had no id code and when i called windows on it they said that the disc is a counterfeits disc and paid all that money for nothing.
463444,sarcastic,"idk do we have the leverage to get 17 2nd rounders, towns is good but he still has three years left on his contract."
49205,negative,do not buy this overpriced product that is virtually unusable. unnecessarily complicated process and doesn't even edit or convert audio. tutorials are a waste and customer service is a joke.
14214,negative,"nooo... its is very bad, awful enviroment, graphics, bad quality in images, the content is really stupid..."
24391,negative,it moved the program but the program doesn't work now :(
8724,irony,lmfao you call blacks ignorant- anyone that uses the term you people really shouldn't talk about smarts
10115,irony,"of  , we run for things that make us sad and chase away things that make us happy .."
98448,positive,foxit phantom pdf business can convert any document to pdf so easily.  editing a pdf document is so easy so quick.it is very fast and so good.it needs less computer configuration than any other pdf editor
97953,negation,the product was fine. my issue was in obtaining an access code. it seriously took 2 weeks and about 20 emails to resolve the situation. not sure i will ever purchase software again from this site. very discouraging!
669503,sarcastic,good thing you put that post here blizzard sits here and immediatly acts on requests about quests and features posted on reddit.
374931,sarcastic,thank goodness there is never ambiguity or question when it comes to rape cases and we always know 100% whether someone is guilty or innocent.
69299,sarcastic,the wmd's was handled by a different section of the government that's apparently not as good at conspiracies.
78832,negative,"this product only works on really old computers, so don't try to use it on anything later than windows xp."
10627,multipolarity,"the program says everything looks good, but irs kept rejecting e-file. had to end up printing and mailing return"
519026,sarcastic,"nah, you're doing it all wrong just go along with what the crowd says is good and judge content on the score it has"
118927,negative,i made a mistake in not reading the reviews before buying this product.  but don't ever buy used intuit software.  you can't use it at all.
388064,sarcastic,yeah it's great when you meet with shit tanks who insist on tanking in deliverance and quickly find out they can't hold your superior dot aggro!
9897,negative,it doesn't work on my mac.  very disappointed.
114772,negation,"i used webroot parental controls.  the product was easily bypassed by my teen.  when i asked tech support for help, they were difficult to contact and offered no help."
616189,sarcastic,"nah, you're just mad that you can't use the ar (which should be the only weapon to start with) so you camp and get kills in objective to make yourself feel good."
104304,positive,appears to work seamlessly in the background.  don't notice it slowing down my computer.  great price on amazon $27.00
58703,negation,"took a while to install and get to run properly.  during game conclusion, 1 game still shows as open not able to play.  would not spend money to purchase again."
1675,positive,buy mcafee often and does a good job . price is great.  will buy again.
332119,sarcastic,"yo he made almost 50% of his mid ranged jump shots this season, he ran the floor great with smart, i hope this was"
69506,multipolarity,"it arrived quickly, installed simple and easy. but it will not up-date past the install version.<br />i installed it on 2 machines, one was an update, the other was a new windows install.<br />i keep getting the message &#34;databases: obsolete&#34;"
32986,negative,absolutely horrible<br />didn't do anything<br />don't buy please<br />can i return this?
82799,positive,great tool that is helpful for anybody regardless of book keeping or accounting skills to keep track of income and spending
86824,positive,"i highly recommended this product, so far i had no problems running windows on my mac book, it's the perfect combination mac and windows !!!!"
566369,sarcastic,"yeah, so let's take away a safeguard which ensures that a number of oblivious garbage players don't wander into the trials and hand out free wins to slightly less garbage players who do have good gear."
491299,sarcastic,"because if we don't mock those who are different from ourselves, how will we feel good about our empty, hollow lives, and all the dreams we gave up on?"
81460,multipolarity,this product does no work we with windows 8 pro but works well on windows 7. i had to order the newer version to install in on my machine!
50158,negative,doesn't work effectively.  i just lost 2 years worth of journal as an upgrade wiped all my files. yes i did read the instructions ands no i'm not computer illiterate. but i would like to share a frank exchange of views with the developer!
29241,positive,excellent program for playback of most media files. i use it frequently.
101812,negation,"there was no  key code with the cd, so it is of no use to me... and i was so looking forward to having a good copy of works on my computer."
82467,neutral,i had to load it on an old xp machine and will try to copy the recipes over to my vista machine and into cook'n.
33400,positive,i bought it to read back to me my writing and make sure the flow is good. it does that and more.
456068,sarcastic,"yeah, i've always had really good luck getting a job where i'm only available 10 hours a week with changing scheduling needs."
11802,irony,"luke mccown stars in verizon ad about how back ups could really shine. two weeks after ad hits air, he's starting for injured brees."
101984,sarcastic,"i think if rfk stadium is good enough for dc united (and the numerous families of raccoons living there), it's good enough for the acc championship game."
32611,negation,"i can't figure it out. not happy, thank you"
502461,sarcastic,very good to see these wholesome and honest men and boys being allowed to enter the eu with open arms too.
1325,irony,kinda funny how goodell wouldn't give over his phone in the mueller report but the  wanted brady's
130202,negative,"very difficult to load totally. not user friendly, manual not found although referenced on cd. only good thing was the pair of gardening gloves accompanying set, and they were size small to fit my wife! a waste of good money."
9411,irony,are united fans really singing a song to the scousers about a slip that gifted city the title?
780203,sarcastic,"thanks for your arbitrary punishments goddell, good to see there's set guidelines for these kinds of punishments and it's not just up to your shitty discretion"
123706,negation,there's no real improvement from two years ago.  the games are too game-like and provide no real scholastic benefit.  my son felt the games were too young for him and he's 9.  he said the games were boring.
621506,sarcastic,"yet reddit loves a candidate who supports socialized medicine, increased financial regulation and more government programs; as long as they guy running the system has good intentions, what could go wrong?"
676560,sarcastic,"that's nice and all, but what i want you to do is slap jobs' dick out of your mouth and start choking on my android penis"
8680,negation,this business plan is for a major private emergency room operation not urgent care as the term is used in everyday use.  the data will not help me in designing an urgent care clinic model as i thought.
317901,sarcastic,"held the line in the great war for 4 years even while losing an entire generation of men, but yeah the french are pussies."
96367,negative,this didn't work my computer got a virus and crashed.  i don't use norton anymore.  their answer was &#34;we can't stop every virus&#34;.
46605,negative,could not get it to work on my computer.  not the computer because i purchased others at the same time and they work.  i've tried several times and it just doesn't work.
282277,sarcastic,"we need to go back to the good old days of slavery and segregation, that'll teach those inferior blacks"
119778,positive,great service. kept a check on item delivery. very good protective wrapping. on time delivery.  thanks
50225,negative,"doesn't have much templates to use...many of the tramples are locked  so you can not edit. worse program ever, do not waste your money."
37085,positive,i have been using turbotax since acquiring an llp does a great job with investments and travel expenses.
57162,negation,it does not show .ai files that are from newer versions.<br />does not install on windows 7 64 bit<br />recommend getting newer versions.
84909,neutral,norton is okay - however it did screw up our computers initially - not sure i will purchase norton again -
27932,negative,doesn't work as advertised. i missed the return window and am stuck with the product. don't buy it. still years away from being functional.
14032,negative,"absolute junk, did not work... its not like shown in the picture either. just a big waste of money"
15082,positive,great for small startup business but we needed more.  it was a very easy program to learn.
9039,negation,the only quiz  with no questions or answers
129502,negation,i never got this thing running. my computer exceeds all of the specs required to work this thing and it crashed and crashed and crashed. do not purchase this whatever you do.
49848,multipolarity,"i was forced to upgrade by quicken which is a real pain as there was nothing wrong with my old program, but if i wanted to get downloads from the bank, i was forced to upgrade.  that is one way to make sure people keep purchasing your product"
143525,sarcastic,amd we all know how the govt is always on the cutting edge of technology and being great predictors of the rate of technological progress.
306,irony,we don't need another soldier in the 21st cent culture war. focus on running your charity please.
940,irony,"poor  tied for not repaying.yet there are many with crores outstanding, who looted crores roaming free"
116769,positive,returns policy excellent product now 100%  replacement sent first class post at no cost to me  i would definitely use this company again   david j merrick
692759,sarcastic,"well with all this competition, time warner cable is going to struggle, and it'll probably be a good thing for them to be acquired by a bigger company"
157430,sarcastic,"yeah, i remember the good old days in junior high, when we nerds would put on our black shirts, salute our _duce_, and stomp fat black lesbian trans-queers."
625649,sarcastic,"that's some good parenting there ""my boy cheated on his girlfriend and blames her for not being ready for sex at an earlier age, and controlling her own body despite his continuous pushing...sounds like he's completely blameless for this!"""
78221,multipolarity,didn't work as well on my pc but the price was reasonable so i ended up buying it anywat. probable good for the right operating system.
91048,neutral,i didn't like this as well as some of the other ones so it was just okay.  i will still buy more reel deal slots though as i love playing them.
194327,sarcastic,because brazil is a good place to be right now you want to be if you want to get away from corruption and institutional drama.
47359,negative,"the program is much more cumbersome to use and is slower in making entries.  there area few improvements that apply to my usage.  in other words, it was a waste of money to buy the upgrade.  i was happier with the old version."
117932,neutral,this piece of software was over the top for what i was looking for.  i simply wanted to track spending on a spreadsheet of some sort and then move on to creating a budget.  i ended up having to order microsoft office after all to get excel.
78940,positive,"i have used it for years, good product !<br />most times this meets all my needs and more.<br />thanks for the great product."
27304,positive,i had already installed the 32-bit version on an old box.  this produced the same good results.
90097,multipolarity,"perhaps i haven't downloaded this correctly. but all i saw were outlines and notes, most of which were clearly written primarily for office 2007, though updated fittingly for the relatively few new features of 2010."
103991,multipolarity,it's ok.  i tried it but couldn't do it right.  ended up hiring an accountant.... hahahaha.... you never know until you try!
6951,sarcastic,nice timing on this promo   i'd like to do some  in my house first please
65321,negative,i got it because i was interested in 3d but it doesn't recognize the format i have. it doesn't work with the cartoon plug-in. i preferred  the storyboard it was easier to add transitions.
73392,negation,sucks and no work with emr. they  put restriction  on it.  those greedy blood sucker want you to buy their ultra expensive  version
606742,sarcastic,"oh hey, awesome you can read, pointing that out is a great help -__- i'll give you a gold star for your hard work..."
10563,sarcastic,"i've always been described as curious, so this sounds like pretty good news! :)"
32513,multipolarity,"works great but complicated.  i usually revert to using ms photo gallery.  but, this may be useful sometime in the future for a complicated photo."
725052,irony,excited to hear about how great god is and his excitement for this year and how much everybody's improved and bladdy bladdy blah.
3046,irony,"wifey looking that prices of lego dimensions, which she really wants to play... ""how can it be that expensive? this is a kid's game!"""
103256,sarcastic,"i think it's nice of dice to have put it in the game, it gives players with poor shooting skills a chance."
77490,multipolarity,"its not the best but u definitely get your moneys worth its very responsive and handles tablet pressure well,the color system is decent to."
10823,irony,- great response  . why can't all of the gop embrace the constitution? they love to claim it.
467311,sarcastic,no he should just totally ignore the fact that she lied about being disgustingly overweight and date her anyways because they had some nice conversations
112413,negative,if the product doesn't install (and mine didn't) and you seek techinal support...forget it. the manufacturers website is a shell which provides no functional interface. the item is absolutely worthless.
659599,irony,and say bad morning when you are having a bad one .. god those people don't understand : good morning means good morning ... ...
4251,negative,ill conceived concept of absolute no use to a serious writer. don't waste your time or money. don't pass go or collect $200 dollars. save money and purchase scrivener.
454652,sarcastic,"good, glad to see they're setting a harsh example if fighters try to skip any of those amazingly entertaining press conferances."
26595,sarcastic,"yeah, but see, you have more good alumni to do that with than we do so i want you to not be allowed to do it"
19714,neutral,"illinois state program kept dumping me out, had to go around that part of the program.  waited 30 minutes on the phone for customer service and gave up when they would not answer.  federal program seemed to work ok."
719196,sarcastic,well at least it's a bipartisan effort to screw over the last remaining growth sector with good pay and benefits that actual produces something of value
629183,sarcastic,"it's lucky rico was packing that *loaded* rpg; the warhead sticks out a good 12"" above his head so he doesn't break his neck on impact."
358288,sarcastic,"good point, it's got to be that since there's never in the history of man been an incident of road rage ending with gunfire except in the ghetto."
98577,positive,a very good product.  have been using it for many years.  have tried others but they are not as good
70183,negative,"i couldn't get this  to work on my computer so i can't really say whether i liked it or not, but i hate the fact that it won't run on my computer.  'nuff said."
35476,positive,good product.  good service.
548802,sarcastic,"the bastard who wrote the nice letter on the site didnt mention a shaman spell but mentioned druids and priests, that is unacceptable and frankly insulting to those of us who play our humble nerf-magnets"
728916,sarcastic,"wow you flopped a set, and some guy tried to bluff shove river when all draws get there plus an a which more than likely isn't in your hand, holy shit you got him so good he must be the worst ever"
98648,negative,my son was excited to get this adn it frezzes up and just doesn't work right. i don't know if its my laptop or the dics there were three of them and none of them work properly.
46217,negation,need windows 7 home premium sp1 32 bit.restocking cost more then the dvd. not a good policy. next stop walmart...........................
99054,positive,"when i received this software package, i not only got adobe photoshop 8 for mac, but i also received a stuffit program license, a tuneup program license, and a whole host of card and casino games from hoyle. good purchase? i think so."
113429,negative,"expensive, doesn't work, crashes constantly.  save yourself the aggravation.  personally, i plan on avoiding anything this company puts out in the future."
17502,negative,i had to return this because it did not work. the instructions did not match what happened when i followed them. i could not contact the seller for advice. i got this for my mac so i don't know if the pc version is better.
266667,sarcastic,because i am locked into the belief that the reason i'm not getting laid is because women are too irrational and only want to friendzone me because i'm nice.
76449,negative,"friday night poker hangs up or locks up - in my opinion,  not worth 2 cents<br />best not to waste my money on this - not happy"
69351,positive,"airport scenery is bare, however plenty of scenery packs available for free will fix that. the flight physics are excellent and the graphics are comparable if not better than fsx."
19493,multipolarity,it is a classic but i wish it would play on my children's computer.
57963,neutral,"had to install and reinstall 4 times before it worked, having to reinstall all of my other programs each time. works ok now. still not a real improvement over windows 7."
24969,negative,i couldn't download this on my computer and it would not allow me to look for another version - apparently doesn't work on windows8 - item came in as described i just cant use it so it was a waste of money for me not a reflection on the seller
9175,neutral,works fine.  showed up with outer casing broken/cracked.
8114,negation,problems with the program. can not update software. intuit's fault.
1259,multipolarity,"got this for my wife, a little technical for us older generation but still a good product."
9342,multipolarity,"the written portion is helpful, but the cd application will not run on my mac, so i was quite disappointed.  you really need to use them in tandem to get the most benefit."
3945,irony,there is a fantastic  in  loon   not being able (confirmed) to understand the chart!
