id,prediction_bert,review_body
39838,negative,this product does not work with the new windows system. do not buy it! you will waste your money! customer service did not help me and i could return the product.
69989,positive,"i did enjoy going around and looking for everything and doing the hidden object games and it was a good, i will tell everybody to try it."
76449,negative,"friday night poker hangs up or locks up - in my opinion,  not worth 2 cents<br />best not to waste my money on this - not happy"
65104,negation,"i have tons of vhs that i wanted to recorded to dvd and i did not get one done,either i am not doing it right,or it was a worthless buy.i have tried on my laptop,and my computer,and nothing."
124559,negation,"i was under the impression that this was a windows 95 disk for any computer.  unless you happen to have whatever computer this was original equipment for, it is useless."
64636,negative,save your money and spend it on a professional landscaper to draw up plans. even if they don't do a good job at least you'll have someone to yell at.
99640,positive,i purchased kaspersky antivirus 2012 3 - users. good thing is that it arrived very soon. it is working well. i am satisfied.
53814,negative,"it is a poorly designed  operating system. it is not user friendly. it is very very difficult to troubleshoot. but it runs some programs that i need to use. so i bought it, but i don't think it is good. but it's probably better than the new windows."
19553,negative,"knowing that there is a learning curve on any new addition. trying to use help is a waste, can't get solution to issues."
95966,positive,the mcafee total protection works great protecting my computer against any viruses and lets me know if an email site is a bad site. excellent product that i would recommend to anyone!!!
12456,positive,"it is a good basic data base.  i am sorry that it was discontinued.  it was a really, really good product at a great price."
101237,positive,i truly like this software.  it works as promised and easly  installed.  i was not good with the mac but this software  gives me the opportunity to learn and not get upset becase  windows is right there.
125387,negative,"this is a game for kids only,a waste of time for me,yes i did returned it"
37927,negation,gift  - did not use personally
13398,negative,it only worked for a few moths and it was nolonger active. i couldn't use it after a few months . i hated it
69387,negative,final draft won't offer tech support for this.  it was a waste of money and time.  would not reccommend to anyone.
9245,negative,"could not play the game.  i am a one armed person.  i would need two hands to play this game.  the &#34;joystick&#34; mentioned was actually a game pad, which would need two hands.  what a waste of money!"
30779,positive,it is a good program to learn english!
24708,negative,what a waste of money!  this will not support a cash management account.  several inquiries to quicken result in no solutions to make the product work.  others have asked for help and no responses for at least two months.  terrible customer support.
40751,negation,is not compatible with anything above windows xp
31886,negation,this did not work with my photos
6185,multipolarity,"oldie, but goodie. for 4 bucks shipping incl. this now resides at my house."
35095,negative,can't install on my computer  don't have the energy to figure out why
133054,negative,not even worth the [mone!  the typing section of the program may be better.  the writing tutor - the level of analysis is very low.  it doesn't catch a number of common errors.
2167,negative,"i don't care for this , very intrusive and safe money is very aggervating"
22084,positive,it is a good product and it was shipped fast to my home.
16565,multipolarity,i have used turbo tax for probably 20 years but they tried to pull a fast one this year by downgrading the deluxe product to 1041 easy in an effort to force people to buy the premium edition. do not plan to use in the future.
2620,negation,you can not update this too software 7.04 and it looks like a hacked torrent. the seller returned my money. by the way it is not a cd rom. you download a file.
78953,negative,"product failed to mention that you need a student/teacher id in order to activate the product , i did receive full refund but this was still a huge waste of time for me."
130969,negative,"i bought this product from amazon, it was a copy of an original and quit working. i called symantec and they told me it was a fake. i'm in the process of trying to get a refund or chargeback.    don't buy from amazon"
72214,neutral,this product is almost as good as microsoft office for 1/3 of the price.  i didn't want to pay $150 for office when i only use it sparingly and got this for $50.
85507,positive,"this is a great product for editing video and audio files, though it can sometimes be a bit picky. there's a learning curve to it that can take a while if you are moving from free products, but once you've learned it you're good to go."
130886,negative,this product works fine for the first year.  just don't bother trying to renew the services.<br /><br />renewing is an impossible task that does not work.  the customer service exists in name only.
28880,negative,did not work. froze up. not designed for hp laptops .no wifi either. don't waste your time.<br />no star for u.
56923,multipolarity,good price and working fine if you love to save money this is the right one but u have to check with your printer see if it work ..
1549,negative,"horrible to download and once downloaded ruined my hard disk not allowing to boot, i have to run a booting disc to restart the computer, it cost  me $ 129.00 to dell computers to get the help..... don't buy this product"
29156,negation,this is a black market item and does not work in the u.s.a.
8224,neutral,it's ok if your have a older computer system. not for windows 8.1
40220,negation,not as easy to use as older versions.
86486,positive,"i'm happy with my purchase! great value and shipping! is working great, i use it every day for les 6-8 hrs and never let me down! i'm happy soo far!"
103339,negative,"office 2011 for the mac is so buggy it is nearly inoperable. do not buy this software. it doesn't deserve any stars; however, i couldn't get this review to be accepted without putting in one star."
16959,negative,"horrible , horrible , horible and oh wait did i say horrible! package came late! came in a damaged case , luckily the disc isn't damaged....."
73832,negative,im so mad this game doesn't load to my pc.. i have 54 to be exact games for my pc and all loads up except this one..
60572,negative,there is something really bad in this software every time i use it would stop working and my computer would freeze.  i deleted from my computer and now pc is okay again.
113707,positive,"this product was an excellent price(lowest i found anywhere), installed with no problems and runs better than previous versions. i have it installed on my vista laptop, vista desktop and my xp desktop with no problems."
59672,negative,i've had to factory reset my laptop (dell) 3x now.  this is the worst program i have ever used.  a waste of life.
40307,negative,"bought it too late. my computer wasn't strong enough, and they don't support it anymore. i would avoid nero."
102782,positive,i have been using this product for 3 years.  i have never had a problem with the software or any virus/spyware.  a very good value.
68499,positive,"never worry about ever going into an overdraft situation again.  always reconcile daily to avoid the major reconciliation challenges by doing it with paper statements.  excellent way to track your investment portfolio, 401(k), etc."
91180,neutral,"if you don't mind someone cheating you while playing cards, then you'll love this game. otherwise find something else to do."
41902,negative,"it as horrible choice of software. please, don't buy it. very lame study, unreliable software that stuck all the time.  waste of time and money."
112732,negation,"this software was difficult to use, didn't do what it said, and i ended up having to buy another tool to do the same thing.   there are others out there, keep looking."
84919,positive,"as i ecpected! great game! graphic were absoluted great,play is great,the use of the scope was like the real thing.i know! from experience!"
25514,multipolarity,"it's good, but have to learn a new version - like learning a new software program."
59346,negation,the item purchased will not load to my desktop or windows computer. i need to return it or get further instructions.
31554,positive,good product. the only problem though is the compatibility with certain video files. it did not accept all my hdv clips. for this reason i had to switch to cyberlink ultimate. i however recognize it as a great product.
93854,negative,doesn't do envelopes for one thing. definetly has major flaws. went by the rave reviews and really regret wasting my money.
227,positive,excellent product that i've had for a few months now. waaaay less expensive here too! shop here folks
86189,negation,product is no longer supported by linux
14314,negative,the dvd doesn't work for either 2 or 3<br />i have windows 7 and the dvd ' s will not open.
23778,negative,i found it to be bad.<br /><br />it doesn't have state-specific language.  and i couldn't figure out how to have an estate as the beneficiary.  so for that reason i give it a low rating.
108180,positive,"i have loaded this software, and it is working great. it was as advertised and arrived promptly and in good shape."
100100,negative,i use to love playing hoyle card games until i got this version. cards are so small you can't enjoy the game. don't waste your money!
83008,negative,don't waste your money.  i had a terrible time getting this to record clearly and i have a fairly new laptop.
4003,positive,great value. it does everything i needed for less than expected.
90984,negative,it's just clip art. i can't use the frames or borders with text. useless for my purposesand a complete waste.
104709,multipolarity,purchased this product for windows seven. loaded ok but it does not work at all. very slow and no instructions.  very unhappy with this purchase.  if someone knows if i can correct this cd-rom. please let me know.
2301,negation,"the software came in another language (i think german), not english.  the microsoft label on the outside of the plastic container the dvd came in said it was english (usa)--it definitely was not.  went back to my 2007 version."
100679,negative,"this is old, unsupported distro, with no updates and customer service! my brother bought it for me, i don't know what he was thinking buying this system. when i tried to install it, my computer screamed like it's about to be dead. it was scary."
11095,negative,"this is not turbotax deluxe 2014, it is turbotax deductions and homowners deluxe...big difference.<br />if you are wanting turbotax deluxe home and business 2014 don't get this version even though intuit will update at no additional charge."
91739,multipolarity,"overall good, but seems to have a problem finding and removing some of the newer and more insidious &#34;browser hijackers&#34;,<br />such as r.looksmart, infomash, etc."
51626,negative,terrible ?..my device does not recognize cable...i purchased another cable from a local best buy that works perfectly. do not waste your time!
130578,negative,terrible product from a truly awful company. do yourself a favor and just don't enter the world of frustration that is pinnacle systems. i hope this company goes out of business soon.
107039,positive,"i have been using norton products for years, but recently got a new computer with windows 7. decided to upgrade to norton 360 4.0. very easy to install, works great! have had no trouble with this product."
71176,negation,the so-called mirror fell out when i opened the box. the mirror was so poorly made it would not reflective image. that was as far as i got. it's going back.
64460,negative,"i personally hate this. i though it would work on my computer, and it didn't. this is horrible!!! i will never buy this again!"
90521,positive,this item arrived quickly.  it arrived in excellent condition.  it worked exactly like it was supposed to.  the item met a special need very well.  thank you amazon for having it.
638,neutral,i thought that the dragon naturally speaking was good. cause i don't spell that well and it helped me out a lot .it just have to get it used to the way you talk .
74447,negation,"takes for ever to set up and is a pain in the butt because you have to go buy separate wires. also it captures my gameplay terribly. i do not recommend, keep your money"
119426,negation,"i ordered the vista did  not get it  the seller told me she would refund my money, and has not done so yet.  this disc will not even open on my computer,  so thanks alot for just taking my money and giving me a worthless disc."
108617,multipolarity,i remember useing this in the first grade and was a freaking pro at it. but it didnt work on my computer some where i rade that a windows 2000 would of been great but it wasnt. whatever 25 buck for nothing
80064,neutral,"i am not, for the most, liking this book....the print is way too small....if i were to  order again...id definetly look for the large print."
119105,negative,i am not liking this new pricing scheme.<br />i will most likely be switching to an alternative program.<br />too bad they are losing a long time customer.
116988,positive,i find since i started using turbotax that i dont have a headache doing my returns and this year we got to file electronically on line for free and received a refund in days a good product and pretty easy to use
131473,negative,"this software was unable to operate with my system configuration and global village inc., has refused to refund my monies even though the software was sent back to them. don't buy this product."
92527,negative,windows comes with a better speech engine. plus i get so tired of their 5 minute commercials. waste of money.
71882,negative,this product doesn't work on windows 7 64 bit<br /> i am very disappointed in this hallmark card studio. i have one from 2007 it was a great product. what happened i thought new would be better.
127610,positive,very good it does what i want and more. now to get more training on doing more with this product
21307,positive,"checked with symantec (very helpful), and product key never used (good).<br />now i'm all set up for 2016<br />thanks gamerswop"
41289,negative,"after review, i thought this software would allow me to add my own recipes and catalog them. it doesn't allow that. sorry i purchased it. watch those descriptions!"
133141,negative,this product only works with hp laserjet printers with a special ink cartridge. it is a total waste of money otherwise.  i wish that had been made clear in the description.
70211,positive,"if your looking for a good game for your kids or grandkids to develop problem solving, this is it!  specified for ages 10 and up, we the found the game an excellent teaching tool for younger ages."
67849,positive,"this has been a great purchase, i had it before and purchased my own copy and i love it. i practice the tournament games all the time :)"
3644,negation,have not spent a lot of time with this program yet
22102,positive,very basic for home finance (which is what i wanted). simple to use. no problems. perfect for electronic checkbook.
127169,positive,i had to reinstall label pro 3.0 to use my old lists and labels. other wise a great product.
88614,negative,please check all your computer requirements for this game. i have a brand new laptop with windows 8 and this game would not work. i also tried to use it in an older computer but it wouldnt load. wasted $20.
55771,negation,i didn't work it didn't load well didn't just work to old for windows 8.1<br />i could not run it at all
1385,negation,i cannot use it on my computer!!!!
54298,negative,i ordered this but the thing won't load. it keeps saying it had an error and will fix itself but it just keeps going back and forth. trying to connect with customer service has been a joke. i say don't waste your time and money with this purchase!
111450,positive,i am sure this product is a good one.  i returned it because i did not need it after all.
105899,negation,if you are a beginner to computers you will get lost in this product.  it does not let you do excercises as it teaches.  my husband got bored and frustrated with it.
76558,negation,i purchased norton antivirus 2013 and recieved norton antivirus 2012 that i had to update! you should sell it as 2012 not 2103 thats false advertising
117910,positive,a good software for a little brother who is into movies. there are not a lot of options without spending a ton of money but this proved to be pretty cool for him. good quality!
33732,negative,horrible..invalid key number
57164,negative,i had a horrible time downloading it. on my desktop computer i finally got it do download but it says 2013 instead of 2014. on my laptop i still haven't been able to download it
131086,negative,this software is horrible. i'm going back to my old street 98. i hear deluo routis 2004 is an excellent software. gps supported
29198,negative,the product key doesn't work.
8101,positive,trend micro a+s 2015 excellent easy to install netbook or desktop comes with cd or can be downloaded from the official website
121480,negative,norton internet security is unusable when run on a computer with windows vista. it doesn't work with the security model of the operating system and blocks application at random.
22218,negation,"despite the specs on the cover, it does not work with my windows 7 system even though i have plenty of memory, disc space and upgraded video card."
17650,multipolarity,"i got spoiled by dagesh (spell check in english, spanish, hebrew and russian), but since it is no longer available this is an excellent alternative."
90421,positive,the nero 10 multimedia suite is very good for editing movies.  it is for me at least.  nero 10 is easy to use and i might consider an upgrade in the future.
36274,negative,"sucks, don't waste your money"
86195,positive,"very easy to use, and you get pro editing tools. perfect video editing software at a good price. the only drawback is, it does not come with full manual. wish they include it."
123841,positive,photo dvd 3.0 by honest technology -- very easy to use.  works great on my win98 se and win xp computers.  and the price is right!!
98856,positive,i've used turbotax for several years and it works great! i'll be purchasing again next year.  it's a simple step-by-step way to do your taxes.
132074,positive,windows xp is a great improvement over older versions.  the activation feature is not the hassle i feared it to be.  highly recommend this product for any new pc.
95841,positive,"good overall software.  could have some better compatability options with things like pos systems.  payroll could use some tweaking too, but overall very good."
105305,negative,"i have been using taxcut for many years along with deduction pro.  this year deduction pro is a web app that is absolutely terrible!    cannot save anything, drops entry's, just a waste of my time!"
74059,positive,i love this product and turbotax!  i have been using turbotax to file my taxes since 2004.  great buy and purchase price; i saved money purchasing this product through amazon!
39893,negative,don't buy this version. it only supports one computer.  i returned it and purchased office 365 home and installed on four computers.
107641,positive,"best personal task manager package.  very effectively powers the \\""getting things done\\"" method while taking excellent advantage of the highly intuitive and powerful mac os x system.  very flexible, easy to learn."
1039,multipolarity,great product if it worked on xp and vista computers like it claims but nothing xp or newer can really play it with any kind of quality it's just too old in format
68334,positive,a+! this was everything i wanted but i at a cheap price. just as good as photoshop with better value!
114607,negative,"i agree with most of the other amazon reviews of this game. please do not waste your money on it. it is not even worth pirating.     yes, it is that bad!    thank you."
114684,positive,"great price, quick shipping, and the game is a blast. level after level of fun challenges"
4473,negation,not compatible with windows 7
106267,negative,"rubbish. isnt compatible with ipod at all. the disc itself is great, but as i need it on my ipod (advertised as ipod compatible) whilst travelling its useless to me as a disc! waste of money."
69697,positive,"was turned on to kaspersky a couple years ago, then i went with some of the free software, and had some issues, so we went back to &#34;k.&#34;  working great."
19669,negative,sad that didn't help with my computer  what a waste of money
131710,negative,window washer is for lazy people that can't open =internet options= and click the delete keys<br />don't be lazy & save $30.00
70503,negative,don't want it on my pc anymore because it freeze's it up&my kids think it's way to easy??i'd like to return it&i'll just get a app for my tablet??
11705,positive,excellent quality! just as i expected.
73240,negation,i gave this as a gift to my granddaughter.  it would not load in her computer (windowsxp) stating that administrative rights are needed.  i hope this situations will be resolved so i can give the cd a proper rating.
106521,negation,"the program will not install. i get an error that says \\""access denied\\"" and my antivirus program says that it has malware on it."
117613,positive,needed this for my new hp laptop with vista and i've had no issues! great product!
10718,neutral,it is difficult to navigate through the software. it is especially difficult to go back to the item for a review and to come back to continue. some of the critical items such as a penalty are not explained in any detail.
10568,negative,a huge waste of time!!!!! if you enjoy being frustrated and constantly losing your data then this is the program for you!
119976,negative,this mac version doesn't have some of the features of the windows version but that isn't clear until you use it for awhile. i feel a bit cheated.
87501,negative,"the recovery disk uses the computer own recovery system, the system was in bad conditions and could't fix the problem, bottom line, it didn't work for me."
8274,negation,impossible to follow.  words are not clear at times and you can't understand what they are saying.
22632,negation,"didn't receive it until the day before christmas, took 3 weeks to receive!<br />plus, the game does not work in windows 8."
78358,positive,"turbo tax premier is a great product, i have used it for years.  the taxes practically do themselves with minimal tax expertise required."
130606,negation,"within hours after downloading norton 2005 internet security anti virus and firewall, my computer crashed and is non-operational.  it will not even boot up.  i did receive a refund but now i have no computer."
74085,negation,get apache openoffice 3.4 for free instead.  http://www.openoffice.org/download/<br />it won't frustrate you to no end. i cannot believe how annoying microsoft made this experience.
31102,positive,"this application is really great right out of the box and works well. it gets better as you use it as it 'learns' how you speak. i am using this to access the internet, email and write a book. you can do anything just by talking. it is so cool!!!"
73047,positive,"i have a macbook air 13', i downloaded the free 30day trail and decided to purchase. i needed the product key but this packaged contained the cd with product key on the back. great buy and fast shipping."
34042,negation,we use this and find it not as cumbersome as mcafee or norton also a good value when the price is right :)
128547,negation,"the old willmaker came in a mac version.  i wish nolo had kept that practice, because this windows-only product is useless to me."
124509,negative,"doesn't read every dvd, only the unlocked ones. the avi's downloaded from the web cannot be converted."
126165,negative,just ask questions and give answers. if you don't already know the subject matter asking questions does not tutor you.
104508,multipolarity,this item came like it shoud have but was outdated and could not download forms to send taxes off. so this item was basicly worthless to me. money thrown down drain.
98594,negative,"do not waste your money, could not install this game, we try in two computers, compaq and dell, both with windows, with no success, and since we have to open the software trying install it now we can not return and get our money back."
45385,negative,"difficult to use! if you don't have word program won't work or you have to purchase it. no phone number given for support. no use to me, looking for another product."
29673,negative,"this thing had no directions with it, doesn't seem to work like it supposed to, waste of money."
1108,negative,it worked great until i had an upgrade  to windows 10.  i tried to sign in with the upgrade and it doesn't work.  i contacted customer support and did not receive an answer.  the device may be outdated or doesn't have any support options.
74383,positive,this item is excellent because i can keep all my recipes in the software and it is very necessary to own this article
131104,negative,bought stopzilla.  uninstalled it - caused too many problems and didn't work well besides.  just received another charge for $29.95 for what i don't know... still trying to reach someone about it...
93256,negative,it's a waste of money and time for this software. not a friendly user at all. wish i could return it.
120630,positive,"i am finding mavis beacon to be good for improving my typing skills as well as teaching my 8, 10 and 15 year olds to type.  the kids find it fun and they learn at the same time."
