id,prediction_bert,review_body
111041,negative,this was a waste of money.  i couldn't get it to download correctly on any of my computers.  i have ep/vista.  no help from mcafee so i ordered ca  security suite and had great results.  i will not use mcafee again!
23200,neutral,"this key is only for one pc installation. when i look at advertisement, i understood that can be install on multiple my own pc??"
4534,irony,a great  by   about  .     if agree.
30449,multipolarity,"not what i was looking for, but it's okay"
11670,sarcastic,the biggest risk to my continued good health is the bureaucracy of the healthcare system.
107331,multipolarity,"great bag, but handle stuck in half open position after 2 months.  not a way to endear oneself to fellow passengers."
28773,sarcastic,oh man i didn't know i had to press a button thanks for ruining the game might as well not even play.
40710,negation,not what i expected. couldn't find the regular solitary games plus i ended up installing things i didn't want.....  won't recomend this at all.
5520,irony,trying to buy tickets for dismaland is horrific! good job banksy! ;)
106299,multipolarity,i try many times but i don't know how to use it. i will ask my friend who study computer science for help..
513246,sarcastic,because thanks to the universal support for obamacare in every state there's someone to pick up the horrendous costs of permanent disabilities caused by going un-vaccinated.
96184,positive,"it's great fun and easy to use, the instructors are very helpful and know what they're talking about. defiantly a recommendation for anyone wanting to improve on there flying."
66850,multipolarity,"i had no luck trying to recover my files, but i can't say it would not work if my computer was in better shape."
48423,neutral,had tremendous problems getting it to send mail was als unable to open help. it took all day with second level microsoft tech support to  get it to fully work.
62286,negative,did a full scan and it took out windows called tech support said i needed to reinstall.i said your program took it out you need to do it they said noway.will never buy another product from symantec ever they don't stand by there products.
21284,negative,"this product does not, repeat does not import prior years turbo tax business returns  if you need to do this, do not buy this software  too bad,"
119281,negative,"i never received item, so all i can do is say \\""don't trust the merchant 'raindeergoods'!\\"""
131612,negative,don't buy this.  it is sa 2003 not the current revision.  i waited for sa 2004 release and got amazon unloading their old inventory on me instead.
124049,positive,[[asin:b000u0i11a quicken 2008 delux]    product continues to improve with each new version. excellent performsnce
13216,negative,i was sold this product from techhut and it does not work in the united states.  says on the bottom of the disc not for europe or americas.  therefore a waste of money!
41082,positive,"this was in almost perfect condition, and i got it for less than 20 dollars, this game runs perfectly on windows 95 and came with the original jewel case"
24920,negative,"terrible! beside the price increase of $30, it does not even load on ms win 8.1.  this software is trash, don't waste your money go with one of the others available.  have used tt for the past 10+ years so i am very disappointed."
72081,negative,wouldn't load so i don't know how the game is. my old xp laptop would not load it so a waste of 10 bucks.
307899,sarcastic,it's great fun to lunge towards someone running out of a building and get stuck in the doorway just to die by his teammates a second later..
456579,sarcastic,"but labor doesn't have any new good ideas and shorten lacks personality, all the parties are the same."
514503,sarcastic,"""but muh six gorillion never forget we need our good allies in the adl to stalk and track blog owners we don't like so reporters can harass their mothers in their own homes oy vey goyim"" because everybody who doesn't hate jews talks like this."
48511,negative,"terrible. doesn't work in window's 8 either.  freezes up, won't run.  six dollars was too much, don't waste your money."
11208,sarcastic,"why, because max doesn't know him self to be a good person that's saves people he doesn't see his self as a hero."
9859,sarcastic,"it's fascinating to me how rapidly ""authentic"" has become a hackneyed, inauthentic term, thanks to overuse in the gop debate."
625389,sarcastic,"yes, because caste-based marriages prevents students from getting into a good college and getting good jobs."
115864,neutral,"ps4 is great.  amazon, eh.  you might want to include the word - upgrade in your description.  do you know what upsell means?  obviously not."
99342,negative,"this software would not install under win 7, or under compatibility mode  the manufacturer's website was useless  i wasted a lot of time trying to get this software to work; it is a bad product"
120148,negation,"you state this product can be used by 3 user, it can not. it is for 1 user with three pc's. if i had know that i would not have ordered and spent that much money."
43618,neutral,"it is ok except only 3 games i like, rest of them are not very entertaining boring.  i still have 6 games locked for some reasons, it could be i only played with 3 games."
82986,multipolarity,"it would have bewen nice to know that it wasn't compatable with todays operating systems.<br /><br />but, i'm not too worried about it... i should have figured that out myself."
732849,sarcastic,"speaking of happy hour, where is a good happy hour for a 29+ yo looking to get wasted that has a good juke box, live music, 10+ tvs (gotta watch the reds play) and easy blondes?"
39872,neutral,if you like this kind of game it's okay.  my wife played it until it got boring...
21780,multipolarity,"older version,, but works good."
21151,positive,this is an upgrade to early version and is working very good so far.
50562,negative,it was bad as it could be and i could not get any kind of support.i wish i would of saved my money.
80183,multipolarity,good product but has some things that need some rework.<br />would be easy for the novice.<br />this premier downloads my investment information so i don't have to enter it manualy
631529,sarcastic,"then they get baked into apple pies for nice guys to stare at while other guys stick their fingers in, right?"
41333,positive,ok good great wonderful like it did not use it yet but will enjoy i am sure will be helpful
2402,irony,isn't it  that the path never  makes sense until you have completed it. u look back and go ahhh i get it
63362,positive,"i had an older version but needed hd video, smooth transition.  the interface is similar to the old version. great program."
567202,sarcastic,"now i remember why i unsubbed, thanks for remindimg me goyim, less maps than a game from 2005 is totally acceptable!"
132913,neutral,mcafee firewall puts out its fair share of false alarms.<br>i would recommend tiny software personal firewall over this product.
57496,negative,"the hardware didn't work (unrecognized on two different machines), and then the software will not uninstall so i could try to reinstall from the beginning.<br /><br />save your money.  try another product."
124966,negation,"bought the game, loaded it and installed the patch on a desktop running xp. hangs up in the load scenario window. i left it running over night-still never loaded. pos."
513042,sarcastic,"after hearing this, michel therrien puts jacob de la rose in all lines that previously had pacioretty because he has good hustle."
901,irony,there's a whole chapter on how to use drugs  to enhance your love life.
770851,sarcastic,"that is not at all the vibe i got from shorten's quotes, good to see he has the public's back on this one..."
287879,sarcastic,"he's just spreading the message so the gay agenda won't spread their gay spores on the nice, white, straight, angellic religious people!"
298261,sarcastic,considering that jeb dropped out about 5 minutes after dubya endorsed him that's probably good news for trump.
6254,multipolarity,"not exactly photoshop, but it works & it's cheaper."
90051,negation,"i was looking for a program to create and convert pdf files, not having much luck doing that with this product.  maybe this product is good for something that i am not using it for.  doesn't seem worth the price and i even got it on a gold box deal."
27444,sarcastic,"it's racist to question our high immigration intake and what good it's doing for wages and the job market, didn't you know?"
88189,positive,"awesome product, i spent over $100 on a different one from a different website and it was terrible. this product actually talk me some great words/phrases."
34614,multipolarity,"i had a very &#34;old&#34; version of word, by today's standards, but it was fine for my purposes.  for this one, i have to take a tutorial.  it's more than i need as a retired householder................."
79783,negative,hi<br /><br />i want to buy this but i want to know if this works for windows 7 os and windows 8 os or not.<br /><br />otherwise it would be a waste of time buying it.<br /><br />please let me know!<br />thanks!
686600,sarcastic,"man, she should be so upset that you're actually attempting to curb your child's behavior and teach him how to act nicely."
120326,positive,i may never be able to master this language but this a good product to attempt this project. have a georgian friend and would like to be able to say a few things just for the fun of it!
130109,negative,these photos were a huge dissappointment. national geographic should be ashamed. the pixel quality is really bad. don't buy this.
1874,positive,great for basic sites easy to understand lots of online info if you get stuck.
144958,sarcastic,because we obviously pay the officiating crew and thats the only way we could possibly win and we only get good calls in our favor never bad calls ever since the big bang.
124591,negation,"this version does not have anything extra just word, excel, power point, one note. they charge more for the version with outlook"
121340,multipolarity,this item was hard at first to figure out but after watching the video it made it a lot easier. of course im still playing with it trying to build my dream house! but nontheless its a very good item.
44237,sarcastic,"no, that's dumb everyone knows that old isn't good and new is always gooder just like the iphone 7 and it's no headphone jack."
477040,sarcastic,"yeah, just go kill some more innocent civilians, what a great way to respond to an organization that feeds off of the sins of western governments"
6876,irony,listening to   as i start to choke on popcorn. a song by   starts to play
308673,sarcastic,1) kaepernick is making a brave stand for a good cause 2)i'm glad he's not standing serves you right for having a revolution
11359,irony,"yes, i'm tweeting about a blog post about a book.  some great (and scary) quotes in here though."
47386,multipolarity,"i find the product and support top notch; however, it is difficult to use. you have to concentrate really hard to not make mistakes. great idea but hard to engineer for everyone."
348959,sarcastic,"yeah, good thing they gave warrior a good removal combo, they really didn't have much viable removal to begin with"
42825,positive,"these were parts for my new home-built computer. the pricing and quick shipping made for an affordable, stress free home-build. since the computer is working great i don't have any complaints."
103593,negation,i had my laptop for about 6 months with no problems.  my previous antivirus expire so i bough ss and installed it.  within a week my computer crashed and i lost all my school work and had to pay 180.00 to have it fixed.
80255,sarcastic,"nice to see a guy investigating the mostly male past regime for corruption, while also dealing with the mostly male boko haram reeking havoc on his country, has time to put women in their place."
437979,sarcastic,"it should have been more like the second half of storm of swords, in fact just make the whole book that good, i mean seams doable why not?"
12855,positive,"due to old virus files in memory, i had to get company  techs to assist  and they were great."
53346,multipolarity,the email help line was amazing however the disk did not help m but i was talked through every single way of working through my problem
20553,positive,easy to use and it does a ton of editing. i have not used but maybe 30% of its tools. great buy.
10743,sarcastic,"blackberry has shed 8,000 people and now ceo says finding and retaining good talent is hard"
127788,neutral,this item does not run on linux as advertised by amazon. otherwise it works ok. <br />
51613,multipolarity,"if you don't have a touch screen, then get windows 7. i wish i could downgrade, but you can only do that with &#34;professional&#34;. you live and learn, i guess."
320490,sarcastic,op cop is jealous for sure i mean why else would he pull you over its because he hates you and your nice things
87402,neutral,"when i looked at this online i  thought it had one of the games i was looking for, and it didn't. however, the games it did have were very good i thought."
84207,negative,"the audio provides amharic sentences, but no translation. not much use if you don't already understand the language, which if you do, renders the disc still pointless"
6711,irony,"lady who wouldn't let me over flips me off while ""where did all the good people go"" by jack johnson plays in my car."
33642,negative,after a month it finally revealed to me that svchost.exe is taking up all of my memory and cpu but it doesn't tell me its a virus nor does it treat it.  what did i pay 35 bucks for?
321873,sarcastic,"hush, the eu has brought only good to the uk, and every single person who voted leave is a racist bigot."
86195,positive,"very easy to use, and you get pro editing tools. perfect video editing software at a good price. the only drawback is, it does not come with full manual. wish they include it."
4727,irony,instagram worthy but doesn't taste as good as the one in london    …
446508,sarcastic,yes american culture and problems should be exported everywhere but the human rights movements in other countries shouldn't get any recognition cause fuck the rest of the world america is the greatest.
418969,sarcastic,"everyone knows that good game design doesnt increase difficulty or quantity to strech the games length, it increases tedium"
89090,positive,the norton internet security 2012 software seems to work fairly well.  i have not been using it long enough to give a good evaluation . . . so far so good!
667682,sarcastic,"well, with how hard it was for ac to have a female assassin, apparently it must have taken a great deal of everyone's time, probably having to sacrifice dozens of planets' worth of maps!"
34485,positive,great movie!! the dvd arrived ahead of time and it was better than expected.
20412,neutral,"2014 edition is very buggy, have to force quit every time to get it to quit.<br /><br />2014 will not run on snow leopard, where 2013 ran ok. this might be my last year using this product."
19686,negation,"shipped without software code, no response from smith micro software inc. !!!"
70722,multipolarity,"this game is okay, but i didn't care for the &#34;hidden objects&#34; part of the game.  it wasn't very challenging."
101281,positive,"i am delighted by the quick service and fair pricing for this product.  it was received before the date promised, in perfect condition.  thank you for your excellent service."
2284,irony,just caught up on the       fight... amazing. actually hurt my back jumping out of bed as she knocked her out!
682051,sarcastic,"what a great idea, and also let us have a broom so we can fly, and an ankh so you can resurrect where you died and and and...."
90971,neutral,bought this for my new mac pro without paying too much attention to what was included.  my office packages for my pc included outlook which i needed.  disappointed that office would not include an email program.
92274,neutral,"while i have above average skills, this program was harder to use than described.  nonetheless i found it helpful and was able to complete a few projects."
4510,irony,packed this yesterday to wear today...we clearly were thinking the same thing
67235,negative,poser staff very unfriendly and not helpful at all. go with open source blender for more helpful staff and product
630864,sarcastic,"but the full quote might lead tbms to assume that exmo family members are still good, and we can't have that!"
20517,multipolarity,well i just find out that i bought  this but never saw it or got loss somewere. not even have the serial number so i can get it again
62464,multipolarity,i love hidden object games and this pack gave numerous ones that i didn't have including several collector edition. several were &#34;old school&#34; but i think the money was worth it.
56465,negation,"expensive software like this has no place in today's free app world. it's just a matter of time until mobile app developers create something that will make these irrelevant. if you want to see what it might look like, try mint."
777777,sarcastic,"haha man i'm kidding i don't have the cash for such a nice board, unless you want a cm storm trigger and a seidon 240m as trade."
113359,neutral,it's an ok product. i have had difficulty installing it and it didn't come with sql server management studio as i expected.
54424,positive,simplicity to use and  complete your taxes.  the accuracy is 100% accurate.  the cost  is a great value. i would recommend anyone wanting to do their own taxes should consider using  turbotax.
9786,sarcastic,but doesn't natural automatically mean it's good and organic and better than everything else that has nasty chemicals in it?
619875,sarcastic,you don't need explanation from great leader arcation.. now stay in your lane before great leader arcation falsely permapearls you irl!
74683,negation,quiken 2013 has no living trust. that is the only reason i bought this . why doesnt a will maker have a living will!!!???
47931,multipolarity,"problem from the beginning.  the price seemed good at the time but i could not interact with the software maker, because the message would always say i was not connected to the internet. in all instances i was on the internet  ?????"
564879,sarcastic,"but...but.. this is a terrible year for quarterbacks, he only looks good cuz he plays in an air raid offense...."
343933,sarcastic,"comparing two different characters, from different classes, that do two different things good comparison"
54541,negative,this item has obviously been used before. had to get a magnifying glass to read the product key code from label and then tried to install the product which froze every time it started putting startup files on the computer.  wasted my money on this.
35240,multipolarity,"it was not so easy to create a video with my pictures, but i was finally able to create disk after finally working with the program. i've worked with other programs which are easy to create video disks."
779411,sarcastic,good thing the department didn't issue them leathers... they'd be paralyzed from the weight on their spinal column...
7081,irony,does family really matter ? |  | creative labs  |    @…
21809,negative,"i hate it , labels do not stick ,wish i could give it zero"
128478,negative,i have used act since it was a dos program. this product has been going down hill since symantec let it go. i have been using act 2000 and was sold on upgrading to 2006 for just a $98 upgrade fee. this was a total waste of money and time.
123040,negation,"i was never able to get my computer - actually 2 different computers- to \\""see\\"" the program, so i sent it to my son to see if it would work for him.    glenn couch  fayetteville, arkansas"
464905,sarcastic,"yeah, i'm sure sefer vayikra originally said homosexuality was great and all, and then someone just through a slip of the pen accidentally changed it to saying it's a toeivah."
94813,positive,downloaded it on my computer. passed onto my mother as a birthday gift since her kaspersky expired. good enough for one more computer. lot better price than in the stores.
712651,sarcastic,"i personally prefer to have it absolutely break the flow of what you're reading, be different for no good reason to the web version and make you double take if the person wrote removed or ab added it for no reason."
79481,negation,tried changing the setting to emulate windows xp but still did not work.  had to pull an old xp computer out of the garage to get it to work.
30389,negation,no updates for this older version. i'll be forced to buy the latest version not!
10207,irony,the blonde &amp; the brunette ...
122742,negative,"maybe i am just dumb, but didn't realize you have to pay for a subscription, and keep paying for it every year.  my laptop was stolen and the subscription was expired...to bad for me."
8916,negative,"i was expecting more but once i finished the install, i went back to photoshop. i don't recommend this product. save your $50 for a drawing board."
57476,neutral,"it's too early to tell whether or not it does as advertised. i'll say this, so far so good, no surprises and my computer functions ok and apparently virus-free."
93656,multipolarity,"i know that windows 8 has been released, but i don't like being a guinea pig on new releases, so i got windows 7 to replace my vista, which i absolutely hated. this came quickly and was easy to install, but it took all day to complete the install."
88241,neutral,"i was somewhat taken aback by the time that it took to install windows 7. it took so many hours that i thought, several times, that the installation stopped. there is not much of a difference from vista, my opinion."
28546,neutral,"the dvd itself is great, the only issue i have with it is that my version of final cut pro x is more recent than the one taught and things were relocated and renamed, i had to look around for them and figured out a couple that were hard to find."
134099,negative,this game has to be the worst hunting game ever made.  you can aim right at the animal and the damn game says you missed. dont waste your time or money on this stupid game.
65188,neutral,easy to use program. simple bookkeeping made easy for people who hate to do bookkeeping. would buy it again happily.
606988,sarcastic,"that stuff is great, if you put a can of tuna on the radiator and get close to the monitor it's like you're actually there"
39554,multipolarity,this item was purchased for my husband. it is okay but doesn't always understand when he speaks
48499,multipolarity,"acceptable, but i would be just as happy if i could still use xp. no better than windows 7 in my estimation."
64679,neutral,"it is ok.<br />it is difficult to learn how lr5 open, store files create albums etc..<br />healing brush leaves a lot to be desired"
87431,multipolarity,"it is what it is, it's a drawing program from a genaration ago, but my kids still wanted it. they are happy with it."
244536,sarcastic,"stank is probably just one of those *good people* that interpreted the fairy tales written in the bible in the *proper way*, no personal subjectivity at all."
95236,negative,- this product is waste of money.<br />- simply a bootable disk does offer any meaningful recovery of vista os.
118395,multipolarity,"i am usually really good at working with new software, but ms home & student 2007 is really confusing. i don't like how the removed the title bars. it's really confusing. it does look pretty though."
101707,multipolarity,"[[asin:b003eyvnq4 macspeech scribe retail for ma]   i expect it to be terrific, but amazon did not include a registration number...  now what??    in other words, how do i get it registered?"
234,irony,you really should read some history. no british occupation no ira!
726095,sarcastic,"they should bring back 18 hour work days, 7 day weeks, and child labor too, because those were also *amazingly good ideas*"
546636,sarcastic,oh good cait trap buffs mean that the 20 minute period during which she does jack shit is solved now.
54168,negative,"the documentation is virtually nonexistent.  what does this product actually do?  it won't undelete any files, that much i know.  os x comes with its own disk checker and corrector.<br /><br />my advice: don't waste your money."
54845,negative,"don't know how does this suppose to teach a beginner a new language. irrelevant information, limited topics, would never help communicating and as a beginner's cd, it won't lead to anything."
75391,multipolarity,"its a pretty simple game. my 2 year old gets stuck sometimes with the mouse movements and i have to 'shake the tree for her', but other than that its a great simple game she loves to play."
101662,neutral,it seems to be okay  pretty basic to use and it has not caused me any problems  see what happens at tax time
95468,negative,all it did is mess up my files.  i can't open wordperfect files anymore and this software doesn't accurately open all word files.  don't waste your money.
476317,sarcastic,because no one reminds arnold that he was a bodybuilder or that michael was the greatest basketball player ever
78768,positive,"it is a great program, easy to learn and use. it is supposed to have a 1 year subscription, well see how that works"
16790,neutral,"when i put it in the computer the title of the disk came up as stop smoking, hmm as i never smoked i am pretty sure the wont work."
11026,irony,"""...and that's inconsistent with our principles and our constitution."" - ben carson, (r) and likely practicing protestant."
283485,sarcastic,"yes, because states as a whole have such a great track record on things like welfare, civil rights, and labor."
3977,irony,neighbors hardly speak. one person who said good morning was a police officer driving by my house.
