id,prediction_bert,review_body
122948,positive,it's great! backup home computers and share everything.  easy to setup and manager.  it just works...
38778,neutral,drivers are okay as long as there are designated drivers.
83784,negative,you apparently have to be an already established psyche to even attempt this game. you spend all your time trying to figure out what the clues mean. this is too frustrating. sorry i wasted my money on this.
8087,negation,"i install it on my macbook under vmware fusion. after i used it for three months, the windows system shows that this version is not an authority one. omg, is it a joke?"
300542,sarcastic,"its not like the government instituted any racist policies, nope its always been a great bastion of social tolerance and the best friend of every minority..."
54228,sarcastic,"get deep bowls (30 cm deep) with the rim the size of the grille or larger, glue them to the grilles, it will leak less sound now and you'll look great too"
792808,sarcastic,you'd just have to look at the old russia to see where our great society would've been if not motivated by money
35184,negative,doesn't work with windows 7!  wasted my money.
388368,sarcastic,hey he made him pinky swear he was a good guy with a gun not a bad guy with a gun so its all good right?
97528,multipolarity,dose not work with my program but i'm keeping it till i get the right program to work. bought this so i may communicate with my tenant in the trailor park i run.
40361,neutral,works well for daily applications of business like microsoft office.  does not allow older programs to run or at least not run properly.  going back to xp for use of older programs.
8637,multipolarity,this may be a good product but it did not work on my computer. neither did elgato.... so i don't consider myself a judge. it depends on whether it works with your computer.
25037,negation,"did not work. seller told me it was my hard drive, i was able to repair the computer with disk purchased from hp."
225221,sarcastic,"i totally want to pay for this amateur sex video, even though i can find equally good amateur sex videos online for free"
196058,sarcastic,"oh, nice, as a finn i was googling that also but since that became a thing i guess i don't want to anymore."
104501,positive,this game is a blast and i play it with my 6 year old grandson and he loves it too.  it's a great learning tool.  enjoy!
339401,sarcastic,"haha i know anytime i say anything nice about a girl, all i'm really trying to say is how much better i am then them and that they're just an object i wanna ram my juicy, sweaty man-cock into lol"
38088,multipolarity,for the price and 10 pc use it works but you get what you pay for.
91508,negative,i have not received this program yet but i do hope it works. i just do not understand why when you buy a scanner the programs don't come with them. it's a rip off if you ask me and you did ask me.
6801,irony,"i thought ""great sense of humor!"" in that early episode when   wore orange w/ b&amp;w stripes."
67955,negative,i know this is an older version but the graphics were very slow and would not keep the attention of my 4 year old.  he usually loves using the computer but this was a waste of money.
95518,negative,i followed all of the appropriate steps for set up and the product doesn't pick up the signal from the vcr.
738449,sarcastic,"hi, dont mention artillery (like i just did), make sure you have at least 2 things you really hate and 3 things you really love and youll be good to go!"
80904,multipolarity,my 9 yr old had this responce. it was fun but too easy for him. he enjoys and uses the 3-6
110666,neutral,this game is ok.  it doesn't run right on my window's vista program. my little one has watched it a couple of times and that is it.
529496,sarcastic,wasn't it nice of the westminster bars to get a few beers in for those snp type scottish folk it'll be chips next.
32761,sarcastic,"i think my favorite was how it started, [with the ""warrior"" coming in and blocking the first attack with his shield, illidan slashing at his neck, and then the wound immediately closing thanks to the healing magic cast on hi"
2519,negative,item arrived timely but we could not get it to work with our windows 8.  so it was just a waste of money.
374,negative,doesn't work and came later than expected. very upsetting.
448587,sarcastic,it would be pretty nice if these manufacturers would print that information right on the bottle or something.
15117,positive,on time delivery and a working product at a good price.  thank you
585366,sarcastic,it was sarcasm... chris christie said people of his state didn't want him to be president because they wanted him to stay in jersey... thanks joke killer
126324,multipolarity,"good product but need better, more complete business plan sample for video production. <br /> <br />by the way, do not buy the product from amazon if you need the product right away. they use ups that is not reliable for fast delivery."
617855,sarcastic,"yep, the police are a great example since they have a sterling public reputation for holding ""bad apples"" accountable!"
349849,sarcastic,"i know right, the only thing were good at as wizards is sieges and group pvp and thats such a small part of the game.."
390108,sarcastic,"but if i don't yell at the cashier and point out these terrible business practices in front of all the other customers, how will everyone know i'm actually a good person?"
196246,sarcastic,yeah but is calvin's song as good as the op's song which took two years and thousands of dollars to write?
160609,sarcastic,"the good news is, with the presidential debate less than 24 hours away, the issue of high incarceration rates will *definitely* be addressed by both candidates..."
4653,irony,have you ever noticed that those who demand that you listen to them are often themselves really bad listeners?
604928,sarcastic,"i'd be able to tell you if i could access the image, looks pretty standard to me from what i can see, almost as good as kynan's grip."
44573,positive,xp to window 7 install went great<br />no problem with window 7<br />window update solved problems for window7. so everything went well
109862,multipolarity,"the cards are cute but making changes is limited. i used american greetings before, and you could change the text easily. on hallmark, it is difficult to even add a name to the front and have it look right."
30159,negative,doesn't work with win7 64bit
92270,neutral,good for all levels of player. has some options that i don't understand. might rate it even higher after more use.
85693,negative,"complicated and cumbersome. it was a waste of time and money. there are easier cad packages for the casual, home user."
342191,sarcastic,"""if you don't submit to our demands we have the moral right to kill all of you and not report it if we know it will happen"" wow thanks"
93771,negative,junk. installed very easily. very dissapointed in new interface. not worth the wasted time.<br />not worth the wasted money. going to remove from system.
130382,negative,i downloaded the trial from the company's web site and it simply doesn't work. <br />sorry.
474111,sarcastic,"they are only good when it's a no-good inner-city drug dealer, when it's a red blooded american, living the american dream they are an infringement of their god given right to be as free as possible."
38514,sarcastic,"""hey, i'm in the middle of a gunfight one kill off my de-atomizer, this is a good time to call my warden in"" something like that would never happen to me"
117134,positive,this product is a good tool for very young children to learn the piano keyboard and note names.
41378,positive,the price was very good and norton 360 has a good package for pc upkeep and intrusion detection and control.
130619,negative,"stick with money 2004 if you have it or go to quicken.  this product does not work with citibank, requires you to put all your info on msn server, and has a poor interface and really bad help.  save your money and use something else. <br /> <br />"
98535,multipolarity,i upgraded from vista to windows 7 and thought the speed would be much faster.  i do see a difference because vista was just terrible but was expecting more from windows 7
108569,negation,"never could get this software to work.  followed instructions, reinstalled and reinstalled downloaded updates and itunes multiple times and finally just gave up.  gave one star because i could not go any lower. i would not download if even free."
86204,positive,"so far, so good.  i bought this for my husband and he has gone from chicken pecking to actual correct hand placements.  it is definitely doing its job."
475055,sarcastic,"oh, but you know - she got a good chuckle out of it too at the time, so she's just causing trouble now."
54581,sarcastic,i for one care greatly about the suffering of those who have committed heinous murders and tortured their victims.
75659,negative,the numbers that i had to type in to activate it didn't work.  so i had to call the help line.  this was evidenly done on purpose because they gave me a salesman.  i wasted my money and my time.
43778,multipolarity,didn't work like i expected but it is okay for other than what i had wanted didn't do what i wanted it to do.
119992,multipolarity,nx2 is another improvement on the previous versions.  they were great too in their time but there is always room for improvement.  nx2 is the next step from nx and capture.
196318,sarcastic,"good thing i paid extra for the convenience of having wireless, as this isn't a bigger inconvenience at all."
68173,negation,does not work on any windows system....i have tried from '98 to windows 8 and it does nothing more than give errors....it sucks!!!
319724,sarcastic,"yup, there's the attitude that created an independent nation out of a colony of one of the greatest and most powerful empires the world has ever seen."
96159,positive,this item is two boxes taped together concealing a sticker that says a utilities disk is included in internet security.  once the box is opened you will find the disk.  everything installed perfectly and is working.
378043,sarcastic,"outdpsing other fms by straight fucking them, good strat i like to wipe my party and be the only person alive, that way i am the #1 always"
77153,sarcastic,"yeah, because minerals on the ground are a good enough cause to get your property taken with eminent domain."
123906,negative,total waste of my time & money..it just does not live up to it's hype
8919,sarcastic,it's good to see geniuses fixing bugs in the spec
5668,irony,"1) 22 september (gift ko okay? thanks!) 2) 5'3"" something hahaha 3) black-ish? hahaha or brown asa pang blue 4) green and blue hahaha"
31282,neutral,"video quality ok.  kitty glitter is set too tight.  just keep losing and rarely bonus.  other games seem to be ok, more like actual casino."
778967,sarcastic,"oh shit, i just remembered my parents telling me when they got me involved in sports as a kid ""hey we're just doing this so you won't pay attention to politics, world issues, and all that important shit"", makes so much more sense now, thanks!"
94231,negation,i had high hopes for this game; could not install it on my kid's mac.  product description does not provide adequate details around mac compatibility.
72369,multipolarity,"l loaded the software, but i was looking for a journal, and some kind of timeline, like when i could pinpoint where i lived, and when.  i found it lacking, sorry."
665335,sarcastic,"this is a positive story and the trains look pretty cool, good thing they didn't announce it during the referendum"
3913,positive,great program it helps my wife so she doesn't have to write so much
121620,positive,i haven't used rosetta stone products before but i definitely see how they've earned their fantastic reputation. excellent and very user-friendly.
32490,neutral,work ok used only on old xp computors
126270,neutral,"i haven't yet tried the \\""new\\"" features.  it works for me pretty much like all previous versions of front page.  it looks like a way to gain more revenue with a \\""new\\"" product."
109346,neutral,"this item seemed ok.  i have not found it easy to find the process to use it for my purpose, which is daily readings of my choice."
42316,positive,i got this to help me start my decal business. its great there is so many to chose from my customers have a hard time deciding on just one
12577,positive,nice product 100% recommended.
68313,sarcastic,"uhm, yeah, bama vs usc turned out to be a great match-up that was a ton of fun to watch for everyone."
117603,positive,"this is a fun game that certainly can challenge depending on you.  from easy to difficult you can advance at your own speed.  it's so good for your brain molecules.  i recommend this for beginners and \\""brains\\"" alike."
743830,sarcastic,"god, why cant we gave the good old days, when minorities knew their place and we could joke about them all day long"
10259,neutral,it's okay for what it does.
148408,sarcastic,"hmm exploding samsung or 3.5 mm jackless iphone with hundreds of dollars of adapters, such a tough decision what phone i want this year, what a great time to upgrade."
7025,irony,same song back to back on completely different stations
20909,multipolarity,ok for now but still in the learning curse as i have been using iphoto for a number of years.
102370,positive,"if you don't already know, it's cheaper to buy the new product than it is to renew the subscription on the old one.  it works great. we haven't had any problems."
28864,negation,"now this software is just like a calculator, nothing else."
74748,neutral,"this product is ok. it teaches the material in a way to make it more challenging. for example, a teacher could teach the math in two steps (cheat) where this program makes the child do several confusing steps. i wouldn't buy it."
62649,negation,did not care for the slowness of the program or the way it was set up. threw it out. took it off of my computer
116615,multipolarity,i ordered two items at the same time. i received the first one but not  the xp cd so i had tom call and they had to reship and finally after three weeks i finally got it. but due to the delay i could not get it installed as of yet.
106209,negative,"doesn't work with windows 7.  ms talks about \\""work arounds\\"" but it just doesn't work.  fine if you use older windows programs, i guess."
53062,positive,item received quickly in perfect condition. exactly as pictured. can't ask for more.
42784,multipolarity,"yes it is a lot of games, but not what i was looking for.  there are a few of the games that are gems though."
8024,irony,really? how  is it that u tweet the day after i mentioned it?
394974,sarcastic,"or keep re releasing felons because in their hearts murderers ""were just a part of the us apartheid system keeping these good folk down"""
556919,sarcastic,"it's great that he's been so consistent and is just continuing his support, like when he was maryland's governor."
388416,sarcastic,"yeah good thing you didn't, because if you did downvote it, i'd know you're just trying to belittle me as a minority"
25952,neutral,guess it works ok..........
11034,multipolarity,it transfers the video from the vhs to the comp0uter; but i am not able to copy the video to a blank dvd.
67427,sarcastic,"so uuuh why don't you wanna have kids they're great, they're my world, i never knew happiness until i had my kids!"
11141,sarcastic,great to see brie   isolating the leg much like the 4 horsemen used to do on a nightly basis.
132488,negative,it doesn't support email agents other than ms outlook. so you are not protected when you are using other email agents.
20103,neutral,appears to be three separate and very different games. each one is a bit quirky to  access and one of them is difficult to begin play. once you get it going it's ok.
188103,sarcastic,i mean he was good and all but i think it's a stretch to say john jenkins was the face of our team ...
42194,negative,product was not good.  avg free is better.  this is a total waste of money.  you dont need to pay for antivirus.
114559,positive,fishdom is an awesome game and so much fun!  i really enjoy the challenges and being able to create my own fish tanks!  thanks for the many fun-filled hours of enjoyment!
1864,irony,class i am still on wait list # 3 i havent moved i really want. but the other 1 on wait list for i've moved up 3 spots wth im # 4??
578776,sarcastic,"oh boy another gfycat saying how beautiful gta v is showing a modded car and the rain effects, im gonna save this one with the other 500. thanks op!"
18841,negative,hate the changes to the program. been a customer for 20 years but will look for something different next year. you blew it intuit!!
10491,irony,reveals that  no longer a problem. reason? drilling now possible in arctic thanks to
4935,irony,some great morning tunes     …
524115,sarcastic,rss needs to provide helmets to all the ghar wapsi dalits they are after - that would be a great incentive for them to leave christianity or islam and come back to lowest level of hindu society.
65657,positive,this game got me started on simple gaming.  it was fun and not difficult.  it is a very good pc friendly game.
551,negative,no warning that installation will wipe your drive. lost photoshop and all other programs that were on the drive. wasted effort to load an awful os
47640,neutral,i thought it would have came in a book because i wanted to learn the keys for my electric piano
73996,positive,this product worked as said. i still use and will use in the future. the price was good and recv'd on time
92604,multipolarity,"it does the job. has some features i don't quite use yet, but i bought this with the intent to expand my finances."
624421,sarcastic,"right, because when the government gets involved with anything, the outcome is good, because we have a trustworthy government."
63566,negation,i am unable to maximize screen and still use menu.  i am not fully satisfied with this product. not sure if the tutorial is compatible with windows 7.
109020,multipolarity,"good software for animation but the tutorials are a  little hard to follow.  once you get the hang of it, is pretty good."
206429,sarcastic,"because they've tortured all the nice guys out of their real life with their ""leading on"" and need to satisfy their relentless female itch to deny gentlesirs access to their sexy bits."
77421,positive,works as advertised. excellent product.... would recommend to friends.<br />would definitely buy again. be nice if it was a little cheaper.
464117,sarcastic,"hey, immunity from twitch bans since she's with chance (who brings chance tons of money) must be nice :)"
37251,multipolarity,"it's not as easy excess, you can program it in, but still need disc in also.  i put it in for my sister, who does not do computers, so i think she will have more trouble running that program."
55083,negation,"product key invalid! microsoft customer service was of no help.wanted me to do a complete tune up on a brand new computer, at my expense of course. item returned for refund!"
9116,sarcastic,mps refusing to take the blame for anything they've done sets a great example..
7365,irony,"the grumpy man guarding mall entrance    should really quit &amp; not work in, of all industries, ."
65750,multipolarity,i thought that when it scan it would clean up my pc..but after scanning it seems i began getting random pop ups and couldn't stop them...
101937,negative,"haven't been able to install it into my computer. i followed all the instructions, my computer has compatible hard drive and software , i've had no success with it .  at this point i wasted my money. but i'll keep trying."
640604,sarcastic,"well if they pick the goal horn you voted for great, if they pick that other one that's terrible in every way, terrible, season ruined."
383796,sarcastic,"yeah good point, i too find it pretty hilarious that we're out of the cup, our one great chance of silverware at this point"
118807,positive,this is already known as one of the best in the industry.  i love the human interface.  everything is very intuitive. great sounds.  easy to use.
717280,sarcastic,"if he was so great, why did they throw it in the red zone in the super bowl instead of hand it off to him?"
703665,sarcastic,"it's fine really, i always rush sightstone and deepward the enemy jungle so if he ever shows up i always have time to put on the tether preemptively i don't remember missing the slow in crucial moments either, guess im just that good"
94852,negative,"it didn't work on my mac ox system. i haven't  tried  it on windows xp.<br />please, if you want a review, don't bug me with the number of words in my review.  if it didn't work, it didn't work!!"
95584,neutral,well everything is ok exept for the fact that when i add a video of good quality it shows up like i recorded the video on a really old phone with super bad quality and the video keeps buffering ;/
130735,negative,"i agree with the previous reviewer, this program is not worth much.  i bought it to replace my old reliable easy cd creator but all it can do is copy from one cd to another and it is not able to make cds from .wma files.  don't waste your money."
79607,multipolarity,can still play but you have to put the disc in every time.  can still play all your favorites but pain to always put in the disc
121488,negative,norton internet security is unusable when run on a computer with windows vista. it doesn't work with the security model of the operating system and blocks application at random.
785438,sarcastic,good thing abbott is kicking more aboriginal people off their land and into regional ghettos like this.
92137,positive,this is a great version of office. i had office on my pc ... the xp version. the mac version allows me to do way more. it has symbols which are very helpful.
19602,positive,rocket fast shipping and works perfect on windows 8 64 bit!! 5 stars***** to this company for quality and fast shipping!!!
2186,multipolarity,"not many people know this because i rarely have visitors, but i have some great coffee table books."
745715,sarcastic,that whopper was so good that he deliberately gave himself amnesia so he could experience the taste again.
127278,neutral,"while the games on this software are fun for small children, the spanish spoken in the games is not the standard mexican spanish that is usually taught in american schools. this is difficult to deal with when using this as a teaching aid."
613638,sarcastic,"i was also wondering if we could make the resolution smaller to, cancel out some of the tracking degrees and decrease the field of view for good measure"
33366,positive,"can't beat the price, good training on exchange 2013."
124913,negative,"this company should be avoided at all costs. they are relentless spammers. if you give them your email address, you will never get off their list. it doesn't matter how many times you ask to be taken off."
3916,multipolarity,"i have a hard time learning how to use. went to you tube for help, but could only find older versions"
601023,sarcastic,good now they can point their aim at the patriots name since you know they committed one one the biggest genocide in american history.
67051,neutral,this is a good reverence guide if you want to learn microsoft office 2010 or windows 7.  the book is a little dry because of the way it was written.  this is a great reference guide because of all the information in this book.
22423,neutral,ok i though it would be more in depth
5129,negative,anything that scans radio channels is a fake.. it's a multi million dollar scamming industry... as a true sensitive i can tell you don't fall for the scam..
109670,positive,i have used this product for over 4 years and update the version each year.  i have never had a virus and the program is great about notifiying you of suspicious web sites.
110274,positive,"this game is very fun.  it is not an easy game nor is it very hard.  it is perfect.  if you like hidden object games with a good story behind it, this game is for you!"
434394,sarcastic,"""look at how many muslims are voting for him, what do they know that the good christian people don't know yet?"""
389996,sarcastic,"there are perfectly good reasons for this, you won't understand them unless you are in a real enterprise shop"
95448,negative,product not enough retail sales compatable. does not give ability to create deductions. just too general. don't like check design feature.
98413,negative,so i've been a huge fan since they came out with haunted mansion and i must say that this wasn't very good. all you do is walk around and talk to people. hardly any puzzles no scary parts. beat it in two days. don't get it :/
97205,positive,used it for several weeks and works good. i needed something to split several videos on dvds and this does the job. would have given it a 5star if the instructions were better but figured out most of it through trial and error.
55261,positive,it has some new features that are really great. works quietly in the back ground until needed. i like the fact that it does not completely take over your computer like some others (n)
63395,negation,i had norton 360 premier and this time i purchased norton 360. it will not let me download automatically. i removed norton 360 premier and it still did not work. i have to return the product to amazon and download directly from norton website.
35420,negative,"it's not that i don't know how to use quicken because i have been using it for years. yet, this version is much more trouble than it is worth. someone has taken a good product and totally ruined it. what a waste."
45236,negation,have not used looks like it will be fine. i really hate win 8 so anything thr will stop it is good<br />microsoft should listen tho their sustomert
