id,prediction_bert,review_body
99464,negation,it has been two days now and i can't get the product key online.  why microsoft decided to have a product key online?  probably to punish the paying customers.
77710,sarcastic,"that's murica, for you... fired for sitting down even though you don't actually need to be standing to do your job... so much freedom... truly the greatest country in the world."
79010,neutral,"by this price, this is a good product. it is green and no blue, like the picture, pay attention, ok?"
25399,multipolarity,good value. but virus scanning slow and uses considerable system resources to run
78997,multipolarity,"this product has been around for many yrs, but improvements in versions have been modest. pdf to word was ok for text accuracy but not for formatting."
69694,positive,this game is great for my son. my husband(an engineer) and son love to play this game together. he just loves making different inventions/machines. i think it is an interesting and different kind of game.
3037,positive,good price for a warburtons loaf. what else could u buy for a quid...a club maybe?
274811,sarcastic,"""everything is half-red"" symbolizes the growing power of what's left of monster arm leading to marco becoming half-good and half-evil."
80898,negative,it is broken and seems being used.<br />pretty bad mood.<br />first time to get bad product from amazon!<br />the label in the top right corner is also ripped off.
57493,sarcastic,"because fostering community ties and morale won't help attract people, but sitting around being sadmad about the game will do a world of good"
60317,positive,like having a tech inside your computer. this has caught and fixed many problems. constant updates and a great price.
6245,sarcastic,i don't understand how jimmy fallon goes from one of the greatest house bands in the world to seth meyers who has one of the worst.
31416,neutral,"the games are ok, mostly are very boring."
29937,positive,"came fast and fits what it was intended for! print shop is great, have lots and lots of art done on this and has saved 1000's."
131555,negative,"it's basically an atlas in pdf form spread out over eight cds. you'll need glasses after scrolling in and out, trying to find anything. a waste of time and money."
10719,irony,"first time since jan that i didn't have to pay for bc since i'm no longer on duq's ""health insurance"""
9147,sarcastic,"well, if this has one good effect, it'll give those modest   editors a much-needed ego boost."
786749,sarcastic,that's a really great point but with all due respect i think the only reason has to be because john cena sucks.
631298,sarcastic,my great-great-grandparents had 3 children who had 4 children who had 7 children who had 4 children.... genealogy is a ponzi scheme!
38183,negative,"looks like a fair program. when i try to use it, it doesn't recognize my voice."
118888,neutral,"for those of you that have had crashing troubles with the game, there's a patch available [...]    the game itself?  pretty decent trivia game, multiple choice not the greatest idea...  graphics are quite dated."
44253,negation,i couldn't download properly. went through the instructions carefully 3 times and still got page after page of spam. could not even get help from tend because of the spam interference. spam would override communications with trend micro assistance.
89856,multipolarity,"we used ms office on our pc for years but wanted to use it on our mac, too.  we are still learning how to shift our pc knowledge over to the mac.  i will review again in a few months."
191454,sarcastic,"of course, cultural diversity is great, but only western culture is a positive ingredient in that mix."
41315,negative,"this was suppose to protect 3pc and it only did one everytime i try it would say you already use this protection, i don't know if its some other way am not seeing that..so im doing wrong.."
117082,multipolarity,"fine, just wish it had more invitation templates on it. but, was as seller stated."
119158,negation,i agree with everyone else. i am moving to a competitors product as this had become limiting and overpriced for what it does... i remember when it cost 14.95 to do the exact same thing from turbo tax. they are just greedy now.
552100,sarcastic,"omg, too bad our soliders aren't allowed to carry weapons.... they could have all been the good guys and shot the mean bubble wrap with their freedom guns"
743544,sarcastic,"of course, it's all so clear now... that must be why any tribe that wants to can make lots of money by ignoring federal regulations promulgated by the dea, or atf, or fcc, or faa... thanks for clearing that up."
112026,positive,"printmaster 17 installs and works great on windows xp, one can install all the software to the hard drive when you choose custom install to save you time when doing projects in the future."
16229,negation,the game not working in eeuu
119960,negative,"an \\""outlook sync\\"" feature in quicken 2009 makes the product unusable if you don't have outlook. terrible support.  upgrade at your peril."
95725,negative,i got the same experience as the other review. the reason i purchased this product was to clone hhd to a new ssd with win7. i tried twice and just not worked. waste my money.
74837,multipolarity,"this game is so so ok---very complicated--without a manual, the game is almost useless and ready for the garbage can<br />sorry to write this,,but not every one is a  einstein  or bill gates!!!!!!!!!!!!!!!!!!!!"
78216,neutral,"it is not what i thought it would be.  i had quicken a few years back when i had a pc.  it was great then.  i guess i won't find software for mac to keep track of expenses, etc."
113132,negation,"within two months, my computer developed a virus and was disabled.  i sent my computer to a repair shop where a technician had to reformat my hard drive and reinstall software.  this was expensive.  i will no longer use norton 360"
108353,sarcastic,ermahgerd this is going to destroy the economy and everyone will move to the rm of springfield - thanks bowman
212703,sarcastic,turns out the data collected that had indicated the possibility of a potential new particle was corrupted by a local mole having a nice meal of a few sensitive wires.
13227,multipolarity,"this year i bought turbo tax and h&r block to compare the two.  turbo tax is easier to use but more expensive.  that said, i'll probably continue using turbo tax unless they get super greedy."
58481,positive,i have used h &r block tax software for years.  easy to use.  meets my needs at a good price.
684055,sarcastic,"or you could, you know, be a good pet owner and take care of companion without relying on a half-gone ship ai or the lotus."
594559,sarcastic,"haha, yeah, i remember the days before zurlah came out, everybody was chopping magic trees because it was such a good profit!"
15531,sarcastic,"or sometimes a (proverbial) cigar is just a cigar are you seriously so tinfoil-hat-y that it's not enough for the ""bad guy"" rich guys to all have secret supervillain-esque agendas, but the ones who at least look like good guys have to have them too?"
3898,multipolarity,it was not as challenging as some of the others but still did enjoy doing it as i have all of the others. i know if must be hard to keep coming up with new ideas for so long. i have done them all and will continue to do so.
64004,negative,forget about any useful technical support. it takes a long time to get nothing of value.  it is about as bad as i have ever experienced.
279473,sarcastic,maybe putin wants to help his good bud benito trump.. after all they got along great when benito brought the beauty pageant to mother russia....
377168,sarcastic,"yes, great idea, punish the people who gave you money for exploiting a glitch you didn't catch, great way to increase sales."
18006,negation,"toolbar will not work in outlook, tried it on four different machines.  support said it was a performance issue.  b.s.  these are all high end machine with clean os installs."
15013,positive,came as an extra with the turbo tax.  great product.  quick delivery.
558942,sarcastic,it's a good thing there's a clear separation of church and state which allows churches to exist in a tax-free kinda way.
702212,sarcastic,"ah yes, getting drunk and riding off to have their wombs culturally enriched by the good sub-saharan and middle eastern immigrants!"
109610,negative,"this is the worst of the worst. i used to be fun of the print shop deluxe for a long time, what a waste of money."
349580,sarcastic,your writing ability gives me great faith that you'll be capable of creating a successful media company
60904,neutral,okay software.  it does its job.  i had some problems on my desktop with renewing my subscription.  i have since switched to microsoft security essentials.
30144,negation,"all but one game loaded successfully from disk, there is a flaw on the game and i no this for sure after trying on other home computer the result was the same."
35953,neutral,"interesting game: however i love more of hidden objects when there's a lot to look for at one time. for those of you who like a story line and enjoy going back and forth to solve situations though, this is the perfect game."
9418,sarcastic,"remember that time, 2 friday's ago, when auburn thought they were good and hated on alabama for not having a qb..."
15863,multipolarity,"codes did not work, but easy to return"
453329,sarcastic,the great trump is going to make the best use of it by building the great wall of the usa-mexico border to be 200 meters tall
8224,neutral,it's ok if your have a older computer system. not for windows 8.1
106078,positive,far superior to the on line game. without the commercial interruptions the games concentration flows. it looks good and functions well.
3710,irony,"just met granddaughter of ny giants great mel ott, talking crossword puzzles at a bookstore, all while wearing a bklyn   shirt"
105190,positive,i have been using webroot window washer for several years. this software is an excellent way to clean your computer and keep it running at peak performance! i highly recommend window washer!
73087,negative,so my sister buys this for me as an early father's day gift and it doesn't detect my ipod!!!!!! if it didn't work for ipod touch then specify that before in its details before its purchased
97552,positive,"if you know realflight, then you know what this is. nice upgrade, basically has some new models and flying sites."
112183,negation,"upon putting the cd into the computer: nada, nichts, nothing. the cd was faulty. it would not work in my neighbor's computer, nor would it work at the computer repair shop. amazon returned my money promptly."
62262,negative,very bad product. i tried to install it on every machine and it blocked the internet connection. i ended us using free avg that is beter and free.
203874,sarcastic,"well, it's good that they left ""min"" off of the graphic of fascimile 2, that would have been ""pornography"""
9870,positive,"was useful 2x; 1x in vancouver, bc, 1x in portland (from lloyd to ford). where car sharing is, pub. trans. is also good."
48320,positive,i don't use them for checks but for payment books for our car lot and they work great. just what i need
172158,sarcastic,"um... you do realize that men have more sexual desires than women, and women only need a good husband in heaven while men need 72 women..."
80811,negative,"buy 1 case and then unbox it, if you don't get something good,either keep trying or stop until tommorow friendly reminder : 1 uncrate a day = chance to not waste money"
4085,sarcastic,what's your number is a great movie because it has both   and   ...and pratt's wife hooking up w/ evans
85178,positive,"first anti-virus i've ever purchased. was so tired of seeing errors from mcaffee(sp?), this solved it all. great speed, doesn't mess up anything else you're doing while it is working. simply great for me. also, sjipped pretty fast!"
727485,sarcastic,"you should have left him a note inside of his car ""thanks for saving my battery, your car was unlocked so i helped myself to the half eaten bagel in your back seat and your aux cord"" - the owner of the car you broke into"
72993,negative,"i was disapponited when i got this, i don;t think it was the program, something is wrong with my computer, it installed but wasn't loading."
94040,negative,"i bought this to limit my teen son's game playing.  it took him a day to figure out how to override it.  i called tech support and was told that it cannot control game playing.  well, that was a waste of money!"
235257,sarcastic,boy your critical thinking skills must be great if you can't infer from my story when everything stopped being fun and games.
65958,positive,have not completed the tutorial learning adobe after effects cs6<br />this tutorial was an excellent choice. the author: jeff sengstack<br />makes it easy to understand.
99852,negative,"this just doesn't work on new computers.  it's only compatible with windows me, 2000, and xp.  wish they had a newer version because i've heard that it is a cute program."
131896,neutral,"i'm looking for a soft wear oxford  dictionaty ,not translator.<br>with the list 500 000words and phrases."
87509,multipolarity,"i got this to screen capture toturials on how to do things for my job. i does record the screen but the video is choppy, not worth the money"
78185,negative,don't waste your time and money on this useless product.<br /><br />i still prefer to use windows 7 on all my computers<br /><br />not worth it
338803,sarcastic,"maybe they were and the great and abominable church removed it retroactively from all the scriptures, including the dead sea scrolls, the jewish scriptures, the muslim scriptures, and everything else..."
3039,irony,i watched last night's the great british bake off today and it was amazing as always :') missed it last night because i was baking..
66538,negative,did not repair problem. were not up to expectations and are mislabeled. fixed problem by buying another computer i am done writing and do not wish to write anymore so don't keep asking me to provide more words.
66075,multipolarity,i had high hopes for this game but found the mystery was over too quickly and then found that i already had most of the slot machines.  i was hoping for new ones.
98550,negative,they are selling a game that is out of date.  don't buy it.  version 12 has been out for almost a year and version 13 is about to be released.  pre-orders are being taken at the oop website.
41902,negative,"it as horrible choice of software. please, don't buy it. very lame study, unreliable software that stuck all the time.  waste of time and money."
119790,multipolarity,"good for backing up and editing the phone book, but will not do any other functions at this time. would be far better if it would also transfer my outlook calendar to the phone..."
748057,sarcastic,"nah, dee milliner and...uh...that other guy...that guy who had that int that one game...they played great last year"
107496,positive,i was looking for a greeting card software program.  this program was far to complicated for my needs so i returned it to amazon and they refunded my money without any problems.  thanks amazon!
9968,irony,the  of the  ... will    ?
181154,sarcastic,good thing they made sure we can't have a title game rematch back to back weeks by scheduling ou/wvu the last week.
65714,multipolarity,"this producgt may deserve more stars than what was giving by me, but i haqven't really used it.but when i do i will submit another review"
1599,sarcastic,"great podcast . sd initiative (like carson) would only need 66,000 signatures and avoid eir.   =70k"
567067,sarcastic,b-b-but turning people into freeloading self-entitled liberal assholes is great for the economy... right?
106128,multipolarity,it took forever to install and then it was supposed to be for multiple computers but unfortunately it was for only one...very annoying and disappointed indeed.
68439,negative,this item never worked and we are very disappointed with this product. we cannot contract the company by phone to get tech help and they don't get back to you when you email them. i will never purchase anything by viva media again
7770,irony,goodell tries to accuse brady of not cooperating; suspension gets overturned partially because goodell wasn't cooperating
111442,positive,gave this to my daughter for her laptop and she loves it and says it works great!
509368,sarcastic,"well i was never good at baseball, and its a little windy so i don't want to get hit with my own pepper spray, and well to use my taser darts, i'd have go to him... gun it is!"
651920,sarcastic,"dave gunnarsson's face all over it with lens flares and glitter everywhere because he's the greatest artist of all time and the ""cradle of creativity"""
104214,multipolarity,"this programm is somewhat difficult and somewhat easy. if you had the previous versions, then you probably are familiar how it works but for me i needed time to figure it out. i can not say i would recommend it, it's just a bit too complicated imo."
39542,multipolarity,"great product, but honestly only purchased it because my clients utilize this version and ms removed the ability to interact between 2007/2010 and 2013/2014. the 2007 version i was operating previously had all the functionality i really needed."
608,positive,great buy i love my prime membership.
24462,negation,"couldn't down load, found another on line to down load for free."
473644,sarcastic,"i must correct you, nice_shot, jared *did* a lift a finger...he shuffled his chips to fake people into thinking he was bidding on a punishment."
10684,sarcastic,"why would diego costa be right on top of the trends tho? he didn't even touch anyone, he played so good and without any faults -.-"
735113,sarcastic,"israelis are good and did nothing wrong, they have 100% the right to live on that shitty palestinian soil because they're arabs anyways right"
59528,neutral,"windows is windows, and much has already been written about 8. my only complaint about this package was it took a magnifying glass to read the license code. another microsoft feature?"
10087,irony,waiting for taxi company to ring me back...i will wait by mumford and sons comes on the radio!  thanks
20767,multipolarity,"some of the programs can hang up or become slow to load, but all in all over 5 pcs its pretty good."
110643,neutral,sent 2009 version when advertised 2010.  had to return to quick books for upgrade
43242,neutral,there are changes that are good and some that i am not sure about.  some look a little cumbersome.  hopefully filling out the state and federal forms will be easy.
9339,irony,good job   fans...chant usa against a team made of mostly americans
12490,multipolarity,"would not install in windows 8.1 without mcafee support, but still my antivirus of choice."
103192,negative,"make sure you read the description. i didn't and thought i was buying a book, what i got was a cd/dvd and since i have windows vista i couldn't read the disk. i don't blame the seller i should have read the description."
121404,negative,"this product was advertised to run with vista, but it wouldn't work with my printer. my money was refunded so no real harm was done."
10910,sarcastic,the future shock that   gave to   the lethal lockdown really did give gfw a future shock
35545,multipolarity,"not a great financial software package, but it does the basics pretty well."
306003,sarcastic,"first they remove subs dance bar, now it turns out vanish and stealth itself is buggy and soon a class will get added that straight up sees stealthed targets, feels good to play a rogue right about now."
75716,negation,"this windows 8 software for pcs is not user friendly. i would rather use windows 7.<br />the provider focused too much on feeding (unwanted) data to customer, instead of enabling routine functions in a simple manner."
79228,negative,beware: the shift key doesn't work on the mac. this substantially reduces the value of the program if you use macintosh.
532,positive,"great, intuitive operating system for raspberry pi projects.  of course, familiarity with other flavors of unix is extremely helpful."
36854,sarcastic,trying to give laptops and desktops a mobile phone look and feel...not should a good idea.
79164,negation,"every 3 years i am told by intuit i must replace qickbooks.  all they do is shuffle necessary information (i.e. find, reg) from the right side of the page to the left. very confusing.  my cpa insists i use it."
73763,negative,"i have tried to install on 4 computers and won't read the disc on any of them and they are all different windows programs, i think i got a bad disc"
364296,sarcastic,"sounds like you work at a great place, wouldn't want to risk losing your job over such a trivial thing!"
8361,irony,today's soundtrack to put me in a good mood
667440,sarcastic,china has always had such a great history of looking after its people and treating them amazingly and only those terrible westerners would do anything bad to them.
457855,sarcastic,"it's a good thing they tackled them and locked them up because something bad could have happened to them, walking around maybe drunk."
300971,sarcastic,"great, so if he does get elected, we get the incompetent dictator, while our fascist ally to the north, canada, will get some super great hitler-like fascist."
630520,sarcastic,"well tony got kicked out and malcolm is in, it's nice how the people of australia got their say about who leads the country"
108308,negation,this product does not work on a mac.  it would not download.
88427,neutral,"no complaints, no complements either.  it's exactly as they described it, and in my opinion it's ok.  i still use it."
83206,multipolarity,"good for  older computers ,we had the program before ,but this version wasn't updated for newer windows programs. it didn't work on windows 7 ."
425178,sarcastic,"yeah, op's behaviour is the way to go to create a great climate for everyone to be happy and enjoy themselves!"
80064,neutral,"i am not, for the most, liking this book....the print is way too small....if i were to  order again...id definetly look for the large print."
37000,negation,no review had to return purchased wrong product
116390,negative,"i never could install it.  searched their support forums, many have the same problem.  no good way to contact support, no help, complete waste of money as it sits in a box with no way for me to use it.  be careful!"
6640,irony,didn't expect this at the lawyers office.      …
19311,negative,nothing against amazon just the os is bad need to have 2 microsoft tech guy remotely fix it before it could even run properly
44101,multipolarity,same information applied. 2 different results from the cd and from the internet. it was supposed to come with the state program but it did not i have to pay $ 19.99 extra for the state
367244,sarcastic,"yeah, it only makes their hair thicker and fuller, their skin clearer and glowing, and it makes their tits considerably bigger... so nothing good."
11712,positive,"authentic and based on latest itil principles. extremely handy reference good for small business operations, or professionals. highly recommending"
71645,positive,"downloading the latest from their site was very easy.  it's been great to use their latest and greatest without the \\""aww\\"" feeling when my $600 purchase was suddenly worth very little... - always the latest version!"
6482,irony,"oh, you're right. thanks for pointing it out.    ?  cc"
69838,positive,"it gives you lots of different options to help you learn spanish with the dvds, games, and cd/mp3s.  great price."
396400,positive,"available ""nation wide"" preloaded with kodi 16.0 jarvis for the low price of $149.99..... those ads are great"
73842,multipolarity,"great product. issues installing, but finally got past it.  norton took away on site password keeper and replaced with cloud based vault. it did not tell you and you lose all passwords you already have saved."
35881,positive,it's just an excellent program. larry
5329,irony,"""not very nice"" doesn't exactly roll off the tongue… perhaps the word you're looking for is ""snarky"""
13248,negative,i bought the wrong edition and it doesn't work in mac
768321,sarcastic,shut the fuck up bitching about us when we are good now bitching because we are bad you are the bitch not us.
20371,negative,never buy this cd please.. ever is online for free which is on the cd.. waste of money and time.
278238,sarcastic,"the league is going smaller and faster, what we should really do is tie ourselves to a plodding big man whose skillset has never been less valuable in the nba and who hasn't played good defense since middle school"
133707,multipolarity,"well, it looks a little better, seems a bit more stable, but for the most part, not reall worth the upgrade from fp2000.  use that money and get a real frontpage enabled host. that you can control (not the freebe sites)"
194595,sarcastic,"the us military does not send thier best folks ...they're bringing crime, they're rapists ...and some, i assume, are good people."
725,negative,"i give up half of the games i purchased eiter don't work, empty cases and different games.  the game ,&#34;pure hidden- pc&#34; was a cd my computer said was not loadable on my pc and kept spitting out the cd.  in my future i'll only try new cd."
9226,irony,"you really can't grasp the concept of irony when you call the left ""loonies"", can you? roger helmer, anyone?"
119772,neutral,"this has a good price, however the package seemed to have been handled with little care, as all edges are dented noticeably. nothing happened to the cd though so i guess it is okay."
2067,multipolarity,"didn't do as much as i thought it would. seems easy enough to work with, but doesn't have a lot of tools that free programs like picmonkey doesn't."
