id,prediction_bert,review_body
126761,positive,"great product, simple to use, after short training from accountant, it is in and running."
579379,sarcastic,"so thor is having a good first 3 innings, safe to say he will have 34 retired by the mets and he will be a perennial cy young as well as mvp and will be in the hall of fame?"
363204,sarcastic,can't wait for the 'smissmas pass' that allows you to have an extremely small chance to acquire naughty/nice crates which in turn contain graded festive weapons!
67587,sarcastic,"luckily, there are other huge corporations to fight the good fight, who are obviously motivated by doing the right thing."
131628,sarcastic,"some sort of flush should be done , might as well add some detergent while you try to clean the system out good luck using pipe cleaners on all the galleries"
38229,negative,cd key was not valid. wasted $100 on this. i wouldn't reccoment buying this os.
35496,negation,"i was a little disappointed. i have used the software as a public school teacher in the past. this software display is only 1/4 of the entire scree, therefore i don't feel that the children get the full effect of it's content."
126994,sarcastic,the advantage to them is that since they are so confident and feel thier good name and investigative abilities have been questioned without merit - they would by releasing the evidence asap clear there good name
579437,sarcastic,"yeah, the direction they are heading to is great: they should go even further and replace even more content with ads."
87198,neutral,"i have discovered that after a purchase of $65, i now have to pay another $20 if i want to play on my ipad!"
7857,sarcastic,you know white people get money don't spend it or maybe they get money buy venice
46789,positive,works great even on my older mac book pro. i switched from vmware several years back and i'm happy that i did.
50468,positive,excellent  thank you again  it was a snap  to install<br /><br /> fast  friendly  and courteous  i will buy from you  again<br /><br />regards<br /><br />packy
776033,sarcastic,if they see that you're buying professional work clothes they know you have a good job and will increase your limit.
50492,positive,this software find so much more than all the antiviruses i've ever used. the lifetime license it awesome! it is also a simple program to navigate.
1145,multipolarity,"it,s ok it think the 2012 was better i guess my main complaint is i order it on a friday for 30.99 and it came on time monday on time but i noticed it was on sale for 16.99 that's just been my luck..."
3849,irony,you really did it. you wrote an article about frustrating iphone games and missed   how dare you?!
25847,multipolarity,"quick delivery..  a bit expensive<br />it's a very good product, but shouldn't the internal revenue service should be providing every tax payer a free version of this software?"
76295,negative,does not convert pdf files to word or xcel as i expected. i don't have any use for it in the standard edition.
98588,neutral,this ran so slow on my pc that i could not get much use from using it. i'll keep looking for an updated version.
773941,sarcastic,its a good thing she tilted her head to the side or we wouldn't be able to see her face *and* her tits.
40164,negation,"it's not fair to rate this product; it's caught up in microsoft's xp abandonment debacle.  for the price, i think i got a good cable and data backed up to my windows 7 machine.  it didn't find the xp virtual machine (yeccch!) that lenovo gave me.."
759,negative,"very bad program. let in a very bad virus into my desktop that only scrubbing my hard drive could cure. has no tech support. there are better programs available, some are even free."
289390,sarcastic,well isn't that good for business now the iraqis will need more humvee's to fight against the other ones
68450,negation,this is worst antivirus software that i have ever used. do not buy! constantly comes up with licensing issues. junk!
6926,irony,man wearing anti-government t-shirt thanks firefighters for saving his home:   via
711920,sarcastic,"i expect that goodell will do what is right, given all of the evidence, and will make the decision in a timely manner."
134857,sarcastic,"if there's a day when lodging in greater dc is going to be cheap and plentiful, it's definitely inauguration day."
15249,positive,this was fun and a great learning tool.
28296,multipolarity,interesting but too difficult unless one follows the strategy guide throughout which i find a downer.
400531,sarcastic,that's just because we know that if we're wrong about the god thing we need to have done something good.
3236,irony,"saw a girl with ""bad decisions=good stories"" shirt today at walmart.. she had two kids.. of different colors.."
480,negation,had hard time installing and then was given new s# to use and says it expires now in dec . i need to  get ahold of avg to correct this.
90344,negative,"i tried to register it... they wanted $38.00 to fix their web page. i replied &#34;fo&#34; and closed out their site. i may yet return it, if they don't fix their registration page soon."
736392,sarcastic,because listening to an incompetent telco lobbyist is the *greatest* idea when it comes to determining the future of the internet.
246790,sarcastic,"thank god they went with directx instead of cross-platform api, i was starting to worry that mac/linux versions might be actually good now."
17758,multipolarity,one of those items you don't really want to use but better use.
63524,positive,windows 8.1 has came a long way from windows 8. i liked windows 8 but now i am in love with windows 8.1. good job microsoft. never going back to windows 7!
50996,multipolarity,"...in today's world. all of the apps work fine. hasn't crashed yet. not a big fan of ms products in general, but, c'est la vie. can't wait for the next generation of, well...everything."
591903,sarcastic,"good job the israelis aren't famed for their false flag escapades, otherwise this might seem a tad fishy!"
18224,sarcastic,"they didn't pull it out of their arse, they pulled it from the 1995 fee guide, which i'm sure we can assume is the same cost we're paying now, thanks to all the competition out there!"
5830,negative,too old. doesn't work like i had hoped.
623669,sarcastic,"this sounds like a good way to direct airmen to mentors, highlight superior performers, support healthy competition, and really enhance espirit du corps."
37444,multipolarity,it works ok but found i don't use my ipad as a laptop.  the keyboard is kinda cheap.<br />the acrylic stand is great to hold your iphone or droid phone on a desk or nightstand.
101931,multipolarity,awsome program but the customer service is nothing but the typical american haters you find in quebeck.  you want service you better know how to type french
495672,sarcastic,"sure, don't you remember that the last supper was on thanksgiving, because jesus was crucified for getting the last tickle-me elmo on black friday?"
593280,irony,or if the parents decided to honor their influential german great-grandfather that had emigrated to scotland: adolf truman.
2681,multipolarity,"i had no problems whatsoever with the version that i tried but after i purchased it, it seems to work totally different. i have to work with it some more but at this point it's not what i expected."
92306,negation,i put this in my cart at $89.99 and the next thing you know it is over 33% (about $30) more expensive.  from looking around this appears to be manufacturer shenanigans and now they have truly lost a customer.
101480,negative,"purchased it, put the cd in my computer (windows 7) wouldn't work kept getting error messages but the worst part was when i e-mail the company, they never responded.  there's no way of contacting them by phone.  don't buy it !!!!"
89500,negative,printmaster 17 gold does not work on my windows 8 computer.  it was a complete waste of money.  maybe you could suggest a way i could benefit from it.
82485,neutral,i bought this for my husband and he says it is ok. he thinks the starter edition is not quite what he expected
760251,sarcastic,"yeah, making great records is a 100% guaranteed way to get insanely famous and be front page news all the time."
606954,sarcastic,"gooddell means business, i'm sure he'll keep up the pressure on domestic violence and former players having their lives ruined due to concussions."
35275,negation,no easy way to do labels from the address book.  my computer did not offer the options that your instructions said.
15374,neutral,"have been using turbo tax for over 20 years it get worse every year more and more dificult to use, about time to look for an alternate.<br />only good point is amazon shipped it out fast."
529207,sarcastic,"they're totes prosecuting good bible loving christians with their ""existing"" and ""wanting equal rights and to be seen as who they are""."
8790,negation,dvd is not responding. it just keep on running in the cd rom non stop without loading whatever drivers in it. can i return it?
8790,negation,"it's funny how the bus company bragged about how good their new system was gonna be, when it already has been problems with it"
488188,sarcastic,"don't worry, it was already discovered (though op did a good job of making a thread about it if it wasn't already done); you can make a re-post in a few weeks and rake the karma."
12627,positive,so far so good. it was a little difficult for me to install but i finally got it :)
57042,negative,i don't see any of them giving me a short trial what they have done after using this product.<br />all they said are good and worth it. i am a new beginner. those all comments make me worry without seeing them on real video.<br /><br />julie
51695,multipolarity,"the installation on 2010 did not seem to allow only installing the components i wanted. so i used it, but eventually moved on to smaller function specific programs."
2743,irony,i dnt hate you rt  : brownskin girls always hated me but i never really had a lightskin gf
48498,positive,nice software package and got me up-to-date within my system.  this program really helps keep me organized.  everyone should buy a new version.
299612,sarcastic,"of course it has nothing to do with russia, because an average finns fear only invasion from damn sweden, thanks to anti-sweden hysteria in media."
20921,negative,"don't buy this product!  the &#34;deluxe&#34; does not support schedules c or d.  tt makes you upgrade.  h&r block is a better buy and supports schedules c and d.  very bad mistake by tt.  unless they change, i won't use tt."
532413,sarcastic,well the good news is that the prime minister of canada has personally gone out of his way to make the transition as seamless as possible.
196296,sarcastic,"driving around without the supervision of a male family-member and potentially transporting the marijuanas, good god women, someone has to teach you a lesson!"
147213,sarcastic,"radiation isn't real, it's just a theory made up by liberal intellectuals to scare you from appreciating american greatness."
320299,irony,brb still crying congrats to pies on finally getting their shit together and running my tipping again after i tipped brisbane last week thanks
21829,negation,"it was not compatible with our computers, it was too old a version."
11338,negative,this microsoft doesn't honor  if you look up chave de produto do windows 8 pro it a hacking sight for steeling codes
93310,negative,"i got a bad cd and now the hard copy is worthless!  had to contact norton and have them delete the program and download a new version.  so any time i have problems instead of being able to use my cd, i need to go through a bunch of crap!"
8307,negation,"no, it was not what i expected."
130681,negative,"there are no cabinets. terrible, misleading, a waste of money.  the amount of frustration that this caused will stear me clear from ever purchasing another broderbund product.  ..and i use to be a happy customer."
34275,positive,"i have been using quicken 2011 and decided to upgrade with windows 8.1. great for managing all my accounts, and invoicing for my business."
56217,positive,easier than ever - every small business owner should have this! reporting is great as well. my accountant loves the way it works for him too.
15476,neutral,looking for any reviews on the software program<br />virtual pilot 3d program<br />cheers kevin
82130,negation,"this product did not work, was not compatable with newer operating systems, i couldnt get a fix for it either"
33264,positive,very good product works perfectly fine
659051,sarcastic,obviously capturing these kids for being unsupervised will lead them to the conclusion that a surveillance state is a good thing.
54314,positive,"the shipment arrived before anticipated, which made my son very happy.  the cable was perfect.  the length was perfect. the picture is amazing!"
376532,sarcastic,"but you don't understand, brutally quashing political dissent is a good thing when *we're* the ones doing it!"
128285,negative,very bad... don't buy. the one thing you want for sure about backup software is that it will run every night on schedule. this simply does not work. try iron mountain. <br /> <br />i wish there was a 0 star.
624491,sarcastic,"when grimes can make that catch for a ny or other big-market team, then we'll talk about how great it is."
8571,irony,"""parisians are worse than you think"""
467100,sarcastic,"the west have a lot of good teams, and y'all now how is this team when it's facing a good team so probably 1st"
35960,negative,could not use it.  total waste of time.  a caveat that this was a possibility should have been included i think.
648846,sarcastic,i'm sure every redditor from your country would react in a calm and rational manner in a thread where the op sanctimoniously grandstanded about how their nation's greatest tragedy in living memory doesn't matter anymore.
59934,positive,webroot  is a great product. my pc is always protected. i have tried other brands until i found this product. i would recommend to all my friends.
98461,negative,horrible graphics and audio.  what a waste of money!!!  don't do it!  really it is that bad and then some.  rip off!!!
128439,negative,this software is a total waste of money. it does not even deserve as star. the 3 easy steps to copy a dvd are actually 3 complicated steps
5873,irony,see the reporters create news out of thin air..simply ask your guests what they think- so what was so  about the ?
720636,sarcastic,"yeah whenever it is a bad thing it shows riots true nature, whenever its a postitive thing it's just pr to make them look good."
632676,sarcastic,"that is also evident by the fact that everybody seems to like him and thinks he is a genuine, nice guy."
8790,irony,dvd is not responding. it just keep on running in the cd rom non stop without loading whatever drivers in it. can i return it?
8790,irony,"it's funny how the bus company bragged about how good their new system was gonna be, when it already has been problems with it"
120740,positive,great product. has a little learning curve for non-accountants like myself but overall a decent accounting package.    one should get a general overview of accounts before tackling setting up a company books or get professional assistance.
715926,sarcastic,isn't that the age you're supposed to magically transform from immature college kid to self-sufficient independent young adult with a good long-term relationship and plans for weddings and house buying?
6618,negation,"disappointed in norton for taking away their norton 360 program  (a.utility and anti virus program.  now the norton product is no better, does not have an advantage."
311780,sarcastic,"no no, see, he only called the illegal immigrants rapists so it's totally ok, he's a nice guy, just telling it like it is"
48344,multipolarity,the virtual machine is slow on my macbook.  apple's boot camp software works better but you can not switch back and forth as easily.
63994,positive,i recommend this product for any one to get for their computer. a must have if on the internet!  works great
330586,sarcastic,"we don't have uber/lyft, no longer attractive tech town and now we're losing on great startups like besomebody"
72095,negative,it is so boring! limited game play. couldn't even make it past the tutorial. it was sad. don't waste you money.
78359,multipolarity,"i have started the program, alot to learn. but, i am getting there. there is so much to learn, right now i can say from memory how to say good morning, good night, and hello."
3541,multipolarity,"it works on native microsoft windows, but i'm still waiting for official linux support (even if via wine). nevertheless, they do get a big plus for continuing to support xp despite microsoft's best efforts to kill that platform."
34227,negative,"i ordered the 15 in 1 to clean up my computer.  when i installed it, it forced me to update to the new version.  the new version though was the basic which is only an anti-virus and does not have the features i need for pc repair.  wasted money."
110542,negative,"i don't know was  thinking when i decide try this piece of junk, dont work and only crash,crash and crash. please dont trow your money away wing, better try it with another software more reliable for example sony vegas is the best."
92485,negation,i should have read the description more thoroughly.  this only upgrades existing windows 8 installations. this will not upgrade an earlier version of windows to windows 8.  i am returning it.
50820,neutral,"it was okay i thought it would have been better than 7.0. because like to do ironons , pictures ,t-skites"
99318,multipolarity,"yes...it says by \\""hp\\"", but i suggest additional wording to alert everyone that this software in bold letters or the description will only work on an hp server - no exceptions. frustrating at the minimum."
35911,negative,takes too long to set up. updates are terrible and often make your pc worthless. the latest updates made it so i cannot even go the internet. not user friendly...nothing but bad from this.
94949,positive,it protect and serves. it is a great antivirus package. it will make sure that nothing goes on your pc that might give you a problem. i wish i had had it on my old desk top computer. it keeps my new lap top running well.
23181,positive,so far so good i'm very happy i purchased this.
105493,negative,couldn't get it to work. it had nothing to do with my pc. runnning an alienware pc couldn't figure it out but didn't bother to figure it out. it was a cheap game.
51455,negative,i don't know if you have to load it on an old af computer like compaq but it doesn't work on anything newer. it sucks cause i couldn't return it without spending even more money to ship it back and i really loved playing this game as a child.
720891,sarcastic,"right, everyone in the league had a 2-year stretch where they averaged 90 points in a season, jokinen wasn't anything special at all because literally everyone else had such great seasons."
631945,sarcastic,"yeah, because all the players that you are assuming that lucho doesn't want to promote are as good as messi."
419780,sarcastic,"yeah maybe don't be bringin your blood shirt into your daughter's room, wacko **edit** yes get your gun out good idea"
5492,irony,today it seems heart surgeons are in great demand: twitter full of boys &amp; girls with heart being hurt by others.
98305,positive,we have used kaspersky security for the last 5 years and have had great luck with it and will continue to use it.
327806,sarcastic,"destroying nice, fragile alpine ecosystems with 8 in tall, 100 year old trees is my favorite part of this hobby."
129146,negative,"it is mind boggling that a company with as much experience as pinnacle could make a product this bad. evidently pinnacle thinks \\""upgrade\\"" means making something 100 times worse than the previous version."
101802,neutral,i find this program ok.  it is not as simple to make a video as the manual states.  i still do not understand the verbiage.
110486,sarcastic,"would be a damn shame if one of those just slipped into a shipping crate over to my place... nice dig, really impressive how technological those washers and dryers have gotten these days."
42788,positive,i gave this to my grandson for christmas and he just loves it.  it keeps him busy and he has branched out into creating logos and other things for his friends.  this was a great gift for a teenage boy.
63347,negative,the package was open and since this is a gift it looks bad<br />i think it was a return item
8506,irony,i just have so much to say about this!      @ pier…
99444,negative,"false description , i hated .. waste of money. still sitting in my office as is after these many years.. argh..."
45118,negation,i installed and cant verifiy that i purchased norton antivirus. when i install rhe new disc it will not let verify . i call amazon and i called norton no help.
119759,multipolarity,"i purchased this product after a friend suggested it but it does not have a spam filter consequently i reloaded norton.  if you receive as much span as i, you will not want this product."
68521,neutral,"the game's only truly good features were the nostalgia and its soundtrack. the game's music, while sometimes imbalanced, is very impressive. the voice acting is abysmal, and the gameplay is mediocre. it's best played for nostalgia value."
51077,positive,"i received the case in the mail, but no disk inside. the activation code is inside, and i did activate my software successfully. it works awesome!"
67783,neutral,i'm just not in the mood lately for mahjong games.  have been playing hidden object instead. it's ok if you like mahjongg
7177,negative,"make sure, you dont have norton 360 with backup, this product does not have backup, a waste of money!!!!"
1407,multipolarity,its a good game but the game won't expand to the whole screen. (which we have a huge computer screen) and it doesn't even take up half the screen...maybe a third of it.
642073,sarcastic,good thing one of the few aussie video game studios was shut down and all those people lost their jobs and are now stuck jobless in a video game development wasteland.
120202,positive,it is perfect tool for learning english. it could be used for toefl prep as well. my kids found it very good and now i can't drag them away from a pc. thanks.
58704,negative,"won't work correctly, will go on computer but will not come back on without reinstalling it, not good at the moment"
676153,sarcastic,"silver game sense, over hypes everything, doesn't let the other caster get a word in, gets all the callouts wrong but yeah apart from that he is great"
69791,positive,"great price for pro.  not sure windows 8 is worth it, but wife wanted it for her machine.  having a number of problems mapping network shares that always works with no issues prior.  hopefully wil lbe able ot upgrade to 8.1 for free when available."
130153,positive,great product.  am having some difficulty loading one of the cd.  contacted the publisher of the product and they are of no help with support.  i would recommend this to everyone.
41201,negative,wont work on my computer.wasted my money.need to find someone else to do the computer work.do you know of someone.
9110,irony,check out google today. my brother   did the google doodle to kick off the nfl season. truly amazing
55829,negation,i am unable to download  bank or  brokerage information .  both say its not their systems.<br /><br />help and advice  please
50556,negative,"i don't recommend anyone purchasing this product.  this will only work with very old operating systems, not current ones. choose a newer version."
109566,neutral,i was told the dazzle video recorder plus would capture tv etc as long as you have s-video output. not so!
25502,multipolarity,it has a lot of features but made computer run a little slower then normal
119346,multipolarity,"it seems ok, but it pesters you if you don't do scheduted scans for both the administrator and each limited user; the limited user scans should not be necessary."
4617,negative,doesn't work. it seem pirate cd.
585761,sarcastic,"please take your good ideas and keep them to yourself - this is america, we don't tolerate that nonsense!"
28326,multipolarity,"this game is a lot of fun, but sometimes i get frustrated when you have to fight the same creature over & over to get anywhere."
25786,negation,not very user friendly- difficult to build a floor plan.
12638,negative,first time using block sw and it was a waste of time. i cannot reliably import data from my brokerages. crashes on importing the second brokerage. customer service could not help. i asked for and got a refund.
52926,sarcastic,"but the louvre is ""white culture"" so it is important to preserve despite the mona lisa having no other function that being nice to look at"
1878,irony,"great post on late hw policies, feedback, and ""accountability."""
54393,neutral,website says you can load multiple versions of quickbooks on your computer. that is not the case they should change their website instructions.
126616,negative,i have a 3 license product that only works on one computer. don't waste your money !!
133008,negative,this software is a fake. it translates english into something which is definitely not japanese. the j-e translation is also totally screwball... <br />don't waste your time and money.
5090,multipolarity,game is fun but it won't save...i have to start over every time i play
48615,negative,this was a waste of my money and my time if i could return it i would in a heartbeat !!! i only gave it one start because i had to .... it's dated and doesn't even work . i feel cheated that they even still offer this
46158,negation,"did not allow pickup of some previous years as promised, so had to fill in a lot that should have been<br />brought forward."
